AssignmentId,WorkerId,HITId,AssignmentStatus,AutoApprovalTime,ApprovalTime,AcceptTime,SubmitTime,Answer,response101,response102,response103,response104,response105,response11,response12,response13,response14,response15,response21,response22,response23,response24,response25,response31,response32,response33,response34,response35,response41,response42,response43,response44,response45,response51,response52,response53,response54,response55,response61,response62,response63,response64,response65,response71,response72,response73,response74,response75,response81,response82,response83,response84,response85,response91,response92,response93,response94,response95
35GCEFQ6I6M92L8B50CAUUQEAKZZ33,AXO3OQJDHKRR3,3FDWKV9VCN0RFOOIFSDGKIPJATOUM4,Submitted,2019-06-15 18:00:05-04:00,NA,2019-06-13 17:51:55-04:00,2019-06-13 18:00:05-04:00,"<?xml version=""1.0"" encoding=""ASCII""?><QuestionFormAnswers xmlns=""http://mechanicalturk.amazonaws.com/AWSMechanicalTurkDataSchemas/2005-10-01/QuestionFormAnswers.xsd""><Answer><QuestionIdentifier>response101</QuestionIdentifier><FreeText>Let's be careful out there!</FreeText></Answer><Answer><QuestionIdentifier>response102</QuestionIdentifier><FreeText>At least we were able to find it!</FreeText></Answer><Answer><QuestionIdentifier>response11</QuestionIdentifier><FreeText>Let me explain...</FreeText></Answer><Answer><QuestionIdentifier>response12</QuestionIdentifier><FreeText>I'll tell you what happened when the crisis is over!</FreeText></Answer><Answer><QuestionIdentifier>response21</QuestionIdentifier><FreeText>I think you owe me that much</FreeText></Answer><Answer><QuestionIdentifier>response22</QuestionIdentifier><FreeText>I deserve to be heard!</FreeText></Answer><Answer><QuestionIdentifier>response31</QuestionIdentifier><FreeText>I've come to finish this thing!</FreeText></Answer><Answer><QuestionIdentifier>response32</QuestionIdentifier><FreeText>To eliminate all miscommunication.</FreeText></Answer><Answer><QuestionIdentifier>response41</QuestionIdentifier><FreeText>We will get there as soon as we can</FreeText></Answer><Answer><QuestionIdentifier>response42</QuestionIdentifier><FreeText>We will get there when we get there!</FreeText></Answer><Answer><QuestionIdentifier>response51</QuestionIdentifier><FreeText>Get me a tissue or something!</FreeText></Answer><Answer><QuestionIdentifier>response52</QuestionIdentifier><FreeText>Can I use your belt as a tourniquet?</FreeText></Answer><Answer><QuestionIdentifier>response61</QuestionIdentifier><FreeText>It was a wrong number</FreeText></Answer><Answer><QuestionIdentifier>response62</QuestionIdentifier><FreeText>I can't discuss this right now</FreeText></Answer><Answer><QuestionIdentifier>response71</QuestionIdentifier><FreeText>You should take up a better hobby!</FreeText></Answer><Answer><QuestionIdentifier>response72</QuestionIdentifier><FreeText>You might lose count fairly quickly.</FreeText></Answer><Answer><QuestionIdentifier>response81</QuestionIdentifier><FreeText>The worst of the worst!</FreeText></Answer><Answer><QuestionIdentifier>response82</QuestionIdentifier><FreeText>We must defeat evil at all costs!</FreeText></Answer><Answer><QuestionIdentifier>response91</QuestionIdentifier><FreeText>It's new information to me!</FreeText></Answer><Answer><QuestionIdentifier>response92</QuestionIdentifier><FreeText>You gotta love dogs!</FreeText></Answer></QuestionFormAnswers>",Let's be careful out there!,At least we were able to find it!,NA,NA,NA,Let me explain...,I'll tell you what happened when the crisis is over!,NA,NA,NA,I think you owe me that much,I deserve to be heard!,NA,NA,NA,I've come to finish this thing!,To eliminate all miscommunication.,NA,NA,NA,We will get there as soon as we can,We will get there when we get there!,NA,NA,NA,Get me a tissue or something!,Can I use your belt as a tourniquet?,NA,NA,NA,It was a wrong number,I can't discuss this right now,NA,NA,NA,You should take up a better hobby!,You might lose count fairly quickly.,NA,NA,NA,The worst of the worst!,We must defeat evil at all costs!,NA,NA,NA,It's new information to me!,You gotta love dogs!,NA,NA,NA
3BWI6RSP7H7TS9I2BP1NM11CRHAE7H,A1STHU52FY0M6Q,3FDWKV9VCN0RFOOIFSDGKIPJATOUM4,Submitted,2019-06-15 20:40:25-04:00,NA,2019-06-13 20:31:33-04:00,2019-06-13 20:40:25-04:00,"<?xml version=""1.0"" encoding=""ASCII""?><QuestionFormAnswers xmlns=""http://mechanicalturk.amazonaws.com/AWSMechanicalTurkDataSchemas/2005-10-01/QuestionFormAnswers.xsd""><Answer><QuestionIdentifier>response101</QuestionIdentifier><FreeText>yeah theres nothing here now.</FreeText></Answer><Answer><QuestionIdentifier>response102</QuestionIdentifier><FreeText>its hard to see.</FreeText></Answer><Answer><QuestionIdentifier>response11</QuestionIdentifier><FreeText>i dont know. we will see.</FreeText></Answer><Answer><QuestionIdentifier>response12</QuestionIdentifier><FreeText>it turned out to be bad ones.</FreeText></Answer><Answer><QuestionIdentifier>response21</QuestionIdentifier><FreeText>you see? you never listen.</FreeText></Answer><Answer><QuestionIdentifier>response22</QuestionIdentifier><FreeText>they want to arrest me.</FreeText></Answer><Answer><QuestionIdentifier>response31</QuestionIdentifier><FreeText>u should have nothing on you.</FreeText></Answer><Answer><QuestionIdentifier>response32</QuestionIdentifier><FreeText>i hope you dont make this difficult.</FreeText></Answer><Answer><QuestionIdentifier>response41</QuestionIdentifier><FreeText>we will be there soon.</FreeText></Answer><Answer><QuestionIdentifier>response42</QuestionIdentifier><FreeText>we are almost there, relax.</FreeText></Answer><Answer><QuestionIdentifier>response51</QuestionIdentifier><FreeText>oh my god!</FreeText></Answer><Answer><QuestionIdentifier>response52</QuestionIdentifier><FreeText>hmm, ill clean it off.</FreeText></Answer><Answer><QuestionIdentifier>response61</QuestionIdentifier><FreeText>what does he want?</FreeText></Answer><Answer><QuestionIdentifier>response62</QuestionIdentifier><FreeText>is it a debt collector?</FreeText></Answer><Answer><QuestionIdentifier>response71</QuestionIdentifier><FreeText>you will count forever.</FreeText></Answer><Answer><QuestionIdentifier>response72</QuestionIdentifier><FreeText>i dont have grey hairs!</FreeText></Answer><Answer><QuestionIdentifier>response81</QuestionIdentifier><FreeText>wolf.</FreeText></Answer><Answer><QuestionIdentifier>response82</QuestionIdentifier><FreeText>storm</FreeText></Answer><Answer><QuestionIdentifier>response91</QuestionIdentifier><FreeText>its crazy isnt it?</FreeText></Answer><Answer><QuestionIdentifier>response92</QuestionIdentifier><FreeText>i feel bad.</FreeText></Answer></QuestionFormAnswers>",yeah theres nothing here now.,its hard to see.,NA,NA,NA,i dont know. we will see.,it turned out to be bad ones.,NA,NA,NA,you see? you never listen.,they want to arrest me.,NA,NA,NA,u should have nothing on you.,i hope you dont make this difficult.,NA,NA,NA,we will be there soon.,"we are almost there, relax.",NA,NA,NA,oh my god!,"hmm, ill clean it off.",NA,NA,NA,what does he want?,is it a debt collector?,NA,NA,NA,you will count forever.,i dont have grey hairs!,NA,NA,NA,wolf.,storm,NA,NA,NA,its crazy isnt it?,i feel bad.,NA,NA,NA
3TMFV4NEP9CR9N9C6UNZM7479658W0,A1LR71IS0QHPK3,3FDWKV9VCN0RFOOIFSDGKIPJATOUM4,Submitted,2019-06-15 23:08:20-04:00,NA,2019-06-13 23:00:44-04:00,2019-06-13 23:08:20-04:00,"<?xml version=""1.0"" encoding=""ASCII""?><QuestionFormAnswers xmlns=""http://mechanicalturk.amazonaws.com/AWSMechanicalTurkDataSchemas/2005-10-01/QuestionFormAnswers.xsd""><Answer><QuestionIdentifier>response101</QuestionIdentifier><FreeText>We'll have to find another clue.</FreeText></Answer><Answer><QuestionIdentifier>response102</QuestionIdentifier><FreeText>We can still use this to find our way.</FreeText></Answer><Answer><QuestionIdentifier>response103</QuestionIdentifier><FreeText>I'm not going to let that stop us.</FreeText></Answer><Answer><QuestionIdentifier>response104</QuestionIdentifier><FreeText>But someone has definitely been down here.</FreeText></Answer><Answer><QuestionIdentifier>response105</QuestionIdentifier><FreeText>This won't stop me.</FreeText></Answer><Answer><QuestionIdentifier>response11</QuestionIdentifier><FreeText>That's none of your concern.</FreeText></Answer><Answer><QuestionIdentifier>response12</QuestionIdentifier><FreeText>Something that shouldn't be spoken of.</FreeText></Answer><Answer><QuestionIdentifier>response13</QuestionIdentifier><FreeText>Someone got hurt.</FreeText></Answer><Answer><QuestionIdentifier>response14</QuestionIdentifier><FreeText>A secret that I want to keep.</FreeText></Answer><Answer><QuestionIdentifier>response15</QuestionIdentifier><FreeText>Nevermind, just help me.</FreeText></Answer><Answer><QuestionIdentifier>response21</QuestionIdentifier><FreeText>I think we should break up.</FreeText></Answer><Answer><QuestionIdentifier>response22</QuestionIdentifier><FreeText>We have to work together.</FreeText></Answer><Answer><QuestionIdentifier>response23</QuestionIdentifier><FreeText>I want to go somewhere special with you.</FreeText></Answer><Answer><QuestionIdentifier>response24</QuestionIdentifier><FreeText>I like you, and I always have.</FreeText></Answer><Answer><QuestionIdentifier>response25</QuestionIdentifier><FreeText>You mean so much to me.</FreeText></Answer><Answer><QuestionIdentifier>response31</QuestionIdentifier><FreeText>To help you, now that you need it.</FreeText></Answer><Answer><QuestionIdentifier>response32</QuestionIdentifier><FreeText>To see if you'll hear me out.</FreeText></Answer><Answer><QuestionIdentifier>response33</QuestionIdentifier><FreeText>To stop you, not to hurt you.</FreeText></Answer><Answer><QuestionIdentifier>response34</QuestionIdentifier><FreeText>To give you what you want.</FreeText></Answer><Answer><QuestionIdentifier>response35</QuestionIdentifier><FreeText>To do whatever it takes to make you go away.</FreeText></Answer><Answer><QuestionIdentifier>response41</QuestionIdentifier><FreeText>I can be there in ten.</FreeText></Answer><Answer><QuestionIdentifier>response42</QuestionIdentifier><FreeText>I can't be there any faster.</FreeText></Answer><Answer><QuestionIdentifier>response43</QuestionIdentifier><FreeText>I'm sorry, but traffic is terrible.</FreeText></Answer><Answer><QuestionIdentifier>response44</QuestionIdentifier><FreeText>It's not my fault.</FreeText></Answer><Answer><QuestionIdentifier>response45</QuestionIdentifier><FreeText>I should've left earlier.</FreeText></Answer><Answer><QuestionIdentifier>response51</QuestionIdentifier><FreeText>Oh, it's nothing.</FreeText></Answer><Answer><QuestionIdentifier>response52</QuestionIdentifier><FreeText>Can you get me something to stop the bleeding?</FreeText></Answer><Answer><QuestionIdentifier>response53</QuestionIdentifier><FreeText>Please, call an ambulance.</FreeText></Answer><Answer><QuestionIdentifier>response54</QuestionIdentifier><FreeText>I've been through worse.</FreeText></Answer><Answer><QuestionIdentifier>response55</QuestionIdentifier><FreeText>That doesn't matter now.</FreeText></Answer><Answer><QuestionIdentifier>response61</QuestionIdentifier><FreeText>Well, who is that?</FreeText></Answer><Answer><QuestionIdentifier>response62</QuestionIdentifier><FreeText>He's a stranger.</FreeText></Answer><Answer><QuestionIdentifier>response63</QuestionIdentifier><FreeText>I've never met him before in my life.</FreeText></Answer><Answer><QuestionIdentifier>response64</QuestionIdentifier><FreeText>I dont trust him.</FreeText></Answer><Answer><QuestionIdentifier>response65</QuestionIdentifier><FreeText>Do you know his name?</FreeText></Answer><Answer><QuestionIdentifier>response71</QuestionIdentifier><FreeText>Stop, that makes me self-conscious.</FreeText></Answer><Answer><QuestionIdentifier>response72</QuestionIdentifier><FreeText>You'll be there a while.</FreeText></Answer><Answer><QuestionIdentifier>response73</QuestionIdentifier><FreeText>You've got some, yourself.</FreeText></Answer><Answer><QuestionIdentifier>response74</QuestionIdentifier><FreeText>That's what happens when you get old.</FreeText></Answer><Answer><QuestionIdentifier>response75</QuestionIdentifier><FreeText>You've given me those gray hairs.</FreeText></Answer><Answer><QuestionIdentifier>response81</QuestionIdentifier><FreeText>The biggest bad there is.</FreeText></Answer><Answer><QuestionIdentifier>response82</QuestionIdentifier><FreeText>There's no bigger bad.</FreeText></Answer><Answer><QuestionIdentifier>response83</QuestionIdentifier><FreeText>We have to stop him some way.</FreeText></Answer><Answer><QuestionIdentifier>response84</QuestionIdentifier><FreeText>He'll never listen.</FreeText></Answer><Answer><QuestionIdentifier>response85</QuestionIdentifier><FreeText>We can fight him together.</FreeText></Answer><Answer><QuestionIdentifier>response91</QuestionIdentifier><FreeText>Yes, I'm sorry to say that it's passed.</FreeText></Answer><Answer><QuestionIdentifier>response92</QuestionIdentifier><FreeText>It's very sick.</FreeText></Answer><Answer><QuestionIdentifier>response93</QuestionIdentifier><FreeText>We should go see it.</FreeText></Answer><Answer><QuestionIdentifier>response94</QuestionIdentifier><FreeText>I wish it was doing better.</FreeText></Answer><Answer><QuestionIdentifier>response95</QuestionIdentifier><FreeText>Do you think they'll get a new one?</FreeText></Answer></QuestionFormAnswers>",We'll have to find another clue.,We can still use this to find our way.,I'm not going to let that stop us.,But someone has definitely been down here.,This won't stop me.,That's none of your concern.,Something that shouldn't be spoken of.,Someone got hurt.,A secret that I want to keep.,"Nevermind, just help me.",I think we should break up.,We have to work together.,I want to go somewhere special with you.,"I like you, and I always have.",You mean so much to me.,"To help you, now that you need it.",To see if you'll hear me out.,"To stop you, not to hurt you.",To give you what you want.,To do whatever it takes to make you go away.,I can be there in ten.,I can't be there any faster.,"I'm sorry, but traffic is terrible.",It's not my fault.,I should've left earlier.,"Oh, it's nothing.",Can you get me something to stop the bleeding?,"Please, call an ambulance.",I've been through worse.,That doesn't matter now.,"Well, who is that?",He's a stranger.,I've never met him before in my life.,I dont trust him.,Do you know his name?,"Stop, that makes me self-conscious.",You'll be there a while.,"You've got some, yourself.",That's what happens when you get old.,You've given me those gray hairs.,The biggest bad there is.,There's no bigger bad.,We have to stop him some way.,He'll never listen.,We can fight him together.,"Yes, I'm sorry to say that it's passed.",It's very sick.,We should go see it.,I wish it was doing better.,Do you think they'll get a new one?
3GU1KF0O4JZKRCAIXKTELFMCOEEBPW,A1STHU52FY0M6Q,3OJX0UFJ0Z5C845OQJ9BFWJZAUI9UL,Submitted,2019-06-15 21:59:51-04:00,NA,2019-06-13 21:54:31-04:00,2019-06-13 21:59:51-04:00,"<?xml version=""1.0"" encoding=""ASCII""?><QuestionFormAnswers xmlns=""http://mechanicalturk.amazonaws.com/AWSMechanicalTurkDataSchemas/2005-10-01/QuestionFormAnswers.xsd""><Answer><QuestionIdentifier>response101</QuestionIdentifier><FreeText>no we cant.</FreeText></Answer><Answer><QuestionIdentifier>response102</QuestionIdentifier><FreeText>we are almost there.</FreeText></Answer><Answer><QuestionIdentifier>response11</QuestionIdentifier><FreeText>wow, i praised the lord.</FreeText></Answer><Answer><QuestionIdentifier>response12</QuestionIdentifier><FreeText>u must be dumb</FreeText></Answer><Answer><QuestionIdentifier>response21</QuestionIdentifier><FreeText>well lets protest.</FreeText></Answer><Answer><QuestionIdentifier>response22</QuestionIdentifier><FreeText>i want a raise.</FreeText></Answer><Answer><QuestionIdentifier>response31</QuestionIdentifier><FreeText>yes its gonna get ugly out here.</FreeText></Answer><Answer><QuestionIdentifier>response32</QuestionIdentifier><FreeText>alot of rain is coming.</FreeText></Answer><Answer><QuestionIdentifier>response41</QuestionIdentifier><FreeText>you have alot of right in that say.</FreeText></Answer><Answer><QuestionIdentifier>response42</QuestionIdentifier><FreeText>too good to be true.</FreeText></Answer><Answer><QuestionIdentifier>response51</QuestionIdentifier><FreeText>why? that was rude.</FreeText></Answer><Answer><QuestionIdentifier>response52</QuestionIdentifier><FreeText>go EFF yourself then.</FreeText></Answer><Answer><QuestionIdentifier>response61</QuestionIdentifier><FreeText>woow then your fired.</FreeText></Answer><Answer><QuestionIdentifier>response62</QuestionIdentifier><FreeText>ok then when you get here step into my office.</FreeText></Answer><Answer><QuestionIdentifier>response71</QuestionIdentifier><FreeText>give me my gun.</FreeText></Answer><Answer><QuestionIdentifier>response72</QuestionIdentifier><FreeText>he wont talk.</FreeText></Answer><Answer><QuestionIdentifier>response81</QuestionIdentifier><FreeText>its called a secret agent</FreeText></Answer><Answer><QuestionIdentifier>response82</QuestionIdentifier><FreeText>under cover agent sounds better.</FreeText></Answer><Answer><QuestionIdentifier>response91</QuestionIdentifier><FreeText>haha it surely would.</FreeText></Answer><Answer><QuestionIdentifier>response92</QuestionIdentifier><FreeText>I feel like it does u cigar sucker.</FreeText></Answer></QuestionFormAnswers>",no we cant.,we are almost there.,NA,NA,NA,"wow, i praised the lord.",u must be dumb,NA,NA,NA,well lets protest.,i want a raise.,NA,NA,NA,yes its gonna get ugly out here.,alot of rain is coming.,NA,NA,NA,you have alot of right in that say.,too good to be true.,NA,NA,NA,why? that was rude.,go EFF yourself then.,NA,NA,NA,woow then your fired.,ok then when you get here step into my office.,NA,NA,NA,give me my gun.,he wont talk.,NA,NA,NA,its called a secret agent,under cover agent sounds better.,NA,NA,NA,haha it surely would.,I feel like it does u cigar sucker.,NA,NA,NA
