AssignmentId,WorkerId,HITId,AssignmentStatus,AutoApprovalTime,ApprovalTime,AcceptTime,SubmitTime,Answer,response101,response102,response103,response104,response105,response11,response12,response13,response14,response15,response21,response22,response23,response24,response25,response31,response32,response33,response34,response35,response41,response42,response43,response44,response45,response51,response52,response53,response54,response55,response61,response62,response63,response64,response65,response71,response72,response73,response74,response75,response81,response82,response83,response84,response85,response91,response92,response93,response94,response95
3X4JMASXCN7H3V6YGZEO6EL4G7W0BA,A1LR71IS0QHPK3,3DTJ4WT8BDDAPZQF4HO5O2ZP39CZE9,Submitted,2019-06-16 02:37:58-04:00,NA,2019-06-14 02:28:05-04:00,2019-06-14 02:37:58-04:00,"<?xml version=""1.0"" encoding=""ASCII""?><QuestionFormAnswers xmlns=""http://mechanicalturk.amazonaws.com/AWSMechanicalTurkDataSchemas/2005-10-01/QuestionFormAnswers.xsd""><Answer><QuestionIdentifier>response101</QuestionIdentifier><FreeText>She took a bite out of me like I was an apple.</FreeText></Answer><Answer><QuestionIdentifier>response102</QuestionIdentifier><FreeText>There's a big goddamn set of teethmarks I can show you.</FreeText></Answer><Answer><QuestionIdentifier>response103</QuestionIdentifier><FreeText>I think she left a tooth in my leg.</FreeText></Answer><Answer><QuestionIdentifier>response104</QuestionIdentifier><FreeText>She tore a chunk out of me.</FreeText></Answer><Answer><QuestionIdentifier>response105</QuestionIdentifier><FreeText>Like a shark.</FreeText></Answer><Answer><QuestionIdentifier>response11</QuestionIdentifier><FreeText>Yeah, you chained me up like a dog.</FreeText></Answer><Answer><QuestionIdentifier>response12</QuestionIdentifier><FreeText>I don't care what you are, just get me out of this thing.</FreeText></Answer><Answer><QuestionIdentifier>response13</QuestionIdentifier><FreeText>I'll call you whatever you want if you get me loose.</FreeText></Answer><Answer><QuestionIdentifier>response14</QuestionIdentifier><FreeText>You have yet to prove otherwise.</FreeText></Answer><Answer><QuestionIdentifier>response15</QuestionIdentifier><FreeText>Well, can you blame me?</FreeText></Answer><Answer><QuestionIdentifier>response21</QuestionIdentifier><FreeText>Yes, everything under the stars.</FreeText></Answer><Answer><QuestionIdentifier>response22</QuestionIdentifier><FreeText>Everything that's got his name has yours.</FreeText></Answer><Answer><QuestionIdentifier>response23</QuestionIdentifier><FreeText>You're the owner now.</FreeText></Answer><Answer><QuestionIdentifier>response24</QuestionIdentifier><FreeText>I serve your family.</FreeText></Answer><Answer><QuestionIdentifier>response31</QuestionIdentifier><FreeText>But how has no one else found this out so far?</FreeText></Answer><Answer><QuestionIdentifier>response32</QuestionIdentifier><FreeText>Are we the only ones who know?</FreeText></Answer><Answer><QuestionIdentifier>response33</QuestionIdentifier><FreeText>What if others know?</FreeText></Answer><Answer><QuestionIdentifier>response34</QuestionIdentifier><FreeText>Should we try to tell anyone?</FreeText></Answer><Answer><QuestionIdentifier>response35</QuestionIdentifier><FreeText>How are we supposed to sit on this info?</FreeText></Answer><Answer><QuestionIdentifier>response41</QuestionIdentifier><FreeText>Someplace public.</FreeText></Answer><Answer><QuestionIdentifier>response42</QuestionIdentifier><FreeText>Somewhere there's nobody else around.</FreeText></Answer><Answer><QuestionIdentifier>response43</QuestionIdentifier><FreeText>Somewhere I know.</FreeText></Answer><Answer><QuestionIdentifier>response44</QuestionIdentifier><FreeText>I'll only go someplace that I've been to.</FreeText></Answer><Answer><QuestionIdentifier>response45</QuestionIdentifier><FreeText>Somewhere near the city.</FreeText></Answer><Answer><QuestionIdentifier>response51</QuestionIdentifier><FreeText>I do say so.</FreeText></Answer><Answer><QuestionIdentifier>response52</QuestionIdentifier><FreeText>Who doesn't say so?</FreeText></Answer><Answer><QuestionIdentifier>response53</QuestionIdentifier><FreeText>What, were you disappointed?</FreeText></Answer><Answer><QuestionIdentifier>response54</QuestionIdentifier><FreeText>Tell me you've had better.</FreeText></Answer><Answer><QuestionIdentifier>response55</QuestionIdentifier><FreeText>Oh, should I go for another round?</FreeText></Answer><Answer><QuestionIdentifier>response61</QuestionIdentifier><FreeText>We'll need to be by the doctors every month.</FreeText></Answer><Answer><QuestionIdentifier>response62</QuestionIdentifier><FreeText>All we can do is pray.</FreeText></Answer><Answer><QuestionIdentifier>response63</QuestionIdentifier><FreeText>We'll do what we can.</FreeText></Answer><Answer><QuestionIdentifier>response64</QuestionIdentifier><FreeText>We won't give up.</FreeText></Answer><Answer><QuestionIdentifier>response65</QuestionIdentifier><FreeText>We need to come up with a plan.</FreeText></Answer><Answer><QuestionIdentifier>response71</QuestionIdentifier><FreeText>I think it's our best bet.</FreeText></Answer><Answer><QuestionIdentifier>response72</QuestionIdentifier><FreeText>I don't think we have another choice.</FreeText></Answer><Answer><QuestionIdentifier>response73</QuestionIdentifier><FreeText>If we want to get through this, we have to go with what's available.</FreeText></Answer><Answer><QuestionIdentifier>response81</QuestionIdentifier><FreeText>It's the best.</FreeText></Answer><Answer><QuestionIdentifier>response82</QuestionIdentifier><FreeText>The wine is even better.</FreeText></Answer><Answer><QuestionIdentifier>response83</QuestionIdentifier><FreeText>Maybe France has better food, but only France.</FreeText></Answer><Answer><QuestionIdentifier>response84</QuestionIdentifier><FreeText>Have you ever had the wine?</FreeText></Answer><Answer><QuestionIdentifier>response85</QuestionIdentifier><FreeText>What's your favorite Italian food?</FreeText></Answer><Answer><QuestionIdentifier>response91</QuestionIdentifier><FreeText>The wicked witch, perhaps?</FreeText></Answer><Answer><QuestionIdentifier>response92</QuestionIdentifier><FreeText>Well, how did you get here?</FreeText></Answer><Answer><QuestionIdentifier>response93</QuestionIdentifier><FreeText>What did they tell you?</FreeText></Answer><Answer><QuestionIdentifier>response94</QuestionIdentifier><FreeText>If you haven't had an accident, why are you here?</FreeText></Answer><Answer><QuestionIdentifier>response95</QuestionIdentifier><FreeText>What drew you here?</FreeText></Answer></QuestionFormAnswers>",She took a bite out of me like I was an apple.,There's a big goddamn set of teethmarks I can show you.,I think she left a tooth in my leg.,She tore a chunk out of me.,Like a shark.,"Yeah, you chained me up like a dog.","I don't care what you are, just get me out of this thing.",I'll call you whatever you want if you get me loose.,You have yet to prove otherwise.,"Well, can you blame me?","Yes, everything under the stars.",Everything that's got his name has yours.,You're the owner now.,I serve your family.,NA,But how has no one else found this out so far?,Are we the only ones who know?,What if others know?,Should we try to tell anyone?,How are we supposed to sit on this info?,Someplace public.,Somewhere there's nobody else around.,Somewhere I know.,I'll only go someplace that I've been to.,Somewhere near the city.,I do say so.,Who doesn't say so?,"What, were you disappointed?",Tell me you've had better.,"Oh, should I go for another round?",We'll need to be by the doctors every month.,All we can do is pray.,We'll do what we can.,We won't give up.,We need to come up with a plan.,I think it's our best bet.,I don't think we have another choice.,"If we want to get through this, we have to go with what's available.",NA,NA,It's the best.,The wine is even better.,"Maybe France has better food, but only France.",Have you ever had the wine?,What's your favorite Italian food?,"The wicked witch, perhaps?","Well, how did you get here?",What did they tell you?,"If you haven't had an accident, why are you here?",What drew you here?
3YOH7BII0A5YPZB8P9F6QAUKXV5VK0,A1M0ZFVIMWWMBA,3M7OI89LVYMT4RMQ6LLZ1G6RDT3C63,Submitted,2019-06-15 16:47:15-04:00,NA,2019-06-13 16:39:40-04:00,2019-06-13 16:47:15-04:00,"<?xml version=""1.0"" encoding=""ASCII""?><QuestionFormAnswers xmlns=""http://mechanicalturk.amazonaws.com/AWSMechanicalTurkDataSchemas/2005-10-01/QuestionFormAnswers.xsd""><Answer><QuestionIdentifier>response101</QuestionIdentifier><FreeText>It's my job to prevent you from doing so.</FreeText></Answer><Answer><QuestionIdentifier>response102</QuestionIdentifier><FreeText>I'm sorry, but no. </FreeText></Answer><Answer><QuestionIdentifier>response103</QuestionIdentifier><FreeText>Not gonna happen, hombre. </FreeText></Answer><Answer><QuestionIdentifier>response104</QuestionIdentifier><FreeText>I don't think so. </FreeText></Answer><Answer><QuestionIdentifier>response11</QuestionIdentifier><FreeText>I don't feel comfortable being a part of this.</FreeText></Answer><Answer><QuestionIdentifier>response12</QuestionIdentifier><FreeText>This is your issue. I'm sorry, but I don't want to get involved.</FreeText></Answer><Answer><QuestionIdentifier>response21</QuestionIdentifier><FreeText>I really appreciate that. Thank you.</FreeText></Answer><Answer><QuestionIdentifier>response22</QuestionIdentifier><FreeText>Terrific! That is appreciated. </FreeText></Answer><Answer><QuestionIdentifier>response31</QuestionIdentifier><FreeText>Nothing other than life!</FreeText></Answer><Answer><QuestionIdentifier>response32</QuestionIdentifier><FreeText>Meth! Lots of meth!</FreeText></Answer><Answer><QuestionIdentifier>response33</QuestionIdentifier><FreeText>Planet Earth, just like you!</FreeText></Answer><Answer><QuestionIdentifier>response41</QuestionIdentifier><FreeText>How about fifty dead squirrels? Will that get you out?</FreeText></Answer><Answer><QuestionIdentifier>response42</QuestionIdentifier><FreeText>Get out man! It's just not worth it!</FreeText></Answer><Answer><QuestionIdentifier>response43</QuestionIdentifier><FreeText>Hey man, if you've got the stones to keep at it, that's all you.</FreeText></Answer><Answer><QuestionIdentifier>response51</QuestionIdentifier><FreeText>I told you to go away. </FreeText></Answer><Answer><QuestionIdentifier>response52</QuestionIdentifier><FreeText>If you don't leave now, I'm calling the police.</FreeText></Answer><Answer><QuestionIdentifier>response53</QuestionIdentifier><FreeText>Okay, you wait here, I'll go grab my weapon. </FreeText></Answer><Answer><QuestionIdentifier>response54</QuestionIdentifier><FreeText>Piss off, asshole.</FreeText></Answer><Answer><QuestionIdentifier>response55</QuestionIdentifier><FreeText>It doesn't matter where she is, you're not getting in here. </FreeText></Answer><Answer><QuestionIdentifier>response61</QuestionIdentifier><FreeText>Well what? You hated it too, didn't you?</FreeText></Answer><Answer><QuestionIdentifier>response62</QuestionIdentifier><FreeText>I hated it too, but I wasn't going to tell them that. </FreeText></Answer><Answer><QuestionIdentifier>response71</QuestionIdentifier><FreeText>Good for him!</FreeText></Answer><Answer><QuestionIdentifier>response72</QuestionIdentifier><FreeText>Yeah right. What's he really doing?</FreeText></Answer><Answer><QuestionIdentifier>response73</QuestionIdentifier><FreeText>It's about time!</FreeText></Answer><Answer><QuestionIdentifier>response81</QuestionIdentifier><FreeText>You'll see for yourself as you live and grow. </FreeText></Answer><Answer><QuestionIdentifier>response82</QuestionIdentifier><FreeText>Don't worry, you'll find out. </FreeText></Answer><Answer><QuestionIdentifier>response83</QuestionIdentifier><FreeText>I do say so, and I would appreciate it if you dropped the sass!</FreeText></Answer><Answer><QuestionIdentifier>response91</QuestionIdentifier><FreeText>Here you go!</FreeText></Answer><Answer><QuestionIdentifier>response92</QuestionIdentifier><FreeText>Too bad, sucker!</FreeText></Answer><Answer><QuestionIdentifier>response93</QuestionIdentifier><FreeText>Cool, because I really don't want it.</FreeText></Answer><Answer><QuestionIdentifier>response94</QuestionIdentifier><FreeText>I'm glad it's going to a good home.</FreeText></Answer></QuestionFormAnswers>",It's my job to prevent you from doing so.,"I'm sorry, but no.","Not gonna happen, hombre.",I don't think so.,NA,I don't feel comfortable being a part of this.,"This is your issue. I'm sorry, but I don't want to get involved.",NA,NA,NA,I really appreciate that. Thank you.,Terrific! That is appreciated.,NA,NA,NA,Nothing other than life!,Meth! Lots of meth!,"Planet Earth, just like you!",NA,NA,How about fifty dead squirrels? Will that get you out?,Get out man! It's just not worth it!,"Hey man, if you've got the stones to keep at it, that's all you.",NA,NA,I told you to go away.,"If you don't leave now, I'm calling the police.","Okay, you wait here, I'll go grab my weapon.","Piss off, asshole.","It doesn't matter where she is, you're not getting in here.","Well what? You hated it too, didn't you?","I hated it too, but I wasn't going to tell them that.",NA,NA,NA,Good for him!,Yeah right. What's he really doing?,It's about time!,NA,NA,You'll see for yourself as you live and grow.,"Don't worry, you'll find out.","I do say so, and I would appreciate it if you dropped the sass!",NA,NA,Here you go!,"Too bad, sucker!","Cool, because I really don't want it.",I'm glad it's going to a good home.,NA
3NG53N1RLWH1PECBU894UDWBG82P8K,API7K4R8MF7VD,3M7OI89LVYMT4RMQ6LLZ1G6RDT3C63,Submitted,2019-06-15 19:25:32-04:00,NA,2019-06-13 19:16:44-04:00,2019-06-13 19:25:32-04:00,"<?xml version=""1.0"" encoding=""ASCII""?><QuestionFormAnswers xmlns=""http://mechanicalturk.amazonaws.com/AWSMechanicalTurkDataSchemas/2005-10-01/QuestionFormAnswers.xsd""><Answer><QuestionIdentifier>response101</QuestionIdentifier><FreeText>I cant do that </FreeText></Answer><Answer><QuestionIdentifier>response102</QuestionIdentifier><FreeText>Not today try next week </FreeText></Answer><Answer><QuestionIdentifier>response11</QuestionIdentifier><FreeText>Mum it is not the most proper talk at the supper table. </FreeText></Answer><Answer><QuestionIdentifier>response12</QuestionIdentifier><FreeText>I really dont want to hear the details of anyones sex life. Specially my parents. </FreeText></Answer><Answer><QuestionIdentifier>response21</QuestionIdentifier><FreeText>Have you tried to call him and explain the situation?</FreeText></Answer><Answer><QuestionIdentifier>response22</QuestionIdentifier><FreeText>Everything happens for a reason,. </FreeText></Answer><Answer><QuestionIdentifier>response31</QuestionIdentifier><FreeText>I was about to ask the same of you</FreeText></Answer><Answer><QuestionIdentifier>response32</QuestionIdentifier><FreeText>Nothing. Why what have you got</FreeText></Answer><Answer><QuestionIdentifier>response41</QuestionIdentifier><FreeText>I know that Frances. I tought you how to drive this car remember. </FreeText></Answer><Answer><QuestionIdentifier>response42</QuestionIdentifier><FreeText>Dont make me drag you out, please. </FreeText></Answer><Answer><QuestionIdentifier>response51</QuestionIdentifier><FreeText>NO.  you have done enough damage already</FreeText></Answer><Answer><QuestionIdentifier>response52</QuestionIdentifier><FreeText>She does not want to talk to you, just let her be. </FreeText></Answer><Answer><QuestionIdentifier>response61</QuestionIdentifier><FreeText>It wasnt my fault though. </FreeText></Answer><Answer><QuestionIdentifier>response62</QuestionIdentifier><FreeText>Thinking a bon fire is in order </FreeText></Answer><Answer><QuestionIdentifier>response71</QuestionIdentifier><FreeText>With the tins of paint </FreeText></Answer><Answer><QuestionIdentifier>response72</QuestionIdentifier><FreeText>Why is he bench pressing the dog. </FreeText></Answer><Answer><QuestionIdentifier>response81</QuestionIdentifier><FreeText>You should see the flats in East London</FreeText></Answer><Answer><QuestionIdentifier>response82</QuestionIdentifier><FreeText>I know so. </FreeText></Answer><Answer><QuestionIdentifier>response91</QuestionIdentifier><FreeText>Well than me guess you shouyld come and get it</FreeText></Answer><Answer><QuestionIdentifier>response92</QuestionIdentifier><FreeText>I can ship it overnight to you than </FreeText></Answer></QuestionFormAnswers>",I cant do that,Not today try next week,NA,NA,NA,Mum it is not the most proper talk at the supper table.,I really dont want to hear the details of anyones sex life. Specially my parents.,NA,NA,NA,Have you tried to call him and explain the situation?,"Everything happens for a reason,.",NA,NA,NA,I was about to ask the same of you,Nothing. Why what have you got,NA,NA,NA,I know that Frances. I tought you how to drive this car remember.,"Dont make me drag you out, please.",NA,NA,NA,NO.  you have done enough damage already,"She does not want to talk to you, just let her be.",NA,NA,NA,It wasnt my fault though.,Thinking a bon fire is in order,NA,NA,NA,With the tins of paint,Why is he bench pressing the dog.,NA,NA,NA,You should see the flats in East London,I know so.,NA,NA,NA,Well than me guess you shouyld come and get it,I can ship it overnight to you than,NA,NA,NA
3OF2M9AATHMFYJGIQ649BG7GL79ZK4,A7HM33TK41MUZ,3M7OI89LVYMT4RMQ6LLZ1G6RDT3C63,Submitted,2019-06-15 19:56:50-04:00,NA,2019-06-13 19:49:09-04:00,2019-06-13 19:56:50-04:00,"<?xml version=""1.0"" encoding=""ASCII""?><QuestionFormAnswers xmlns=""http://mechanicalturk.amazonaws.com/AWSMechanicalTurkDataSchemas/2005-10-01/QuestionFormAnswers.xsd""><Answer><QuestionIdentifier>response101</QuestionIdentifier><FreeText>like i said, its not possible. </FreeText></Answer><Answer><QuestionIdentifier>response102</QuestionIdentifier><FreeText>stop asking, its not going to happen. </FreeText></Answer><Answer><QuestionIdentifier>response11</QuestionIdentifier><FreeText>This isnt something that my advise would be appropriate for. </FreeText></Answer><Answer><QuestionIdentifier>response12</QuestionIdentifier><FreeText>I dont want to listen to you talk anymore. </FreeText></Answer><Answer><QuestionIdentifier>response21</QuestionIdentifier><FreeText>I will not take failure as an answer. </FreeText></Answer><Answer><QuestionIdentifier>response22</QuestionIdentifier><FreeText>Make it happen. </FreeText></Answer><Answer><QuestionIdentifier>response31</QuestionIdentifier><FreeText>Maybe we should just get him the stone. </FreeText></Answer><Answer><QuestionIdentifier>response32</QuestionIdentifier><FreeText>Whatever gets him to shut up, find it for him. </FreeText></Answer><Answer><QuestionIdentifier>response41</QuestionIdentifier><FreeText>Or i could just shoot you in the head. </FreeText></Answer><Answer><QuestionIdentifier>response42</QuestionIdentifier><FreeText>Move, or you wont be going home alive. </FreeText></Answer><Answer><QuestionIdentifier>response51</QuestionIdentifier><FreeText>If she wanted to talk to you, she would, but she doesnt. </FreeText></Answer><Answer><QuestionIdentifier>response52</QuestionIdentifier><FreeText>Im calling the police. </FreeText></Answer><Answer><QuestionIdentifier>response61</QuestionIdentifier><FreeText>What do you think went wrong?</FreeText></Answer><Answer><QuestionIdentifier>response62</QuestionIdentifier><FreeText>I hope they dont hate us now....</FreeText></Answer><Answer><QuestionIdentifier>response71</QuestionIdentifier><FreeText>why is he doing it so early?</FreeText></Answer><Answer><QuestionIdentifier>response72</QuestionIdentifier><FreeText>Hes doing it wrong...</FreeText></Answer><Answer><QuestionIdentifier>response81</QuestionIdentifier><FreeText>Youre so spoiled. </FreeText></Answer><Answer><QuestionIdentifier>response82</QuestionIdentifier><FreeText>We can go to one if youre going to keep whinning. </FreeText></Answer><Answer><QuestionIdentifier>response91</QuestionIdentifier><FreeText>then come get it. </FreeText></Answer><Answer><QuestionIdentifier>response92</QuestionIdentifier><FreeText>well come take it then. </FreeText></Answer></QuestionFormAnswers>","like i said, its not possible.","stop asking, its not going to happen.",NA,NA,NA,This isnt something that my advise would be appropriate for.,I dont want to listen to you talk anymore.,NA,NA,NA,I will not take failure as an answer.,Make it happen.,NA,NA,NA,Maybe we should just get him the stone.,"Whatever gets him to shut up, find it for him.",NA,NA,NA,Or i could just shoot you in the head.,"Move, or you wont be going home alive.",NA,NA,NA,"If she wanted to talk to you, she would, but she doesnt.",Im calling the police.,NA,NA,NA,What do you think went wrong?,I hope they dont hate us now....,NA,NA,NA,why is he doing it so early?,Hes doing it wrong...,NA,NA,NA,Youre so spoiled.,We can go to one if youre going to keep whinning.,NA,NA,NA,then come get it.,well come take it then.,NA,NA,NA
35K3O9HUACB672X8T8ZZATETP49FE0,A1FJ0BM89N1C9K,3SBX2M1TKDLJJ5SVSFTFONBULHY4QF,Submitted,2019-06-15 15:51:52-04:00,NA,2019-06-13 15:43:15-04:00,2019-06-13 15:51:52-04:00,"<?xml version=""1.0"" encoding=""ASCII""?><QuestionFormAnswers xmlns=""http://mechanicalturk.amazonaws.com/AWSMechanicalTurkDataSchemas/2005-10-01/QuestionFormAnswers.xsd""><Answer><QuestionIdentifier>response101</QuestionIdentifier><FreeText>Yes to the boat we go!</FreeText></Answer><Answer><QuestionIdentifier>response102</QuestionIdentifier><FreeText>We're so excited!</FreeText></Answer><Answer><QuestionIdentifier>response11</QuestionIdentifier><FreeText>Yes I am asking if you two are involved.</FreeText></Answer><Answer><QuestionIdentifier>response12</QuestionIdentifier><FreeText>There is talk about it. </FreeText></Answer><Answer><QuestionIdentifier>response21</QuestionIdentifier><FreeText>What did you mean then?</FreeText></Answer><Answer><QuestionIdentifier>response22</QuestionIdentifier><FreeText>I don't see how else it could be interpreted. </FreeText></Answer><Answer><QuestionIdentifier>response31</QuestionIdentifier><FreeText>I said leave it!</FreeText></Answer><Answer><QuestionIdentifier>response32</QuestionIdentifier><FreeText>Then work it out. </FreeText></Answer><Answer><QuestionIdentifier>response41</QuestionIdentifier><FreeText>We will believe it when we see it. </FreeText></Answer><Answer><QuestionIdentifier>response42</QuestionIdentifier><FreeText>When will it be published?</FreeText></Answer><Answer><QuestionIdentifier>response51</QuestionIdentifier><FreeText>We broke up.</FreeText></Answer><Answer><QuestionIdentifier>response52</QuestionIdentifier><FreeText>I'm single now. </FreeText></Answer><Answer><QuestionIdentifier>response61</QuestionIdentifier><FreeText>Thanks Mom.</FreeText></Answer><Answer><QuestionIdentifier>response62</QuestionIdentifier><FreeText>I appreciate that . </FreeText></Answer><Answer><QuestionIdentifier>response71</QuestionIdentifier><FreeText>It was exhausting. </FreeText></Answer><Answer><QuestionIdentifier>response72</QuestionIdentifier><FreeText>We need to rest</FreeText></Answer><Answer><QuestionIdentifier>response81</QuestionIdentifier><FreeText>I said we will find a suitable place. </FreeText></Answer><Answer><QuestionIdentifier>response82</QuestionIdentifier><FreeText>Don't let them bother you . </FreeText></Answer><Answer><QuestionIdentifier>response91</QuestionIdentifier><FreeText>Well I dont want it.</FreeText></Answer><Answer><QuestionIdentifier>response92</QuestionIdentifier><FreeText>Give it back to him yourself. </FreeText></Answer></QuestionFormAnswers>",Yes to the boat we go!,We're so excited!,NA,NA,NA,Yes I am asking if you two are involved.,There is talk about it.,NA,NA,NA,What did you mean then?,I don't see how else it could be interpreted.,NA,NA,NA,I said leave it!,Then work it out.,NA,NA,NA,We will believe it when we see it.,When will it be published?,NA,NA,NA,We broke up.,I'm single now.,NA,NA,NA,Thanks Mom.,I appreciate that .,NA,NA,NA,It was exhausting.,We need to rest,NA,NA,NA,I said we will find a suitable place.,Don't let them bother you .,NA,NA,NA,Well I dont want it.,Give it back to him yourself.,NA,NA,NA
