AssignmentId,WorkerId,HITId,AssignmentStatus,AutoApprovalTime,ApprovalTime,AcceptTime,SubmitTime,Answer,response101,response102,response103,response104,response105,response11,response12,response13,response14,response15,response21,response22,response23,response24,response25,response31,response32,response33,response34,response35,response41,response42,response43,response44,response45,response51,response52,response53,response54,response55,response61,response62,response63,response64,response65,response71,response72,response73,response74,response75,response81,response82,response83,response84,response85,response91,response92,response93,response94,response95
3TS1AR6UQRCLYNIY60LT4JMC3JB7FG,A1L3XBD6D9A54J,336OE47KI2INXF7WOKT8P2TTM2BWVM,Submitted,2019-06-15 23:25:13-04:00,NA,2019-06-13 23:20:26-04:00,2019-06-13 23:25:13-04:00,"<?xml version=""1.0"" encoding=""ASCII""?><QuestionFormAnswers xmlns=""http://mechanicalturk.amazonaws.com/AWSMechanicalTurkDataSchemas/2005-10-01/QuestionFormAnswers.xsd""><Answer><QuestionIdentifier>response101</QuestionIdentifier><FreeText>So what should we do?</FreeText></Answer><Answer><QuestionIdentifier>response102</QuestionIdentifier><FreeText>Let's not overreact then.</FreeText></Answer><Answer><QuestionIdentifier>response103</QuestionIdentifier><FreeText>We're so similar.</FreeText></Answer><Answer><QuestionIdentifier>response104</QuestionIdentifier><FreeText>Little things don't bother me.</FreeText></Answer><Answer><QuestionIdentifier>response105</QuestionIdentifier><FreeText>I thought maybe it would upset you.</FreeText></Answer><Answer><QuestionIdentifier>response11</QuestionIdentifier><FreeText>I will, thank you.</FreeText></Answer><Answer><QuestionIdentifier>response12</QuestionIdentifier><FreeText>Don't get mad at me.</FreeText></Answer><Answer><QuestionIdentifier>response13</QuestionIdentifier><FreeText>We can do it together.</FreeText></Answer><Answer><QuestionIdentifier>response14</QuestionIdentifier><FreeText>I understand that.</FreeText></Answer><Answer><QuestionIdentifier>response15</QuestionIdentifier><FreeText>That's fine with me.</FreeText></Answer><Answer><QuestionIdentifier>response21</QuestionIdentifier><FreeText>I know I could have.</FreeText></Answer><Answer><QuestionIdentifier>response22</QuestionIdentifier><FreeText>I shouldn't have to.</FreeText></Answer><Answer><QuestionIdentifier>response23</QuestionIdentifier><FreeText>That doesn't matter.</FreeText></Answer><Answer><QuestionIdentifier>response24</QuestionIdentifier><FreeText>It's his job to check.</FreeText></Answer><Answer><QuestionIdentifier>response25</QuestionIdentifier><FreeText>I could have been dangerous.</FreeText></Answer><Answer><QuestionIdentifier>response31</QuestionIdentifier><FreeText>No you didn't.</FreeText></Answer><Answer><QuestionIdentifier>response32</QuestionIdentifier><FreeText>How did he look at me?</FreeText></Answer><Answer><QuestionIdentifier>response33</QuestionIdentifier><FreeText>So what?</FreeText></Answer><Answer><QuestionIdentifier>response34</QuestionIdentifier><FreeText>Who cares?</FreeText></Answer><Answer><QuestionIdentifier>response35</QuestionIdentifier><FreeText>He didn't look at me.</FreeText></Answer><Answer><QuestionIdentifier>response41</QuestionIdentifier><FreeText>Yes I do.</FreeText></Answer><Answer><QuestionIdentifier>response42</QuestionIdentifier><FreeText>Don't you?</FreeText></Answer><Answer><QuestionIdentifier>response43</QuestionIdentifier><FreeText>Communication usually helps things.</FreeText></Answer><Answer><QuestionIdentifier>response44</QuestionIdentifier><FreeText>It can't hurt.</FreeText></Answer><Answer><QuestionIdentifier>response45</QuestionIdentifier><FreeText>I think it will.</FreeText></Answer><Answer><QuestionIdentifier>response51</QuestionIdentifier><FreeText>I take care of him.</FreeText></Answer><Answer><QuestionIdentifier>response52</QuestionIdentifier><FreeText>I'm like his parent.</FreeText></Answer><Answer><QuestionIdentifier>response53</QuestionIdentifier><FreeText>I watch over him.</FreeText></Answer><Answer><QuestionIdentifier>response54</QuestionIdentifier><FreeText>I care for him.</FreeText></Answer><Answer><QuestionIdentifier>response55</QuestionIdentifier><FreeText>I have a legal responsibility for him.</FreeText></Answer><Answer><QuestionIdentifier>response61</QuestionIdentifier><FreeText>No problem.</FreeText></Answer><Answer><QuestionIdentifier>response62</QuestionIdentifier><FreeText>I get it.</FreeText></Answer><Answer><QuestionIdentifier>response63</QuestionIdentifier><FreeText>I will work on that.</FreeText></Answer><Answer><QuestionIdentifier>response64</QuestionIdentifier><FreeText>What do you want it to say?</FreeText></Answer><Answer><QuestionIdentifier>response65</QuestionIdentifier><FreeText>When do you need it by?</FreeText></Answer><Answer><QuestionIdentifier>response71</QuestionIdentifier><FreeText>What do you want to do?</FreeText></Answer><Answer><QuestionIdentifier>response72</QuestionIdentifier><FreeText>Sounds good!</FreeText></Answer><Answer><QuestionIdentifier>response73</QuestionIdentifier><FreeText>I'm available!</FreeText></Answer><Answer><QuestionIdentifier>response74</QuestionIdentifier><FreeText>When do you want to go?</FreeText></Answer><Answer><QuestionIdentifier>response75</QuestionIdentifier><FreeText>Give me a few more minutes!</FreeText></Answer><Answer><QuestionIdentifier>response81</QuestionIdentifier><FreeText>Thanks I know I am.</FreeText></Answer><Answer><QuestionIdentifier>response82</QuestionIdentifier><FreeText>I try to be clever.</FreeText></Answer><Answer><QuestionIdentifier>response83</QuestionIdentifier><FreeText>I'm smarter than you.</FreeText></Answer><Answer><QuestionIdentifier>response84</QuestionIdentifier><FreeText>Stop talking!</FreeText></Answer><Answer><QuestionIdentifier>response85</QuestionIdentifier><FreeText>You're so annoying!</FreeText></Answer><Answer><QuestionIdentifier>response91</QuestionIdentifier><FreeText>I never thought of that.</FreeText></Answer><Answer><QuestionIdentifier>response92</QuestionIdentifier><FreeText>Who knows?</FreeText></Answer><Answer><QuestionIdentifier>response93</QuestionIdentifier><FreeText>What do you think?</FreeText></Answer><Answer><QuestionIdentifier>response94</QuestionIdentifier><FreeText>Maybe he didn't think of the federal building?</FreeText></Answer><Answer><QuestionIdentifier>response95</QuestionIdentifier><FreeText>There's a lot of missing information.</FreeText></Answer></QuestionFormAnswers>",So what should we do?,Let's not overreact then.,We're so similar.,Little things don't bother me.,I thought maybe it would upset you.,"I will, thank you.",Don't get mad at me.,We can do it together.,I understand that.,That's fine with me.,I know I could have.,I shouldn't have to.,That doesn't matter.,It's his job to check.,I could have been dangerous.,No you didn't.,How did he look at me?,So what?,Who cares?,He didn't look at me.,Yes I do.,Don't you?,Communication usually helps things.,It can't hurt.,I think it will.,I take care of him.,I'm like his parent.,I watch over him.,I care for him.,I have a legal responsibility for him.,No problem.,I get it.,I will work on that.,What do you want it to say?,When do you need it by?,What do you want to do?,Sounds good!,I'm available!,When do you want to go?,Give me a few more minutes!,Thanks I know I am.,I try to be clever.,I'm smarter than you.,Stop talking!,You're so annoying!,I never thought of that.,Who knows?,What do you think?,Maybe he didn't think of the federal building?,There's a lot of missing information.
3JJVG1YBECVGY2SZD5K0N9HVXD2B5X,API7K4R8MF7VD,3VO4XFFP15KG2SAEUDRMRZV4CJO7Q2,Submitted,2019-06-15 17:39:54-04:00,NA,2019-06-13 17:30:57-04:00,2019-06-13 17:39:54-04:00,"<?xml version=""1.0"" encoding=""ASCII""?><QuestionFormAnswers xmlns=""http://mechanicalturk.amazonaws.com/AWSMechanicalTurkDataSchemas/2005-10-01/QuestionFormAnswers.xsd""><Answer><QuestionIdentifier>response101</QuestionIdentifier><FreeText>I did!! When? </FreeText></Answer><Answer><QuestionIdentifier>response102</QuestionIdentifier><FreeText>That was my twin Not me</FreeText></Answer><Answer><QuestionIdentifier>response11</QuestionIdentifier><FreeText>How can I</FreeText></Answer><Answer><QuestionIdentifier>response12</QuestionIdentifier><FreeText>You signed up for this </FreeText></Answer><Answer><QuestionIdentifier>response21</QuestionIdentifier><FreeText>Please move </FreeText></Answer><Answer><QuestionIdentifier>response22</QuestionIdentifier><FreeText>I dont give a hoot what you wanna</FreeText></Answer><Answer><QuestionIdentifier>response31</QuestionIdentifier><FreeText>What's that suppose to mean?</FreeText></Answer><Answer><QuestionIdentifier>response32</QuestionIdentifier><FreeText>Why? Is that not a good suggestion?</FreeText></Answer><Answer><QuestionIdentifier>response41</QuestionIdentifier><FreeText>Hell no! That was the first thing I packed.</FreeText></Answer><Answer><QuestionIdentifier>response42</QuestionIdentifier><FreeText>Of course not. I'm not Dad. </FreeText></Answer><Answer><QuestionIdentifier>response51</QuestionIdentifier><FreeText>Ummm yes, I married him remember., </FreeText></Answer><Answer><QuestionIdentifier>response52</QuestionIdentifier><FreeText>This is why you are single.</FreeText></Answer><Answer><QuestionIdentifier>response61</QuestionIdentifier><FreeText>Yes. Number please </FreeText></Answer><Answer><QuestionIdentifier>response62</QuestionIdentifier><FreeText>What is the number you are trying to reach?</FreeText></Answer><Answer><QuestionIdentifier>response71</QuestionIdentifier><FreeText>Do you love me more than everything?</FreeText></Answer><Answer><QuestionIdentifier>response72</QuestionIdentifier><FreeText>Good. You better. </FreeText></Answer><Answer><QuestionIdentifier>response81</QuestionIdentifier><FreeText>This is why communication is key.,</FreeText></Answer><Answer><QuestionIdentifier>response82</QuestionIdentifier><FreeText>You should have been honest and just tell me.</FreeText></Answer><Answer><QuestionIdentifier>response91</QuestionIdentifier><FreeText>How can you do this to me you ungrateful whore!</FreeText></Answer><Answer><QuestionIdentifier>response92</QuestionIdentifier><FreeText>I should of listened to my sister. She said you were a gold digger!!</FreeText></Answer></QuestionFormAnswers>",I did!! When?,That was my twin Not me,NA,NA,NA,How can I,You signed up for this,NA,NA,NA,Please move,I dont give a hoot what you wanna,NA,NA,NA,What's that suppose to mean?,Why? Is that not a good suggestion?,NA,NA,NA,Hell no! That was the first thing I packed.,Of course not. I'm not Dad.,NA,NA,NA,"Ummm yes, I married him remember.,",This is why you are single.,NA,NA,NA,Yes. Number please,What is the number you are trying to reach?,NA,NA,NA,Do you love me more than everything?,Good. You better.,NA,NA,NA,"This is why communication is key.,",You should have been honest and just tell me.,NA,NA,NA,How can you do this to me you ungrateful whore!,I should of listened to my sister. She said you were a gold digger!!,NA,NA,NA
3S4AW7T80CGAFSABQDQKWK7M9CTL4Z,A1STHU52FY0M6Q,3VO4XFFP15KG2SAEUDRMRZV4CJO7Q2,Submitted,2019-06-15 21:32:17-04:00,NA,2019-06-13 21:26:43-04:00,2019-06-13 21:32:17-04:00,"<?xml version=""1.0"" encoding=""ASCII""?><QuestionFormAnswers xmlns=""http://mechanicalturk.amazonaws.com/AWSMechanicalTurkDataSchemas/2005-10-01/QuestionFormAnswers.xsd""><Answer><QuestionIdentifier>response101</QuestionIdentifier><FreeText>yes true but to get to know you.</FreeText></Answer><Answer><QuestionIdentifier>response102</QuestionIdentifier><FreeText>i know, dont play me.</FreeText></Answer><Answer><QuestionIdentifier>response11</QuestionIdentifier><FreeText>its too late.</FreeText></Answer><Answer><QuestionIdentifier>response12</QuestionIdentifier><FreeText>then get out now.</FreeText></Answer><Answer><QuestionIdentifier>response21</QuestionIdentifier><FreeText>sir, step away from th door now!</FreeText></Answer><Answer><QuestionIdentifier>response22</QuestionIdentifier><FreeText>slams door shut!</FreeText></Answer><Answer><QuestionIdentifier>response31</QuestionIdentifier><FreeText>nevermind i found a cheaper one.</FreeText></Answer><Answer><QuestionIdentifier>response32</QuestionIdentifier><FreeText>can you lower the rate?</FreeText></Answer><Answer><QuestionIdentifier>response41</QuestionIdentifier><FreeText>ohh, I forgot those too.</FreeText></Answer><Answer><QuestionIdentifier>response42</QuestionIdentifier><FreeText>oops.</FreeText></Answer><Answer><QuestionIdentifier>response51</QuestionIdentifier><FreeText>yes, wow, you broke his heart.</FreeText></Answer><Answer><QuestionIdentifier>response52</QuestionIdentifier><FreeText>yes i believe in them too.</FreeText></Answer><Answer><QuestionIdentifier>response61</QuestionIdentifier><FreeText>whats the number?</FreeText></Answer><Answer><QuestionIdentifier>response62</QuestionIdentifier><FreeText>can you provide the digits?</FreeText></Answer><Answer><QuestionIdentifier>response71</QuestionIdentifier><FreeText>stop lying please.</FreeText></Answer><Answer><QuestionIdentifier>response72</QuestionIdentifier><FreeText>then why do you keep hurting me?</FreeText></Answer><Answer><QuestionIdentifier>response81</QuestionIdentifier><FreeText>well why not im glad to see you!</FreeText></Answer><Answer><QuestionIdentifier>response82</QuestionIdentifier><FreeText>i didnt want you here either.</FreeText></Answer><Answer><QuestionIdentifier>response91</QuestionIdentifier><FreeText>just kill me now then.</FreeText></Answer><Answer><QuestionIdentifier>response92</QuestionIdentifier><FreeText>you make me miserable.</FreeText></Answer></QuestionFormAnswers>",yes true but to get to know you.,"i know, dont play me.",NA,NA,NA,its too late.,then get out now.,NA,NA,NA,"sir, step away from th door now!",slams door shut!,NA,NA,NA,nevermind i found a cheaper one.,can you lower the rate?,NA,NA,NA,"ohh, I forgot those too.",oops.,NA,NA,NA,"yes, wow, you broke his heart.",yes i believe in them too.,NA,NA,NA,whats the number?,can you provide the digits?,NA,NA,NA,stop lying please.,then why do you keep hurting me?,NA,NA,NA,well why not im glad to see you!,i didnt want you here either.,NA,NA,NA,just kill me now then.,you make me miserable.,NA,NA,NA
3018Q3ZVOJO0KFL54YX7VZ2L7FPRAJ,A1LR71IS0QHPK3,3VO4XFFP15KG2SAEUDRMRZV4CJO7Q2,Submitted,2019-06-15 23:00:00-04:00,NA,2019-06-13 22:50:38-04:00,2019-06-13 23:00:00-04:00,"<?xml version=""1.0"" encoding=""ASCII""?><QuestionFormAnswers xmlns=""http://mechanicalturk.amazonaws.com/AWSMechanicalTurkDataSchemas/2005-10-01/QuestionFormAnswers.xsd""><Answer><QuestionIdentifier>response101</QuestionIdentifier><FreeText>I don't know you.</FreeText></Answer><Answer><QuestionIdentifier>response102</QuestionIdentifier><FreeText>I've never met you before!</FreeText></Answer><Answer><QuestionIdentifier>response103</QuestionIdentifier><FreeText>Who are you, again?</FreeText></Answer><Answer><QuestionIdentifier>response104</QuestionIdentifier><FreeText>You don't look familiar to me.</FreeText></Answer><Answer><QuestionIdentifier>response105</QuestionIdentifier><FreeText>Are you playing a prank on me?</FreeText></Answer><Answer><QuestionIdentifier>response11</QuestionIdentifier><FreeText>Where do you need to be?</FreeText></Answer><Answer><QuestionIdentifier>response12</QuestionIdentifier><FreeText>Sure, let me help you get out of here.</FreeText></Answer><Answer><QuestionIdentifier>response13</QuestionIdentifier><FreeText>Please, follow me out of here.</FreeText></Answer><Answer><QuestionIdentifier>response14</QuestionIdentifier><FreeText>The exit is over there.</FreeText></Answer><Answer><QuestionIdentifier>response15</QuestionIdentifier><FreeText>Come with me to the exit.</FreeText></Answer><Answer><QuestionIdentifier>response21</QuestionIdentifier><FreeText>Please, it's not safe by the door.</FreeText></Answer><Answer><QuestionIdentifier>response22</QuestionIdentifier><FreeText>You might get in trouble if you stay there.</FreeText></Answer><Answer><QuestionIdentifier>response23</QuestionIdentifier><FreeText>What seems to be the problem?</FreeText></Answer><Answer><QuestionIdentifier>response24</QuestionIdentifier><FreeText>Is there something that you need?</FreeText></Answer><Answer><QuestionIdentifier>response25</QuestionIdentifier><FreeText>What is it that you'd like help with?</FreeText></Answer><Answer><QuestionIdentifier>response31</QuestionIdentifier><FreeText>I trust my insurance company.</FreeText></Answer><Answer><QuestionIdentifier>response32</QuestionIdentifier><FreeText>Do you think it's bad advice?</FreeText></Answer><Answer><QuestionIdentifier>response33</QuestionIdentifier><FreeText>What would you recommend instead?</FreeText></Answer><Answer><QuestionIdentifier>response34</QuestionIdentifier><FreeText>Who else should I listen to?</FreeText></Answer><Answer><QuestionIdentifier>response35</QuestionIdentifier><FreeText>I think there advice is solid.</FreeText></Answer><Answer><QuestionIdentifier>response41</QuestionIdentifier><FreeText>I remembered the checks.</FreeText></Answer><Answer><QuestionIdentifier>response42</QuestionIdentifier><FreeText>I think I forgot them too.</FreeText></Answer><Answer><QuestionIdentifier>response43</QuestionIdentifier><FreeText>I promise I remembered.</FreeText></Answer><Answer><QuestionIdentifier>response44</QuestionIdentifier><FreeText>I'm sorry, but I don't think I did.</FreeText></Answer><Answer><QuestionIdentifier>response45</QuestionIdentifier><FreeText>I hope I didn't forget anything else.</FreeText></Answer><Answer><QuestionIdentifier>response51</QuestionIdentifier><FreeText>Yes, and I'm still with him!</FreeText></Answer><Answer><QuestionIdentifier>response52</QuestionIdentifier><FreeText>That's too corny for me.</FreeText></Answer><Answer><QuestionIdentifier>response53</QuestionIdentifier><FreeText>I would never!</FreeText></Answer><Answer><QuestionIdentifier>response54</QuestionIdentifier><FreeText>I've never met anyone like that.</FreeText></Answer><Answer><QuestionIdentifier>response55</QuestionIdentifier><FreeText>Who hasn't?</FreeText></Answer><Answer><QuestionIdentifier>response61</QuestionIdentifier><FreeText>Sure, what's the number?</FreeText></Answer><Answer><QuestionIdentifier>response62</QuestionIdentifier><FreeText>Who are you trying to reach?</FreeText></Answer><Answer><QuestionIdentifier>response63</QuestionIdentifier><FreeText>Can you hold for a moment?</FreeText></Answer><Answer><QuestionIdentifier>response64</QuestionIdentifier><FreeText>Please let me know the number.</FreeText></Answer><Answer><QuestionIdentifier>response65</QuestionIdentifier><FreeText>Okay, I'm ready to connect you.</FreeText></Answer><Answer><QuestionIdentifier>response71</QuestionIdentifier><FreeText>I love you too.</FreeText></Answer><Answer><QuestionIdentifier>response72</QuestionIdentifier><FreeText>I didn't think you did.</FreeText></Answer><Answer><QuestionIdentifier>response73</QuestionIdentifier><FreeText>Are you just saying that?</FreeText></Answer><Answer><QuestionIdentifier>response74</QuestionIdentifier><FreeText>I'm not sure I believe you.</FreeText></Answer><Answer><QuestionIdentifier>response75</QuestionIdentifier><FreeText>I'm sorry, but I don't love you anymore.</FreeText></Answer><Answer><QuestionIdentifier>response81</QuestionIdentifier><FreeText>Well, it was a horrible idea.</FreeText></Answer><Answer><QuestionIdentifier>response82</QuestionIdentifier><FreeText>This is a bad idea.</FreeText></Answer><Answer><QuestionIdentifier>response83</QuestionIdentifier><FreeText>We should all leave.</FreeText></Answer><Answer><QuestionIdentifier>response84</QuestionIdentifier><FreeText>Let's just stay a while.</FreeText></Answer><Answer><QuestionIdentifier>response85</QuestionIdentifier><FreeText>We should get out of here as soon as possible.</FreeText></Answer><Answer><QuestionIdentifier>response91</QuestionIdentifier><FreeText>No gold is worth this.</FreeText></Answer><Answer><QuestionIdentifier>response92</QuestionIdentifier><FreeText>We're not close enough for that kind of talk.</FreeText></Answer><Answer><QuestionIdentifier>response93</QuestionIdentifier><FreeText>Listen to yourself!</FreeText></Answer><Answer><QuestionIdentifier>response94</QuestionIdentifier><FreeText>You're acting insane.</FreeText></Answer><Answer><QuestionIdentifier>response95</QuestionIdentifier><FreeText>I'm getting out of here, and you're coming with me.</FreeText></Answer></QuestionFormAnswers>",I don't know you.,I've never met you before!,"Who are you, again?",You don't look familiar to me.,Are you playing a prank on me?,Where do you need to be?,"Sure, let me help you get out of here.","Please, follow me out of here.",The exit is over there.,Come with me to the exit.,"Please, it's not safe by the door.",You might get in trouble if you stay there.,What seems to be the problem?,Is there something that you need?,What is it that you'd like help with?,I trust my insurance company.,Do you think it's bad advice?,What would you recommend instead?,Who else should I listen to?,I think there advice is solid.,I remembered the checks.,I think I forgot them too.,I promise I remembered.,"I'm sorry, but I don't think I did.",I hope I didn't forget anything else.,"Yes, and I'm still with him!",That's too corny for me.,I would never!,I've never met anyone like that.,Who hasn't?,"Sure, what's the number?",Who are you trying to reach?,Can you hold for a moment?,Please let me know the number.,"Okay, I'm ready to connect you.",I love you too.,I didn't think you did.,Are you just saying that?,I'm not sure I believe you.,"I'm sorry, but I don't love you anymore.","Well, it was a horrible idea.",This is a bad idea.,We should all leave.,Let's just stay a while.,We should get out of here as soon as possible.,No gold is worth this.,We're not close enough for that kind of talk.,Listen to yourself!,You're acting insane.,"I'm getting out of here, and you're coming with me."
