AssignmentId,WorkerId,HITId,AssignmentStatus,AutoApprovalTime,ApprovalTime,AcceptTime,SubmitTime,Answer,response101,response102,response103,response104,response105,response11,response12,response13,response14,response15,response21,response22,response23,response24,response25,response31,response32,response33,response34,response35,response41,response42,response43,response44,response45,response51,response52,response53,response54,response55,response61,response62,response63,response64,response65,response71,response72,response73,response74,response75,response81,response82,response83,response84,response85,response91,response92,response93,response94,response95
3OB0CAO74INOR355OZZTKHIMNVFHY3,AXO3OQJDHKRR3,359AP8GAGGIC8R0VPVQR7U6N84NC72,Submitted,2019-06-15 18:18:12-04:00,NA,2019-06-13 18:08:36-04:00,2019-06-13 18:18:12-04:00,"<?xml version=""1.0"" encoding=""ASCII""?><QuestionFormAnswers xmlns=""http://mechanicalturk.amazonaws.com/AWSMechanicalTurkDataSchemas/2005-10-01/QuestionFormAnswers.xsd""><Answer><QuestionIdentifier>response101</QuestionIdentifier><FreeText>I said, I'll deal with it, just stay out of it!</FreeText></Answer><Answer><QuestionIdentifier>response102</QuestionIdentifier><FreeText>You don't really know much, do you?</FreeText></Answer><Answer><QuestionIdentifier>response11</QuestionIdentifier><FreeText>A Navy reception? Wow, I wouldn't want to pass up that thrilling experience.</FreeText></Answer><Answer><QuestionIdentifier>response12</QuestionIdentifier><FreeText>I have a box of mac-n-cheese with your name on it</FreeText></Answer><Answer><QuestionIdentifier>response21</QuestionIdentifier><FreeText>I have no idea who did that.</FreeText></Answer><Answer><QuestionIdentifier>response22</QuestionIdentifier><FreeText>Magical screen elves?</FreeText></Answer><Answer><QuestionIdentifier>response31</QuestionIdentifier><FreeText>Not really, remind me!</FreeText></Answer><Answer><QuestionIdentifier>response32</QuestionIdentifier><FreeText>Of course, random bookstore person, how could I forget?</FreeText></Answer><Answer><QuestionIdentifier>response41</QuestionIdentifier><FreeText>This sounds like a scenario that is only going to benefit you.</FreeText></Answer><Answer><QuestionIdentifier>response42</QuestionIdentifier><FreeText>I don't think I want to be tied to you financially.</FreeText></Answer><Answer><QuestionIdentifier>response51</QuestionIdentifier><FreeText>Because I've found out the truth they don't want anyone to know!</FreeText></Answer><Answer><QuestionIdentifier>response52</QuestionIdentifier><FreeText>I'm a scapegoat for a larger conspiracy!</FreeText></Answer><Answer><QuestionIdentifier>response61</QuestionIdentifier><FreeText>Mooks have feelings too, you know!</FreeText></Answer><Answer><QuestionIdentifier>response62</QuestionIdentifier><FreeText>He sounds charming. </FreeText></Answer><Answer><QuestionIdentifier>response63</QuestionIdentifier><FreeText>In what way?</FreeText></Answer><Answer><QuestionIdentifier>response71</QuestionIdentifier><FreeText>Try harder, doofus.</FreeText></Answer><Answer><QuestionIdentifier>response72</QuestionIdentifier><FreeText>Keep watching, let me know if anything changes.</FreeText></Answer><Answer><QuestionIdentifier>response81</QuestionIdentifier><FreeText>I'm still trying to decipher the meaning.</FreeText></Answer><Answer><QuestionIdentifier>response82</QuestionIdentifier><FreeText>Dreams are weird, and this dream gets even weirder...</FreeText></Answer><Answer><QuestionIdentifier>response91</QuestionIdentifier><FreeText>I don't like transactional relationships.</FreeText></Answer><Answer><QuestionIdentifier>response92</QuestionIdentifier><FreeText>Flattery will get you everywhere!</FreeText></Answer></QuestionFormAnswers>","I said, I'll deal with it, just stay out of it!","You don't really know much, do you?",NA,NA,NA,"A Navy reception? Wow, I wouldn't want to pass up that thrilling experience.",I have a box of mac-n-cheese with your name on it,NA,NA,NA,I have no idea who did that.,Magical screen elves?,NA,NA,NA,"Not really, remind me!","Of course, random bookstore person, how could I forget?",NA,NA,NA,This sounds like a scenario that is only going to benefit you.,I don't think I want to be tied to you financially.,NA,NA,NA,Because I've found out the truth they don't want anyone to know!,I'm a scapegoat for a larger conspiracy!,NA,NA,NA,"Mooks have feelings too, you know!",He sounds charming.,In what way?,NA,NA,"Try harder, doofus.","Keep watching, let me know if anything changes.",NA,NA,NA,I'm still trying to decipher the meaning.,"Dreams are weird, and this dream gets even weirder...",NA,NA,NA,I don't like transactional relationships.,Flattery will get you everywhere!,NA,NA,NA
3GGAI1SQEWWXGE5BJ4XHFVYZ1UMCMR,A2D62BEUNNLJKL,359AP8GAGGIC8R0VPVQR7U6N84NC72,Submitted,2019-06-15 20:20:11-04:00,NA,2019-06-13 20:10:52-04:00,2019-06-13 20:20:11-04:00,"<?xml version=""1.0"" encoding=""ASCII""?><QuestionFormAnswers xmlns=""http://mechanicalturk.amazonaws.com/AWSMechanicalTurkDataSchemas/2005-10-01/QuestionFormAnswers.xsd""><Answer><QuestionIdentifier>response101</QuestionIdentifier><FreeText>What do you mean, ""Get a grip""?</FreeText></Answer><Answer><QuestionIdentifier>response102</QuestionIdentifier><FreeText>It doesn't matter that you didn't know.</FreeText></Answer><Answer><QuestionIdentifier>response11</QuestionIdentifier><FreeText>I have not changed my mind about going to the navy reception.</FreeText></Answer><Answer><QuestionIdentifier>response12</QuestionIdentifier><FreeText>What time do you expect to be home?</FreeText></Answer><Answer><QuestionIdentifier>response13</QuestionIdentifier><FreeText>I will be eating dinner on my own then.</FreeText></Answer><Answer><QuestionIdentifier>response21</QuestionIdentifier><FreeText>I did not change the colors on your computer screen.</FreeText></Answer><Answer><QuestionIdentifier>response22</QuestionIdentifier><FreeText>I do not know who changed the colors on your computer screen.</FreeText></Answer><Answer><QuestionIdentifier>response23</QuestionIdentifier><FreeText>Who else had access to your computer?</FreeText></Answer><Answer><QuestionIdentifier>response31</QuestionIdentifier><FreeText>I'm sorry, but I don't remember you.</FreeText></Answer><Answer><QuestionIdentifier>response32</QuestionIdentifier><FreeText>Of course I remember you.</FreeText></Answer><Answer><QuestionIdentifier>response33</QuestionIdentifier><FreeText>Could you remind me of your name?</FreeText></Answer><Answer><QuestionIdentifier>response41</QuestionIdentifier><FreeText>Why would I sell you my half of the house?</FreeText></Answer><Answer><QuestionIdentifier>response42</QuestionIdentifier><FreeText>I would need to have the money paid to me immediately.</FreeText></Answer><Answer><QuestionIdentifier>response43</QuestionIdentifier><FreeText>Are you asking me to move out?</FreeText></Answer><Answer><QuestionIdentifier>response51</QuestionIdentifier><FreeText>They simply do not like me.</FreeText></Answer><Answer><QuestionIdentifier>response52</QuestionIdentifier><FreeText>I don't know why they want to discredit me.</FreeText></Answer><Answer><QuestionIdentifier>response53</QuestionIdentifier><FreeText>It's a smear campaign.</FreeText></Answer><Answer><QuestionIdentifier>response61</QuestionIdentifier><FreeText>What is a mook?</FreeText></Answer><Answer><QuestionIdentifier>response62</QuestionIdentifier><FreeText>Why don't you know what he is like?</FreeText></Answer><Answer><QuestionIdentifier>response63</QuestionIdentifier><FreeText>Haven't you been out on a date with him already?</FreeText></Answer><Answer><QuestionIdentifier>response71</QuestionIdentifier><FreeText>Why haven't you gotten it yet?</FreeText></Answer><Answer><QuestionIdentifier>response72</QuestionIdentifier><FreeText>Try harder.</FreeText></Answer><Answer><QuestionIdentifier>response73</QuestionIdentifier><FreeText>Why are you so calm about this?</FreeText></Answer><Answer><QuestionIdentifier>response81</QuestionIdentifier><FreeText>What do you mean?</FreeText></Answer><Answer><QuestionIdentifier>response82</QuestionIdentifier><FreeText>You honestly think this is a sign?</FreeText></Answer><Answer><QuestionIdentifier>response83</QuestionIdentifier><FreeText>Do you think I received the dream from those who died at Wounded Knee?</FreeText></Answer><Answer><QuestionIdentifier>response91</QuestionIdentifier><FreeText>Why are you doing this to me?</FreeText></Answer><Answer><QuestionIdentifier>response92</QuestionIdentifier><FreeText>Let me go!</FreeText></Answer></QuestionFormAnswers>","What do you mean, ""Get a grip""?",It doesn't matter that you didn't know.,NA,NA,NA,I have not changed my mind about going to the navy reception.,What time do you expect to be home?,I will be eating dinner on my own then.,NA,NA,I did not change the colors on your computer screen.,I do not know who changed the colors on your computer screen.,Who else had access to your computer?,NA,NA,"I'm sorry, but I don't remember you.",Of course I remember you.,Could you remind me of your name?,NA,NA,Why would I sell you my half of the house?,I would need to have the money paid to me immediately.,Are you asking me to move out?,NA,NA,They simply do not like me.,I don't know why they want to discredit me.,It's a smear campaign.,NA,NA,What is a mook?,Why don't you know what he is like?,Haven't you been out on a date with him already?,NA,NA,Why haven't you gotten it yet?,Try harder.,Why are you so calm about this?,NA,NA,What do you mean?,You honestly think this is a sign?,Do you think I received the dream from those who died at Wounded Knee?,NA,NA,Why are you doing this to me?,Let me go!,NA,NA,NA
39LOEL67OT3UIP7OWACXHATABDU388,AC0B0RHJICXU1,3TC2K6WK9G03ANDC27TR9HTW7XG286,Submitted,2019-06-16 02:28:06-04:00,NA,2019-06-14 02:20:08-04:00,2019-06-14 02:28:06-04:00,"<?xml version=""1.0"" encoding=""ASCII""?><QuestionFormAnswers xmlns=""http://mechanicalturk.amazonaws.com/AWSMechanicalTurkDataSchemas/2005-10-01/QuestionFormAnswers.xsd""><Answer><QuestionIdentifier>response101</QuestionIdentifier><FreeText>Well they should have been. </FreeText></Answer><Answer><QuestionIdentifier>response102</QuestionIdentifier><FreeText>You know of the secret?</FreeText></Answer><Answer><QuestionIdentifier>response103</QuestionIdentifier><FreeText>Well...we cannot have you spreading this. </FreeText></Answer><Answer><QuestionIdentifier>response11</QuestionIdentifier><FreeText>Well then why are you here?</FreeText></Answer><Answer><QuestionIdentifier>response12</QuestionIdentifier><FreeText>Well who can tell me the special?</FreeText></Answer><Answer><QuestionIdentifier>response13</QuestionIdentifier><FreeText>Then why are you working here?</FreeText></Answer><Answer><QuestionIdentifier>response14</QuestionIdentifier><FreeText>Isn't that your job?</FreeText></Answer><Answer><QuestionIdentifier>response21</QuestionIdentifier><FreeText>He asks about you every single day</FreeText></Answer><Answer><QuestionIdentifier>response22</QuestionIdentifier><FreeText>You're his father, at least try to be there.</FreeText></Answer><Answer><QuestionIdentifier>response23</QuestionIdentifier><FreeText>Fucking loser. You don't even pay child support. </FreeText></Answer><Answer><QuestionIdentifier>response31</QuestionIdentifier><FreeText>How the hell should I know?</FreeText></Answer><Answer><QuestionIdentifier>response32</QuestionIdentifier><FreeText>He did, and he liked it.</FreeText></Answer><Answer><QuestionIdentifier>response33</QuestionIdentifier><FreeText>Stop bombarding me with stupid questions. </FreeText></Answer><Answer><QuestionIdentifier>response34</QuestionIdentifier><FreeText>Maybe he did, maybe he didn't. What's it to you?</FreeText></Answer><Answer><QuestionIdentifier>response41</QuestionIdentifier><FreeText>I don't have that much time to wait.</FreeText></Answer><Answer><QuestionIdentifier>response42</QuestionIdentifier><FreeText>Can you do it faster?</FreeText></Answer><Answer><QuestionIdentifier>response43</QuestionIdentifier><FreeText>I'll pay more if you can help me.</FreeText></Answer><Answer><QuestionIdentifier>response44</QuestionIdentifier><FreeText>That is way too long.</FreeText></Answer><Answer><QuestionIdentifier>response45</QuestionIdentifier><FreeText>Well, I'll try someone else.</FreeText></Answer><Answer><QuestionIdentifier>response51</QuestionIdentifier><FreeText>See you later. </FreeText></Answer><Answer><QuestionIdentifier>response52</QuestionIdentifier><FreeText>Don't contact me again.</FreeText></Answer><Answer><QuestionIdentifier>response53</QuestionIdentifier><FreeText>Good luck on your driving test. </FreeText></Answer><Answer><QuestionIdentifier>response54</QuestionIdentifier><FreeText>What are you doing here?</FreeText></Answer><Answer><QuestionIdentifier>response61</QuestionIdentifier><FreeText>Is there nothing you can do?</FreeText></Answer><Answer><QuestionIdentifier>response62</QuestionIdentifier><FreeText>But she was so healthy last week.</FreeText></Answer><Answer><QuestionIdentifier>response63</QuestionIdentifier><FreeText>You asshole, do more!</FreeText></Answer><Answer><QuestionIdentifier>response64</QuestionIdentifier><FreeText>Can I see her?</FreeText></Answer><Answer><QuestionIdentifier>response71</QuestionIdentifier><FreeText>My parents don't give a fuck about you.</FreeText></Answer><Answer><QuestionIdentifier>response72</QuestionIdentifier><FreeText>You knew who I was when you met me.</FreeText></Answer><Answer><QuestionIdentifier>response73</QuestionIdentifier><FreeText>Don't ever talk to me like that again.</FreeText></Answer><Answer><QuestionIdentifier>response74</QuestionIdentifier><FreeText>Well I don't give a fuck about your parents!</FreeText></Answer><Answer><QuestionIdentifier>response81</QuestionIdentifier><FreeText>Why though?</FreeText></Answer><Answer><QuestionIdentifier>response82</QuestionIdentifier><FreeText>That man did nothing to us.</FreeText></Answer><Answer><QuestionIdentifier>response83</QuestionIdentifier><FreeText>I can't believe you didn't. </FreeText></Answer><Answer><QuestionIdentifier>response84</QuestionIdentifier><FreeText>He could have killed me, and you didn't protect me.</FreeText></Answer><Answer><QuestionIdentifier>response85</QuestionIdentifier><FreeText>You're always so violent. </FreeText></Answer><Answer><QuestionIdentifier>response91</QuestionIdentifier><FreeText>We took them from you.</FreeText></Answer><Answer><QuestionIdentifier>response92</QuestionIdentifier><FreeText>Our medicine is better than yours. </FreeText></Answer><Answer><QuestionIdentifier>response93</QuestionIdentifier><FreeText>I'm the same as you my friend. </FreeText></Answer></QuestionFormAnswers>",Well they should have been.,You know of the secret?,Well...we cannot have you spreading this.,NA,NA,Well then why are you here?,Well who can tell me the special?,Then why are you working here?,Isn't that your job?,NA,He asks about you every single day,"You're his father, at least try to be there.",Fucking loser. You don't even pay child support.,NA,NA,How the hell should I know?,"He did, and he liked it.",Stop bombarding me with stupid questions.,"Maybe he did, maybe he didn't. What's it to you?",NA,I don't have that much time to wait.,Can you do it faster?,I'll pay more if you can help me.,That is way too long.,"Well, I'll try someone else.",See you later.,Don't contact me again.,Good luck on your driving test.,What are you doing here?,NA,Is there nothing you can do?,But she was so healthy last week.,"You asshole, do more!",Can I see her?,NA,My parents don't give a fuck about you.,You knew who I was when you met me.,Don't ever talk to me like that again.,Well I don't give a fuck about your parents!,NA,Why though?,That man did nothing to us.,I can't believe you didn't.,"He could have killed me, and you didn't protect me.",You're always so violent.,We took them from you.,Our medicine is better than yours.,I'm the same as you my friend.,NA,NA
3TS1AR6UQRCLYNIY60LT4JMC3L0F7H,A34S6AHUQ7RWR,3TC2K6WK9G03ANDC27TR9HTW7XG286,Submitted,2019-06-16 09:00:05-04:00,NA,2019-06-14 08:55:15-04:00,2019-06-14 09:00:05-04:00,"<?xml version=""1.0"" encoding=""ASCII""?><QuestionFormAnswers xmlns=""http://mechanicalturk.amazonaws.com/AWSMechanicalTurkDataSchemas/2005-10-01/QuestionFormAnswers.xsd""><Answer><QuestionIdentifier>response101</QuestionIdentifier><FreeText>Well, it's out in the open now.</FreeText></Answer><Answer><QuestionIdentifier>response102</QuestionIdentifier><FreeText>It hasn't been exactly clear.</FreeText></Answer><Answer><QuestionIdentifier>response11</QuestionIdentifier><FreeText>Could you find out the specials?</FreeText></Answer><Answer><QuestionIdentifier>response12</QuestionIdentifier><FreeText>Is there someone else here that knows the specials?</FreeText></Answer><Answer><QuestionIdentifier>response21</QuestionIdentifier><FreeText>Would i mind what?</FreeText></Answer><Answer><QuestionIdentifier>response22</QuestionIdentifier><FreeText>Please be patient</FreeText></Answer><Answer><QuestionIdentifier>response31</QuestionIdentifier><FreeText>You're not letting me explain</FreeText></Answer><Answer><QuestionIdentifier>response32</QuestionIdentifier><FreeText>I'm trying to tell you I'm not sure.</FreeText></Answer><Answer><QuestionIdentifier>response41</QuestionIdentifier><FreeText>Yes, maybe around March?</FreeText></Answer><Answer><QuestionIdentifier>response42</QuestionIdentifier><FreeText>No, during the summer</FreeText></Answer><Answer><QuestionIdentifier>response51</QuestionIdentifier><FreeText>Ok.  I'm 18.</FreeText></Answer><Answer><QuestionIdentifier>response52</QuestionIdentifier><FreeText>Grea.t.  Do you drive yet?</FreeText></Answer><Answer><QuestionIdentifier>response61</QuestionIdentifier><FreeText>I'm so sorry to hear that.</FreeText></Answer><Answer><QuestionIdentifier>response62</QuestionIdentifier><FreeText>NO, please tell me that's not so.</FreeText></Answer><Answer><QuestionIdentifier>response71</QuestionIdentifier><FreeText>YOu need to give a fuck about me!</FreeText></Answer><Answer><QuestionIdentifier>response72</QuestionIdentifier><FreeText>THey don't need to hear this.</FreeText></Answer><Answer><QuestionIdentifier>response81</QuestionIdentifier><FreeText>THat's a little creepy.</FreeText></Answer><Answer><QuestionIdentifier>response82</QuestionIdentifier><FreeText>Wow.  Very aggressive.</FreeText></Answer><Answer><QuestionIdentifier>response91</QuestionIdentifier><FreeText>WHat are your words?</FreeText></Answer><Answer><QuestionIdentifier>response92</QuestionIdentifier><FreeText>I'm sorry.  I didn't mean to offend.</FreeText></Answer></QuestionFormAnswers>","Well, it's out in the open now.",It hasn't been exactly clear.,NA,NA,NA,Could you find out the specials?,Is there someone else here that knows the specials?,NA,NA,NA,Would i mind what?,Please be patient,NA,NA,NA,You're not letting me explain,I'm trying to tell you I'm not sure.,NA,NA,NA,"Yes, maybe around March?","No, during the summer",NA,NA,NA,Ok.  I'm 18.,Grea.t.  Do you drive yet?,NA,NA,NA,I'm so sorry to hear that.,"NO, please tell me that's not so.",NA,NA,NA,YOu need to give a fuck about me!,THey don't need to hear this.,NA,NA,NA,THat's a little creepy.,Wow.  Very aggressive.,NA,NA,NA,WHat are your words?,I'm sorry.  I didn't mean to offend.,NA,NA,NA
3GGAI1SQEWWXGE5BJ4XHFVYZ1TDCMG,AC0B0RHJICXU1,3SMIWMMK613NK0IWJUJ3TGRA8V2WUX,Submitted,2019-06-15 16:25:42-04:00,NA,2019-06-13 16:17:17-04:00,2019-06-13 16:25:42-04:00,"<?xml version=""1.0"" encoding=""ASCII""?><QuestionFormAnswers xmlns=""http://mechanicalturk.amazonaws.com/AWSMechanicalTurkDataSchemas/2005-10-01/QuestionFormAnswers.xsd""><Answer><QuestionIdentifier>response101</QuestionIdentifier><FreeText>Well at least you know.</FreeText></Answer><Answer><QuestionIdentifier>response102</QuestionIdentifier><FreeText>Then why did you buy it?</FreeText></Answer><Answer><QuestionIdentifier>response11</QuestionIdentifier><FreeText>I can only do the back.</FreeText></Answer><Answer><QuestionIdentifier>response12</QuestionIdentifier><FreeText>Sorry for being so rude, if I have time I will do the front.</FreeText></Answer><Answer><QuestionIdentifier>response13</QuestionIdentifier><FreeText>I can do the front, but it will cost extra.</FreeText></Answer><Answer><QuestionIdentifier>response14</QuestionIdentifier><FreeText>Sorry for asking such personal questions, I'll have to look at the front first. </FreeText></Answer><Answer><QuestionIdentifier>response21</QuestionIdentifier><FreeText>I'm pretty confident I'm right.</FreeText></Answer><Answer><QuestionIdentifier>response22</QuestionIdentifier><FreeText>That's not nearly enough time. </FreeText></Answer><Answer><QuestionIdentifier>response23</QuestionIdentifier><FreeText>Why do you think I'm wrong?</FreeText></Answer><Answer><QuestionIdentifier>response31</QuestionIdentifier><FreeText>That's weird. </FreeText></Answer><Answer><QuestionIdentifier>response32</QuestionIdentifier><FreeText>I'm not sure I can trust you. </FreeText></Answer><Answer><QuestionIdentifier>response33</QuestionIdentifier><FreeText>Why are you doing this to me?</FreeText></Answer><Answer><QuestionIdentifier>response41</QuestionIdentifier><FreeText>You made an agreement to give us your vehicle. </FreeText></Answer><Answer><QuestionIdentifier>response42</QuestionIdentifier><FreeText>Of course you can.</FreeText></Answer><Answer><QuestionIdentifier>response43</QuestionIdentifier><FreeText>Why not?</FreeText></Answer><Answer><QuestionIdentifier>response51</QuestionIdentifier><FreeText>How could I possibly know that?</FreeText></Answer><Answer><QuestionIdentifier>response52</QuestionIdentifier><FreeText>Probably someone who is mad at you.</FreeText></Answer><Answer><QuestionIdentifier>response53</QuestionIdentifier><FreeText>I don't know, do you have any enemies? </FreeText></Answer><Answer><QuestionIdentifier>response61</QuestionIdentifier><FreeText>General Mcaddie is an asshole.</FreeText></Answer><Answer><QuestionIdentifier>response62</QuestionIdentifier><FreeText>I wouldn't follow him to the lunch hall.</FreeText></Answer><Answer><QuestionIdentifier>response63</QuestionIdentifier><FreeText>I don't respond to Mcaddie.</FreeText></Answer><Answer><QuestionIdentifier>response64</QuestionIdentifier><FreeText>Mcaddie has no control over me.</FreeText></Answer><Answer><QuestionIdentifier>response65</QuestionIdentifier><FreeText>Well if Mcaddie said so, I guess I have to. </FreeText></Answer><Answer><QuestionIdentifier>response71</QuestionIdentifier><FreeText>I told you to forget it.</FreeText></Answer><Answer><QuestionIdentifier>response72</QuestionIdentifier><FreeText>Stop bugging me about it. </FreeText></Answer><Answer><QuestionIdentifier>response73</QuestionIdentifier><FreeText>You can go ahead and fuck off. </FreeText></Answer><Answer><QuestionIdentifier>response81</QuestionIdentifier><FreeText>When have you ever been nice?</FreeText></Answer><Answer><QuestionIdentifier>response82</QuestionIdentifier><FreeText>Maybe you could start by being nice to me. </FreeText></Answer><Answer><QuestionIdentifier>response91</QuestionIdentifier><FreeText>How awful.</FreeText></Answer><Answer><QuestionIdentifier>response92</QuestionIdentifier><FreeText>I hope they have a great life together. </FreeText></Answer></QuestionFormAnswers>",Well at least you know.,Then why did you buy it?,NA,NA,NA,I can only do the back.,"Sorry for being so rude, if I have time I will do the front.","I can do the front, but it will cost extra.","Sorry for asking such personal questions, I'll have to look at the front first.",NA,I'm pretty confident I'm right.,That's not nearly enough time.,Why do you think I'm wrong?,NA,NA,That's weird.,I'm not sure I can trust you.,Why are you doing this to me?,NA,NA,You made an agreement to give us your vehicle.,Of course you can.,Why not?,NA,NA,How could I possibly know that?,Probably someone who is mad at you.,"I don't know, do you have any enemies?",NA,NA,General Mcaddie is an asshole.,I wouldn't follow him to the lunch hall.,I don't respond to Mcaddie.,Mcaddie has no control over me.,"Well if Mcaddie said so, I guess I have to.",I told you to forget it.,Stop bugging me about it.,You can go ahead and fuck off.,NA,NA,When have you ever been nice?,Maybe you could start by being nice to me.,NA,NA,NA,How awful.,I hope they have a great life together.,NA,NA,NA
