HITID,convo_1,convo_2,convo_3,convo_4,convo_5,convo_6,convo_7,convo_8,convo_9,convo_10
31GN6YMHLPS2XEYMT9L87W9DVTKWSZ,"[""""<b>A:</b> It's been very sunny lately, hasn't it?"""", '<b>B:</b> Yes, it has. Some rain would be very nice.', """"<b>A:</b> I don't think it will rain for quite some time.""""]""","['<b>A:</b> What are you going to do about your death?', """"<b>B:</b> Well, mostly I'll try to avoid it."""", '<b>A:</b> I mean, are you going to get buried or cremated?']""","['<b>A:</b> My grandma bought me some chocolates yesterday.', '<b>B:</b> That is an impressive-looking box.', '<b>A:</b> She said they were imported chocolates.']""","['<b>A:</b> Can you help me find an apartment?', '<b>B:</b> Sure, I would be happy to help.', """"<b>A:</b> I'm having trouble starting my search.""""]""","['<b>A:</b> This is Joseph Walters, the inspector.', """"<b>B:</b> Hello, Joseph. I'm the buyer, Mrs. Smith"""", """"<b>A:</b> Hello, Mrs. Smith. I've done a preliminary check of the property.""""]""","[""""<b>A:</b> Doesn't that new Godzilla movie look good?"""", '<b>B:</b> The effects are much better than in the old movies.', '<b>A:</b> The storyline sounds interesting, too.']""","[""""<b>A:</b> What's this stain?"""", """"<b>B:</b> I don't know."""", '<b>A:</b> It looks like blood.']""","['<b>A:</b> Where are you going?', '<b>B:</b> I have to walk the dog.', '<b>A:</b> What kind of dog do you have?']""","['<b>A:</b> They should increase the voting age to 21.', '<b>B:</b> Why do you think they should do that?', """"<b>A:</b> Well, people can't drink until they're 21.""""]""","['<b>A:</b> You look troubled.', '<b>B:</b> I feel terrible.', """"<b>A:</b> What's the problem?""""]"""
33P2GD6NRNSMC5QPT1Q6F78GZBUKH6,"[""""<b>A:</b> Let's play cards."""", """"<b>B:</b> I don't know any card games."""", """"<b>A:</b> I'll teach you one.""""]""","[""""<b>A:</b> Something's wrong with my computer."""", '<b>B:</b> Exactly what?', '<b>A:</b> All I get is a black screen.']""","['<b>A:</b> You look lost. Are you in need of any directions?', '<b>B:</b> I was just about to ask someone for directions. Thank you for noticing.', '<b>A:</b> Where are you from?']""","[""""<b>A:</b> You're yawning."""", '<b>B:</b> I sure am.', '<b>A:</b> You should go to bed.']""","[""""<b>A:</b> What's wrong? You look sad."""", '<b>B:</b> I was rejected from my dream school.', """"<b>A:</b> I'm sorry to hear that.""""]""","['<b>A:</b> I was hoping you could help me.', """"<b>B:</b> I'll try. What help do you need?"""", """"<b>A:</b> I'm having an interview tomorrow morning. I'm very nervous.""""]""","[""""<b>A:</b> I'm starving!"""", """"<b>B:</b> Me too. Let's get something to eat."""", '<b>A:</b> What would you like?']""","['<b>A:</b> That is such a cute dress!', '<b>B:</b> Thanks! I bought it yesterday.', '<b>A:</b> Have you worn it yet?']""","[""""<b>A:</b> Hey Dennis, this is Ron. How's it going?"""", """"<b>B:</b> Hi, Ron. I'm looking for a summer job. I was hoping you could help me."""", '<b>A:</b> Okay, how can I help you?']""","['<b>A:</b> Mom, are there animals in the forest?', '<b>B:</b> Yes, there are many different kinds.', """"<b>A:</b> Then why haven't we seen any?""""]"""
3PZDSVZ3J5HT8ZNXB7Y3DAGGO1DN4S,"['<b>A:</b> I like a window seat!', '<b>B:</b> Why are you always so excited about sitting there?', '<b>A:</b> I like being able to look outside.']""","['<b>A:</b> The prices on fruit have really gone up this year!', """"<b>B:</b> Yes, they have. It's ridiculous!"""", '<b>A:</b> The fruit is not of good quality, either.']""","['<b>A:</b> We need a new mattress.', """"<b>B:</b> What's the matter with this one?"""", """"<b>A:</b> It's not comfortable.""""]""","['<b>A:</b> I have to clean the house.', """"<b>B:</b> Yes, it's very dirty."""", '<b>A:</b> You can help me.']""","['<b>A:</b> Ow! That really hurts!', '<b>B:</b> Are you alright? What happened?', '<b>A:</b> I accidentally cut myself.']""","['<b>A:</b> Are you married?', """"<b>B:</b> No. I'm divorced."""", '<b>A:</b> When did you get divorced?']""","['<b>A:</b> My brother smokes three packs a day.', '<b>B:</b> Three packs of what?', '<b>A:</b> Cigarettes, of course.']""","['<b>A:</b> Quick! Get in here and wait out the storm!', '<b>B:</b> Oh, my word. Thank you so much.', """"<b>A:</b> It's raining cats and dogs out there.""""]""","['<b>A:</b> Hi John, this is Katy.', """"<b>B:</b> It's so nice to hear your voice."""", '<b>A:</b> I just wanted to call you and thank you for the lovely time last Friday.']""","['<b>A:</b> The Beatles are the best.', '<b>B:</b> They are the best musical group ever.', '<b>A:</b> I love all their songs.']"""
3XBYQ44Z6P43CEB1I9QYH15ZXCYWTO,"['<b>A:</b> The house down the street is on fire!', '<b>B:</b> How do you know?', '<b>A:</b> There is smoke coming up from the house!']""","['<b>A:</b> Does it snow in your hometown?', """"<b>B:</b> Sometimes, when it's very cold."""", """"<b>A:</b> I've never seen snow. What is it like?""""]""","['<b>A:</b> I need a new computer.', """"<b>B:</b> What's the matter with yours?"""", """"<b>A:</b> It's six years old.""""]""","[""""<b>A:</b> Don't read that text message now!"""", """"<b>B:</b> Why not? We're in the middle of traffic."""", """"<b>A:</b> It doesn't matter, but it is against the law.""""]""","['<b>A:</b> Do you know which bus will get me from Maywood to Cal State LA?', """"<b>B:</b> Yes, I do. You'll need to take two buses."""", '<b>A:</b> Which bus should I take first?']""","['<b>A:</b> My laptop is so slow.', '<b>B:</b> Buy a new one.', '<b>A:</b> I would if I had the money.']""","['<b>A:</b> Why are you holding your mouth?', '<b>B:</b> I think I cracked a tooth. It hurts so much.', '<b>A:</b> Did you look in the mirror?']""","['<b>A:</b> Do you listen to the radio?', '<b>B:</b> I listen day and night.', '<b>A:</b> What do you listen to?']""","[""""<b>A:</b> I'd like to order room service, please."""", '<b>B:</b> What would you like to order?', """"<b>A:</b> I'm really hungry. What are my choices?""""]""","['<b>A:</b> This floor is falling apart.', '<b>B:</b> How can you tell?', '<b>A:</b> Are you kidding me? Step over here.']"""
3ECKRY5B1QWHXV0VZKB12YX83XMZI0,"['<b>A:</b> Why are you taking this class?', '<b>B:</b> I need it to transfer. You?', """"<b>A:</b> Me too! I would never take Speech 101 if I didn't need it.""""]""","[""""<b>A:</b> I'm so bad at picking out gifts for my husband."""", '<b>B:</b> The eternal question of what to get for the man who has everything.', '<b>A:</b> What do you suggest?']""","[""""<b>A:</b> $140. I can't believe it."""", '<b>B:</b> What are you talking about?', '<b>A:</b> I got a ticket downtown for $140.']""","['<b>A:</b> Did you hear about the ball player?', '<b>B:</b> The home run hitter on drugs?', '<b>A:</b> He said a doctor helped him with a personal problem.']""","['<b>A:</b> So, how much is the ticket going to cost?', """"<b>B:</b> Well, it's going to be $200."""", '<b>A:</b> $200 for a parking ticket?']""","[""""<b>A:</b> My grandma's apartment smells funny."""", '<b>B:</b> So does mine.', """"<b>A:</b> I think it's an old people's smell.""""]""","['<b>A:</b> I got accepted to all of the schools I applied to.', '<b>B:</b> Congrats! You totally deserve it.', '<b>A:</b> How many schools did you apply to?']""","['<b>A:</b> Hey, Richard, I could sure use your help.', '<b>B:</b> What is it, Jerry?', """"<b>A:</b> I can't seem to land an interview.""""]""","['<b>A:</b> Look! The bus is coming!', """"<b>B:</b> Let's see if we can cross the street in time to catch it."""", """"<b>A:</b> I don't think we are going to make it.""""]""","[""""<b>A:</b> Greetings, neighbor. How's it going?"""", """"<b>B:</b> Hello to you! It's going just fine. Welcome to the neighborhood."""", '<b>A:</b> Thank you. How long have you been living here?']"""
32CAVSKPCEPPBQANLQRNT717KDWU1E,"['<b>A:</b> People are funny.', '<b>B:</b> They sure are.', '<b>A:</b> Did you hear about the pilot?']""","['<b>A:</b> You need to try harder in school!', '<b>B:</b> I am doing well in school.', '<b>A:</b> Then why are your marks in science so low?']""","['<b>A:</b> Can you teach me to swim?', """"<b>B:</b> Why don't you take a class instead?"""", '<b>A:</b> Swim classes are embarrassing.']""","['<b>A:</b> Good morning. How are you today?', """"<b>B:</b> I'm doing well. Thank you."""", '<b>A:</b> Are you here for our workshop today?']""","[""""<b>A:</b> I'm a good card player."""", '<b>B:</b> Why is that?', '<b>A:</b> Because I watch the other players.']""","['<b>A:</b> Do you go to college?', '<b>B:</b> Yes, I do.', '<b>A:</b> What college do you go to?']""","['<b>A:</b> So, how much is the ticket going to cost?', """"<b>B:</b> Well, it's going to be $200."""", '<b>A:</b> $200 for a parking ticket?']""","[""""<b>A:</b> I'm calling because I got the invitation to your party in the mail."""", '<b>B:</b> I was worried that maybe it got lost.', '<b>A:</b> No, it came in the mail yesterday.']""","['<b>A:</b> Good Morning! EDD, how can I help you?', '<b>B:</b> Hello, I recently lost my job. Can I file for unemployment?', '<b>A:</b> Yes, you certainly can.']""","['<b>A:</b> Is this Gage Avenue?', '<b>B:</b> No, this is Florence Avenue.', """"<b>A:</b> Oh, no. I must've gotten off the bus too early.""""]"""
3SA4EMRVJV2CCWH98LOT5WVY74YP0A,"[""""<b>A:</b> I think I'm going to head home."""", """"<b>B:</b> Already? It's only midday!"""", '<b>A:</b> I think I have a fever.']""","['<b>A:</b> You seem a little lost. Can I be of some assistance?', '<b>B:</b> That would be nice of you. I just have one question.', '<b>A:</b> You can ask as many as you want.']""","[""""<b>A:</b> I've run out of money for my iTunes!"""", '<b>B:</b> You used it all up already?', """"<b>A:</b> I bought my favorite artists' albums today.""""]""","['<b>A:</b> Why are you taking this class?', '<b>B:</b> I need it to transfer. You?', """"<b>A:</b> Me too! I would never take Speech 101 if I didn't need it.""""]""","['<b>A:</b> What happened to your car?', '<b>B:</b> I got a dent in the parking lot.', '<b>A:</b> How did you get it?']""","['<b>A:</b> Why do I have a negative balance in my checking account?', '<b>B:</b> This means you used more money than you actually had in your account.', '<b>A:</b> So what do I do now?']""","[""""<b>A:</b> Help, please. My key won't open the front door to my apartment."""", '<b>B:</b> Oh, no. Let me try to help you.', """"<b>A:</b> Thank you, but I don't think there's much you can do.""""]""","['<b>A:</b> I hate to go outside.', '<b>B:</b> Me too.', '<b>A:</b> Why do you hate to go outside?']""","['<b>A:</b> What are those men doing with brooms?', '<b>B:</b> I think those are special brushes.', '<b>A:</b> Are they going to clean the ice?']""","['<b>A:</b> My parents go to church every Sunday.', '<b>B:</b> They trust in God.', '<b>A:</b> They hope they will go to heaven.']"""
3HRWUH63QU2B4IRXPCHDI2MUOX8N5X,"[""""<b>A:</b> Let's discuss the security deposit."""", '<b>B:</b> Do you have the full amount for the deposit?', '<b>A:</b> I think I do. How much was it again?']""","['<b>A:</b> Take off your shoes and walk in the sand!', """"<b>B:</b> I'd rather not. I bought swim shoes."""", """"<b>A:</b> That's no fun!""""]""","['<b>A:</b> Do you know why I stopped you?', '<b>B:</b> No, officer. Why?', '<b>A:</b> You failed to stop at the stop sign.']""","['<b>A:</b> What is there to eat?', """"<b>B:</b> I don't know. Look in the fridge."""", """"<b>A:</b> I think I'll make a sandwich.""""]""","['<b>A:</b> Good morning. How are you today?', """"<b>B:</b> I'm fantastic. How about yourself?"""", """"<b>A:</b> That's great! I'm good, but I feel a little sick.""""]""","[""""<b>A:</b> Let's book a trip to Puerto Rico."""", '<b>B:</b> There are so many online services that let us book from our computer right here at home.', """"<b>A:</b> How will we know we're getting a good deal though?""""]""","['<b>A:</b> I am so hungry.', """"<b>B:</b> Why don't you heat up a TV dinner?"""", """"<b>A:</b> I'm tired of eating frozen food!""""]""","['<b>A:</b> Do you like baseball?', """"<b>B:</b> I've never watched a game."""", """"<b>A:</b> You've never even seen it on television?""""]""","['<b>A:</b> Are you locked out of your apartment?', '<b>B:</b> It appears that I am.', '<b>A:</b> Did you forget your key inside your apartment?']""","[""""<b>A:</b> My girlfriend's mom got mad at me at the dinner table."""", '<b>B:</b> Why was that?', '<b>A:</b> I sprinkled salt and pepper on the food before I tasted it.']"""
3SMIWMMK615ICRQQIEG8MXR1GQ5WUF,"['<b>A:</b> Why are you eating another apple?', '<b>B:</b> You know what they say about apples!', """"<b>A:</b> No, I'm afraid I don't know.""""]""","[""""<b>A:</b> Greetings, neighbor. How's it going?"""", """"<b>B:</b> Hello to you! It's going just fine. Welcome to the neighborhood."""", '<b>A:</b> Thank you. How long have you been living here?']""","['<b>A:</b> Life is hard.', '<b>B:</b> It sure is.', '<b>A:</b> I thought school was hard.']""","[""""<b>A:</b> Let's go to the mall."""", '<b>B:</b> What for?', '<b>A:</b> I would like to buy a new sweater.']""","[""""<b>A:</b> Dad, I don't have my own car."""", '<b>B:</b> Your mom and I talked to you about this.', """"<b>A:</b> I wasn't paying attention.""""]""","['<b>A:</b> Why is the guy behind me honking?', '<b>B:</b> You are going too slow.', '<b>A:</b> I am driving at the speed limit!']""","['<b>A:</b> Be careful how you peel those potatoes!', """"<b>B:</b> What's so hard about peeling potatoes?"""", """"<b>A:</b> You're holding the knife wrong.""""]""","['<b>A:</b> Hi sir. I have seen you a lot.', '<b>B:</b> I come to this restaurant twice a week.', '<b>A:</b> May I ask why?']""","['<b>A:</b> Hey, where were you all afternoon?', '<b>B:</b> I was working out at the health club!', '<b>A:</b> You went to the gym?']""","['<b>A:</b> Why did you throw snow at your brother?', '<b>B:</b> It was a snowball fight.', """"<b>A:</b> He said that he didn't know you were playing.""""]"""
3L84EBDQ372DEVRXZMT3SZO8RSYKKA,"['<b>A:</b> Hey Alice, do you have a stapler I can use?', """"<b>B:</b> Of course I do. It's on my desk."""", '<b>A:</b> Thanks. Mine broke two weeks ago.']""","['<b>A:</b> I have decided not to transfer.', '<b>B:</b> Why not? You kept saying you wanted to.', """"<b>A:</b> I know, but it's so hard getting accustomed to a new school.""""]""","['<b>A:</b> Can I check the apartment for any damages?', '<b>B:</b> Absolutely, let me accompany you.', '<b>A:</b> Did the previous tenant maintain the apartment well?']""","['<b>A:</b> Election Day is next Tuesday.', '<b>B:</b> Did you register to vote?', '<b>A:</b> How do you register?']""","[""""<b>A:</b> I'm sorry, but today's bus tour has been canceled because of the weather."""", '<b>B:</b> Now what am I supposed to do?', """"<b>A:</b> The hotel's concierge will be happy to find you tickets to a local theater production.""""]""","['<b>A:</b> Have you checked your smoke detectors recently?', """"<b>B:</b> No, I wasn't even aware we had smoke detectors."""", """"<b>A:</b> All the apartments are equipped with them. It's an essential safety feature.""""]""","['<b>A:</b> Can you cut my hair a little differently this time?', '<b>B:</b> Sure! How would you like it cut?', '<b>A:</b> Well, last time it was a little too long.']""","['<b>A:</b> Did you write a letter to grandma?', '<b>B:</b> Yes, I did.', '<b>A:</b> Did you tell her about school?']""","['<b>A:</b> I lost my new pen.', '<b>B:</b> Where did you lose it?', """"<b>A:</b> I don't know.""""]""","['<b>A:</b> I hope this neighborhood is more to your liking.', '<b>B:</b> Yes, it definitely is.', """"<b>A:</b> It's a little more money, but I think it's a great fit for you.""""]"""
3OWZNK3RYLPW0BSJ4UR1YQBCCJAU2V,"['<b>A:</b> I love playing all of these old fashioned games!', """"<b>B:</b> Me, too! Too bad it's so expensive."""", """"<b>A:</b> I wish they'd cost nickels instead of quarters.""""]""","['<b>A:</b> Do you ever take public transportation to get around?', '<b>B:</b> Before I frequently did. Not so much anymore. Why do you ask?', '<b>A:</b> I wanted some information about the public transportation that is available in the city.']""","['<b>A:</b> What are we having for lunch?', """"<b>B:</b> I'm making some sandwiches."""", '<b>A:</b> Can I make some lemonade to drink?']""","['<b>A:</b> Beer is a powerful drug.', '<b>B:</b> So are cigarettes.', '<b>A:</b> Which would you prefer?']""","[""""<b>A:</b> I don't like seeing so many police officers patrolling."""", """"<b>B:</b> They're just trying to keep the city safe."""", '<b>A:</b> I think they just like giving people tickets.']""","['<b>A:</b> When are we going to stop?', """"<b>B:</b> We'll stop at the next McDonald's."""", '<b>A:</b> How far away is that?']""","[""""<b>A:</b> Hi! Is there a specific car you're looking for?"""", """"<b>B:</b> I'm looking for a convertible."""", '<b>A:</b> We have a wide selection right here.']""","['<b>A:</b> May I have a table for three?', '<b>B:</b> Of course. Here is your number.', '<b>A:</b> About how long will it take you to call this number?']""","['<b>A:</b> I found a new social networking site.', """"<b>B:</b> That's cool. What's it called?"""", """"<b>A:</b> It's called Tumblr. It's a blog site.""""]""","['<b>A:</b> I gained so much weight because my college dining hall is all-you-can-eat.', '<b>B:</b> It\'s called the """"freshman 15.""""', '<b>A:</b> What is that exactly?']"""
3IH9TRB0FBZK2ZFNR929A4DWQI9I1U,"['<b>A:</b> Is there a gym in this hotel?', '<b>B:</b> Yes, the fitness center is located on the third floor.', '<b>A:</b> Is there a charge for me to use it?']""","['<b>A:</b> Have you ever been to that popular hot dog stand?', '<b>B:</b> No, I have not.', '<b>A:</b> My friends said the hot dogs are really great.']""","['<b>A:</b> Excuse me! I need a ticket.', '<b>B:</b> You owe me a dollar.', '<b>A:</b> I already put one in!']""","['<b>A:</b> I love to watch """"Judge Judy.""""', '<b>B:</b> Is that a TV show?', """"<b>A:</b> Yes. It's on every afternoon.""""]""","['<b>A:</b> Wow! Our order is sure taking long.', """"<b>B:</b> Yes, it is. It's been nearly 45 minutes now."""", """"<b>A:</b> Well, maybe they're just very busy.""""]""","['<b>A:</b> Is this table okay?', """"<b>B:</b> No, it's too close to the kitchen door."""", '<b>A:</b> How about this table?']""","['<b>A:</b> What are some of the best things to see in this city?', '<b>B:</b> If you want to go sightseeing, we have a tour that leaves from the hotel.', """"<b>A:</b> I'd rather explore the city on my own.""""]""","[""""<b>A:</b> I don't know what to give my dad for Father's Day."""", """"<b>B:</b> Why don't you give him a card?"""", '<b>A:</b> I already bought a card, but I want to give him a present, too.']""","['<b>A:</b> I want to buy my son a skateboard.', """"<b>B:</b> Do you know what kind of board he'd like?"""", '<b>A:</b> I was thinking a basic board.']""","['<b>A:</b> Do you like my new bicycle?', '<b>B:</b> It looks very sporty!', """"<b>A:</b> It's a racing bike. I bought it so I could be in the triathlon.""""]"""
3OB6JN3A9QPURN4VAIFG8O2QBPNRMF,"['<b>A:</b> Do you get PBS on TV?', '<b>B:</b> Yes, everybody gets the Public Broadcasting System.', '<b>A:</b> It puts me to sleep.']""","['<b>A:</b> Excuse me, where can I find a dictionary?', '<b>B:</b> What kind of dictionary would you like?', '<b>A:</b> A bilingual dictionary would be nice.']""","['<b>A:</b> Today is Friday the thirteenth.', """"<b>B:</b> That's a bad day."""", """"<b>A:</b> It's supposed to be unlucky.""""]""","['<b>A:</b> Are you sure you want to go to Seattle?', '<b>B:</b> Yes, I am sure.', """"<b>A:</b> It's an eight-hour drive.""""]""","['<b>A:</b> I have a date with Mary tomorrow.', """"<b>B:</b> Don't you have a date with Dorothy?"""", '<b>A:</b> My date with Dorothy is at 12 p.m.']""","[""""<b>A:</b> I'm going to take a nap."""", '<b>B:</b> You should unplug the phone.', """"<b>A:</b> That's a good idea.""""]""","['<b>A:</b> I have a really bad headache. What do you recommend?', '<b>B:</b> You can purchase some over-the-counter pain relievers in aisle 6.', '<b>A:</b> Do I need a prescription for those?']""","['<b>A:</b> Come inside my apartment! Make yourself feel at home.', '<b>B:</b> Thank you for letting me visit you today.', """"<b>A:</b> It's always nice to meet extra tenants of the apartment.""""]""","['<b>A:</b> Hello, this is my first time here. I could use some help.', '<b>B:</b> Okay, I can help. What is it you want to do?', '<b>A:</b> I need to use the database on your computer.']""","['<b>A:</b> I missed my connecting flight to Washington D.C.', '<b>B:</b> How did you miss your flight?', '<b>A:</b> I was sitting in the airport bar and I lost track of time.']"""
3SV8KD29L4S83QQJZNWDFECLV1BZKB,"['<b>A:</b> Did you see the police posters in the neighborhood?', """"<b>B:</b> I haven't seen them. What do they say?"""", '<b>A:</b> They say not to leave anything valuable in your cars at night.']""","[""""<b>A:</b> I'll pay the restaurant bill."""", """"<b>B:</b> No, I'll pay."""", """"<b>A:</b> You always pay. I'll do it this time.""""]""","[""""<b>A:</b> What is that black goo you're carrying?"""", """"<b>B:</b> It's roofing tar."""", '<b>A:</b> Are you replacing your shingles?']""","['<b>A:</b> Do any public buses run nearby?', '<b>B:</b> Yes, in fact many buses do.', '<b>A:</b> Can you tell me where I can catch them?']""","[""""<b>A:</b> I'd like to buy some flowers for my best friend's birthday."""", """"<b>B:</b> What is your friend's favorite color?"""", '<b>A:</b> She loves the color pink.']""","[""""<b>A:</b> I'm worried."""", '<b>B:</b> Worried about what?', """"<b>A:</b> I'm getting married.""""]""","[""""<b>A:</b> Mom, I'm hungry."""", '<b>B:</b> Look in the fridge.', """"<b>A:</b> I'm looking. There's nothing to eat.""""]""","['<b>A:</b> The floor to my apartment is badly damaged.', """"<b>B:</b> I'm sorry to hear that. How bad is it?"""", """"<b>A:</b> It's practically falling apart.""""]""","[""""<b>A:</b> I can't read my book."""", '<b>B:</b> Turn on the light.', '<b>A:</b> The light is on.']""","['<b>A:</b> Did you finish the math project?', '<b>B:</b> I have not started.', """"<b>A:</b> But it's due tomorrow!""""]"""
3QREJ3J433XOY19FKM547Z1NGS3KLD,"['<b>A:</b> You have not driven in a month.', '<b>B:</b> I just like staying at home these days.', '<b>A:</b> What is really going on?']""","['<b>A:</b> Did you fasten your seatbelt?', '<b>B:</b> It bothers my neck.', """"<b>A:</b> Just adjust the strap so it doesn't bother you.""""]""","['<b>A:</b> That was such a rush.', '<b>B:</b> What did you do?', '<b>A:</b> It was my first time voting in an election.']""","['<b>A:</b> I am going to get the meatloaf.', '<b>B:</b> Get anything but the meatloaf.', """"<b>A:</b> What's wrong with meatloaf?""""]""","['<b>A:</b> Hello, how can I help you?', """"<b>B:</b> I'm calling about your delivery service."""", '<b>A:</b> What seems to be the problem?']""","['<b>A:</b> My ear is killing me.', """"<b>B:</b> What's the matter?"""", '<b>A:</b> I was on a plane.']""","[""""<b>A:</b> I'd like to make a withdrawal."""", '<b>B:</b> Will that be from your checking or savings account?', """"<b>A:</b> I don't have a savings account.""""]""","[""""<b>A:</b> I'm looking for an apartment. Have you seen any apartments for rent?"""", """"<b>B:</b> No, I have not. I'll keep an eye out."""", """"<b>A:</b> Thank you. That's very helpful of you.""""]""","['<b>A:</b> Hello, this is Isabel Foster.', '<b>B:</b> Hi, Isabel. Why are you calling? You can just come to my office.', """"<b>A:</b> I'm actually not in the office right now.""""]""","['<b>A:</b> Why do you have so many full trash bags?', """"<b>B:</b> I had a party last night. I'm cleaning up now and tossing them away."""", '<b>A:</b> Wait! What are you doing?']"""
341YLJU21IZRRKXJAD2NFNN1IONI2B,"['<b>A:</b> You have so many portraits on your wall!', """"<b>B:</b> I love displaying all the pictures I've taken."""", '<b>A:</b> How do you hang all the picture frames?']""","[""""<b>A:</b> It's been so long since I've seen you!"""", """"<b>B:</b> I know. You haven't changed a bit."""", """"<b>A:</b> Oh, stop lying. I've gained a little weight.""""]""","[""""<b>A:</b> I'm surprised to see you out running."""", '<b>B:</b> I want to join the track team next semester.', """"<b>A:</b> Is that why you're training so hard?""""]""","['<b>A:</b> This is it. We can move in starting tomorrow.', '<b>B:</b> No way! Really?', """"<b>A:</b> Yup. We cleared escrow. It's officially ours now.""""]""","['<b>A:</b> I have never seen you before.', '<b>B:</b> I am a new student.', '<b>A:</b> Where are you from?']""","['<b>A:</b> How smart are you?', """"<b>B:</b> I don't know. I think I'm average."""", '<b>A:</b> Did you ever take an IQ test?']""","['<b>A:</b> I hate flying.', '<b>B:</b> So do I.', '<b>A:</b> A long time ago, flying used to be okay.']""","['<b>A:</b> Have you gone to vote today?', """"<b>B:</b> I didn't even know there was an election."""", """"<b>A:</b> Didn't you get the pamphlet?""""]""","[""""<b>A:</b> I'm sorry to knock on your door at this late hour."""", '<b>B:</b> Is there something wrong?', """"<b>A:</b> It's just one minor issue I have to bring up with you.""""]""","['<b>A:</b> Is this a clean restaurant?', '<b>B:</b> Well, the tables and chairs look okay.', """"<b>A:</b> Okay, let's sit down.""""]"""
