AssignmentId,WorkerId,HITId,AssignmentStatus,AutoApprovalTime,ApprovalTime,AcceptTime,SubmitTime,Answer,response101,response102,response103,response104,response105,response11,response12,response13,response14,response15,response21,response22,response23,response24,response25,response31,response32,response33,response34,response35,response41,response42,response43,response44,response45,response51,response52,response53,response54,response55,response61,response62,response63,response64,response65,response71,response72,response73,response74,response75,response81,response82,response83,response84,response85,response91,response92,response93,response94,response95
3LBXNTKX0RV13J46KAM4G4EJZGJX9H,A3OK67ZUPCJR1K,39KMGHJ4RZA9OFDPR093QVUQZOA00M,Submitted,2019-06-21 12:23:16-04:00,NA,2019-06-19 12:04:24-04:00,2019-06-19 12:23:16-04:00,"<?xml version=""1.0"" encoding=""ASCII""?><QuestionFormAnswers xmlns=""http://mechanicalturk.amazonaws.com/AWSMechanicalTurkDataSchemas/2005-10-01/QuestionFormAnswers.xsd""><Answer><QuestionIdentifier>response101</QuestionIdentifier><FreeText>I don't know, can you help me look</FreeText></Answer><Answer><QuestionIdentifier>response102</QuestionIdentifier><FreeText>With my house key, but it isn't there.</FreeText></Answer><Answer><QuestionIdentifier>response103</QuestionIdentifier><FreeText>Oh, thanks! I found them.</FreeText></Answer><Answer><QuestionIdentifier>response104</QuestionIdentifier><FreeText>You had the keys last.</FreeText></Answer><Answer><QuestionIdentifier>response105</QuestionIdentifier><FreeText>I don't remember where I left it.</FreeText></Answer><Answer><QuestionIdentifier>response11</QuestionIdentifier><FreeText>We should come back tomorrow.</FreeText></Answer><Answer><QuestionIdentifier>response12</QuestionIdentifier><FreeText>Why don't we do this more often.</FreeText></Answer><Answer><QuestionIdentifier>response13</QuestionIdentifier><FreeText>I'm so glad we could both do this.</FreeText></Answer><Answer><QuestionIdentifier>response14</QuestionIdentifier><FreeText>I wish every day could be like today.</FreeText></Answer><Answer><QuestionIdentifier>response15</QuestionIdentifier><FreeText>The salt air really does bring back memories.</FreeText></Answer><Answer><QuestionIdentifier>response21</QuestionIdentifier><FreeText>Everyone's skills could improve.</FreeText></Answer><Answer><QuestionIdentifier>response22</QuestionIdentifier><FreeText>Funny, do you want to join me?</FreeText></Answer><Answer><QuestionIdentifier>response23</QuestionIdentifier><FreeText>I think it would help us both.</FreeText></Answer><Answer><QuestionIdentifier>response24</QuestionIdentifier><FreeText>It would be fun, you should join me.</FreeText></Answer><Answer><QuestionIdentifier>response31</QuestionIdentifier><FreeText>Sorry to hear that, can you tell me more about the claim you are filing?</FreeText></Answer><Answer><QuestionIdentifier>response32</QuestionIdentifier><FreeText>Ok, I will just need a few details.</FreeText></Answer><Answer><QuestionIdentifier>response33</QuestionIdentifier><FreeText>Of course, I'm sorry that you are unhappy. Can you tell me more about the issue.</FreeText></Answer><Answer><QuestionIdentifier>response34</QuestionIdentifier><FreeText>Is this the first time bringing this issue to our attention, or do you have a ticket I can reference.</FreeText></Answer><Answer><QuestionIdentifier>response35</QuestionIdentifier><FreeText>Oh no, that's unfortunate. What type of claim do you need help with.</FreeText></Answer><Answer><QuestionIdentifier>response41</QuestionIdentifier><FreeText>Want some company.</FreeText></Answer><Answer><QuestionIdentifier>response42</QuestionIdentifier><FreeText>Sounds like a plan, going to watch anything good?</FreeText></Answer><Answer><QuestionIdentifier>response43</QuestionIdentifier><FreeText>If you're up to it, some of us are going out.</FreeText></Answer><Answer><QuestionIdentifier>response51</QuestionIdentifier><FreeText>Next check your mirrors.</FreeText></Answer><Answer><QuestionIdentifier>response52</QuestionIdentifier><FreeText>Next, make sure all the passengers have fastened their seat belts.</FreeText></Answer><Answer><QuestionIdentifier>response53</QuestionIdentifier><FreeText>Next we wait for the pilot to announce take off.</FreeText></Answer><Answer><QuestionIdentifier>response54</QuestionIdentifier><FreeText>We just sit back and relax.</FreeText></Answer><Answer><QuestionIdentifier>response61</QuestionIdentifier><FreeText>Where do you want to go first.</FreeText></Answer><Answer><QuestionIdentifier>response62</QuestionIdentifier><FreeText>I wonder if there is a good coffee shop near by.</FreeText></Answer><Answer><QuestionIdentifier>response63</QuestionIdentifier><FreeText>Do you want to make a plan, or shall we just wander.</FreeText></Answer><Answer><QuestionIdentifier>response64</QuestionIdentifier><FreeText>I know, its really exciting.</FreeText></Answer><Answer><QuestionIdentifier>response65</QuestionIdentifier><FreeText>With everything so new, its a bit overwhelming. </FreeText></Answer><Answer><QuestionIdentifier>response71</QuestionIdentifier><FreeText>Good afternoon James, I'm Amy and will be assisting you today.</FreeText></Answer><Answer><QuestionIdentifier>response72</QuestionIdentifier><FreeText>Thank you James, how can I help you today.</FreeText></Answer><Answer><QuestionIdentifier>response73</QuestionIdentifier><FreeText>Great, thank you James. Is this call about a new issues or a pre-existing one.</FreeText></Answer><Answer><QuestionIdentifier>response81</QuestionIdentifier><FreeText>Yes, but you also need to balance what you eat each meal.</FreeText></Answer><Answer><QuestionIdentifier>response82</QuestionIdentifier><FreeText>Eating three times a day, doesn't mean those meals are healthy.</FreeText></Answer><Answer><QuestionIdentifier>response83</QuestionIdentifier><FreeText>Ok, so which meals do you want to work on first.</FreeText></Answer><Answer><QuestionIdentifier>response84</QuestionIdentifier><FreeText>It's not fine. Three unbalanced meals won't help you.</FreeText></Answer><Answer><QuestionIdentifier>response85</QuestionIdentifier><FreeText>What do you eat for those meals.</FreeText></Answer><Answer><QuestionIdentifier>response91</QuestionIdentifier><FreeText>He didn't really say much, but will call me back tomorrow.</FreeText></Answer><Answer><QuestionIdentifier>response92</QuestionIdentifier><FreeText>He said I didn't qualify for the benefits, so we are back to square one.</FreeText></Answer><Answer><QuestionIdentifier>response93</QuestionIdentifier><FreeText>I'm going to get the benefits, but I need to fill out more paperwork.</FreeText></Answer><Answer><QuestionIdentifier>response94</QuestionIdentifier><FreeText>Yes, he said I qualify and will be getting the benefits.</FreeText></Answer><Answer><QuestionIdentifier>response95</QuestionIdentifier><FreeText>He said he wasn't the right person to talk to. I need to call HR instead and they might be able to help me.</FreeText></Answer></QuestionFormAnswers>","I don't know, can you help me look","With my house key, but it isn't there.","Oh, thanks! I found them.",You had the keys last.,I don't remember where I left it.,We should come back tomorrow.,Why don't we do this more often.,I'm so glad we could both do this.,I wish every day could be like today.,The salt air really does bring back memories.,Everyone's skills could improve.,"Funny, do you want to join me?",I think it would help us both.,"It would be fun, you should join me.",NA,"Sorry to hear that, can you tell me more about the claim you are filing?","Ok, I will just need a few details.","Of course, I'm sorry that you are unhappy. Can you tell me more about the issue.","Is this the first time bringing this issue to our attention, or do you have a ticket I can reference.","Oh no, that's unfortunate. What type of claim do you need help with.",Want some company.,"Sounds like a plan, going to watch anything good?","If you're up to it, some of us are going out.",NA,NA,Next check your mirrors.,"Next, make sure all the passengers have fastened their seat belts.",Next we wait for the pilot to announce take off.,We just sit back and relax.,NA,Where do you want to go first.,I wonder if there is a good coffee shop near by.,"Do you want to make a plan, or shall we just wander.","I know, its really exciting.","With everything so new, its a bit overwhelming.","Good afternoon James, I'm Amy and will be assisting you today.","Thank you James, how can I help you today.","Great, thank you James. Is this call about a new issues or a pre-existing one.",NA,NA,"Yes, but you also need to balance what you eat each meal.","Eating three times a day, doesn't mean those meals are healthy.","Ok, so which meals do you want to work on first.",It's not fine. Three unbalanced meals won't help you.,What do you eat for those meals.,"He didn't really say much, but will call me back tomorrow.","He said I didn't qualify for the benefits, so we are back to square one.","I'm going to get the benefits, but I need to fill out more paperwork.","Yes, he said I qualify and will be getting the benefits.",He said he wasn't the right person to talk to. I need to call HR instead and they might be able to help me.
3AAPLD8UCCHN18D5DC9Z4IR15XQHTV,A17BWQR8J2PA7P,3JYPJ2TAYI8390WZB37E83I2DYAFPB,Submitted,2019-06-21 11:07:09-04:00,NA,2019-06-19 10:57:51-04:00,2019-06-19 11:07:09-04:00,"<?xml version=""1.0"" encoding=""ASCII""?><QuestionFormAnswers xmlns=""http://mechanicalturk.amazonaws.com/AWSMechanicalTurkDataSchemas/2005-10-01/QuestionFormAnswers.xsd""><Answer><QuestionIdentifier>response101</QuestionIdentifier><FreeText>Nice to meet you as well.</FreeText></Answer><Answer><QuestionIdentifier>response102</QuestionIdentifier><FreeText>Nice to meet you Christine.</FreeText></Answer><Answer><QuestionIdentifier>response103</QuestionIdentifier><FreeText>Pleased to meet you.</FreeText></Answer><Answer><QuestionIdentifier>response11</QuestionIdentifier><FreeText>Would you accept sexual favors?</FreeText></Answer><Answer><QuestionIdentifier>response12</QuestionIdentifier><FreeText>Average rent for this area is much lower than what you have it at.</FreeText></Answer><Answer><QuestionIdentifier>response13</QuestionIdentifier><FreeText>Can I do some of the lawn maintenance in exchange for lower rent?</FreeText></Answer><Answer><QuestionIdentifier>response14</QuestionIdentifier><FreeText>Can you include water with the price of rent?</FreeText></Answer><Answer><QuestionIdentifier>response21</QuestionIdentifier><FreeText>When are we getting a new one?</FreeText></Answer><Answer><QuestionIdentifier>response22</QuestionIdentifier><FreeText>It was only 5 years old!</FreeText></Answer><Answer><QuestionIdentifier>response23</QuestionIdentifier><FreeText>Where will we get our caffeine fix now?</FreeText></Answer><Answer><QuestionIdentifier>response24</QuestionIdentifier><FreeText>That's true, it was 10 years old.</FreeText></Answer><Answer><QuestionIdentifier>response31</QuestionIdentifier><FreeText>It's for $10,000 under asking price.</FreeText></Answer><Answer><QuestionIdentifier>response32</QuestionIdentifier><FreeText>It's much better as it is a cash offer.</FreeText></Answer><Answer><QuestionIdentifier>response33</QuestionIdentifier><FreeText>It's pretty comparable as I told you its a buyer's market.</FreeText></Answer><Answer><QuestionIdentifier>response34</QuestionIdentifier><FreeText>It's for the entire asking price.</FreeText></Answer><Answer><QuestionIdentifier>response41</QuestionIdentifier><FreeText>The prerequisite classes are all the same though.</FreeText></Answer><Answer><QuestionIdentifier>response42</QuestionIdentifier><FreeText>Biology just wasn't doing it for me anymore.</FreeText></Answer><Answer><QuestionIdentifier>response43</QuestionIdentifier><FreeText>I've learned to hate actual science.</FreeText></Answer><Answer><QuestionIdentifier>response51</QuestionIdentifier><FreeText>Is Lisa short for something?</FreeText></Answer><Answer><QuestionIdentifier>response52</QuestionIdentifier><FreeText>How are you doing today Lisa?</FreeText></Answer><Answer><QuestionIdentifier>response53</QuestionIdentifier><FreeText>Welcome to the day spa Lisa.</FreeText></Answer><Answer><QuestionIdentifier>response61</QuestionIdentifier><FreeText>$200!? I thought the tickets were only $50.</FreeText></Answer><Answer><QuestionIdentifier>response62</QuestionIdentifier><FreeText>Are there any fees included in that $200?</FreeText></Answer><Answer><QuestionIdentifier>response71</QuestionIdentifier><FreeText>I wonder if they lost our order?</FreeText></Answer><Answer><QuestionIdentifier>response72</QuestionIdentifier><FreeText>Probably shouldn't have ordered during a snow storm.</FreeText></Answer><Answer><QuestionIdentifier>response81</QuestionIdentifier><FreeText>I wonder if they lost our order?</FreeText></Answer><Answer><QuestionIdentifier>response82</QuestionIdentifier><FreeText>Probably shouldn't have ordered during a rain storm.</FreeText></Answer><Answer><QuestionIdentifier>response91</QuestionIdentifier><FreeText>Yeah but we are working inside so it doesn't help.</FreeText></Answer><Answer><QuestionIdentifier>response92</QuestionIdentifier><FreeText>That's true, the weather makes today more tolerable.</FreeText></Answer><Answer><QuestionIdentifier>response93</QuestionIdentifier><FreeText>How is 40 degrees and windy nice?</FreeText></Answer></QuestionFormAnswers>",Nice to meet you as well.,Nice to meet you Christine.,Pleased to meet you.,NA,NA,Would you accept sexual favors?,Average rent for this area is much lower than what you have it at.,Can I do some of the lawn maintenance in exchange for lower rent?,Can you include water with the price of rent?,NA,When are we getting a new one?,It was only 5 years old!,Where will we get our caffeine fix now?,"That's true, it was 10 years old.",NA,"It's for $10,000 under asking price.",It's much better as it is a cash offer.,It's pretty comparable as I told you its a buyer's market.,It's for the entire asking price.,NA,The prerequisite classes are all the same though.,Biology just wasn't doing it for me anymore.,I've learned to hate actual science.,NA,NA,Is Lisa short for something?,How are you doing today Lisa?,Welcome to the day spa Lisa.,NA,NA,$200!? I thought the tickets were only $50.,Are there any fees included in that $200?,NA,NA,NA,I wonder if they lost our order?,Probably shouldn't have ordered during a snow storm.,NA,NA,NA,I wonder if they lost our order?,Probably shouldn't have ordered during a rain storm.,NA,NA,NA,Yeah but we are working inside so it doesn't help.,"That's true, the weather makes today more tolerable.",How is 40 degrees and windy nice?,NA,NA
3QHK8ZVMIMIPRI2E4BXCWGEMG7ZBL6,A2UETIA0LL3F48,3JYPJ2TAYI8390WZB37E83I2DYAFPB,Submitted,2019-06-21 11:12:00-04:00,NA,2019-06-19 10:55:17-04:00,2019-06-19 11:12:00-04:00,"<?xml version=""1.0"" encoding=""ASCII""?><QuestionFormAnswers xmlns=""http://mechanicalturk.amazonaws.com/AWSMechanicalTurkDataSchemas/2005-10-01/QuestionFormAnswers.xsd""><Answer><QuestionIdentifier>response101</QuestionIdentifier><FreeText>Hi Christine, glad I swiped right on you</FreeText></Answer><Answer><QuestionIdentifier>response102</QuestionIdentifier><FreeText>Christine... my mom was called Christine too!</FreeText></Answer><Answer><QuestionIdentifier>response11</QuestionIdentifier><FreeText>I could sign an extension to stay longer</FreeText></Answer><Answer><QuestionIdentifier>response12</QuestionIdentifier><FreeText>It's just that my wife died and with her loss of income I'm struggling.</FreeText></Answer><Answer><QuestionIdentifier>response13</QuestionIdentifier><FreeText>Can I take you on a date?</FreeText></Answer><Answer><QuestionIdentifier>response21</QuestionIdentifier><FreeText>I blame Fred, he drinks too much</FreeText></Answer><Answer><QuestionIdentifier>response22</QuestionIdentifier><FreeText>True, but now we can get a fancy new one</FreeText></Answer><Answer><QuestionIdentifier>response23</QuestionIdentifier><FreeText>I should drink tea anyway,  it's much better</FreeText></Answer><Answer><QuestionIdentifier>response31</QuestionIdentifier><FreeText>It's a little better, $149,000</FreeText></Answer><Answer><QuestionIdentifier>response32</QuestionIdentifier><FreeText>In this market, you should take it or stay where you are until the economy improves</FreeText></Answer><Answer><QuestionIdentifier>response33</QuestionIdentifier><FreeText>It's about the same, but I think they would be better buyers.</FreeText></Answer><Answer><QuestionIdentifier>response41</QuestionIdentifier><FreeText>Yes, they are, I'm aware they are different</FreeText></Answer><Answer><QuestionIdentifier>response42</QuestionIdentifier><FreeText>True, but I still want to change</FreeText></Answer><Answer><QuestionIdentifier>response51</QuestionIdentifier><FreeText>Hi Lisa, nice to meet you</FreeText></Answer><Answer><QuestionIdentifier>response52</QuestionIdentifier><FreeText>Hi Lisa, I was wondering if you'd like to go on a date?</FreeText></Answer><Answer><QuestionIdentifier>response53</QuestionIdentifier><FreeText>Good, they said I'd find you here.</FreeText></Answer><Answer><QuestionIdentifier>response61</QuestionIdentifier><FreeText>Forget it, Nickelback aren't worth that much</FreeText></Answer><Answer><QuestionIdentifier>response62</QuestionIdentifier><FreeText>Good grief, you scalpers suck.</FreeText></Answer><Answer><QuestionIdentifier>response63</QuestionIdentifier><FreeText>Ugh, fine, it's still a ripoff though.</FreeText></Answer><Answer><QuestionIdentifier>response71</QuestionIdentifier><FreeText>I'm hungry, let's leave.</FreeText></Answer><Answer><QuestionIdentifier>response72</QuestionIdentifier><FreeText>We'll give them 5 more minutes.</FreeText></Answer><Answer><QuestionIdentifier>response73</QuestionIdentifier><FreeText>Fred did say they were slow here, he wasn't kidding</FreeText></Answer><Answer><QuestionIdentifier>response81</QuestionIdentifier><FreeText>We just had this conversation, didn't we?</FreeText></Answer><Answer><QuestionIdentifier>response82</QuestionIdentifier><FreeText>It better be worth the wait</FreeText></Answer><Answer><QuestionIdentifier>response83</QuestionIdentifier><FreeText>I'm gonna speak with the manager</FreeText></Answer><Answer><QuestionIdentifier>response91</QuestionIdentifier><FreeText>It's raining, what's wrong with you?</FreeText></Answer><Answer><QuestionIdentifier>response92</QuestionIdentifier><FreeText>True, maybe a nice walk will clear my head.</FreeText></Answer><Answer><QuestionIdentifier>response93</QuestionIdentifier><FreeText>I like you, always seeing the positives</FreeText></Answer></QuestionFormAnswers>","Hi Christine, glad I swiped right on you",Christine... my mom was called Christine too!,NA,NA,NA,I could sign an extension to stay longer,It's just that my wife died and with her loss of income I'm struggling.,Can I take you on a date?,NA,NA,"I blame Fred, he drinks too much","True, but now we can get a fancy new one","I should drink tea anyway,  it's much better",NA,NA,"It's a little better, $149,000","In this market, you should take it or stay where you are until the economy improves","It's about the same, but I think they would be better buyers.",NA,NA,"Yes, they are, I'm aware they are different","True, but I still want to change",NA,NA,NA,"Hi Lisa, nice to meet you","Hi Lisa, I was wondering if you'd like to go on a date?","Good, they said I'd find you here.",NA,NA,"Forget it, Nickelback aren't worth that much","Good grief, you scalpers suck.","Ugh, fine, it's still a ripoff though.",NA,NA,"I'm hungry, let's leave.",We'll give them 5 more minutes.,"Fred did say they were slow here, he wasn't kidding",NA,NA,"We just had this conversation, didn't we?",It better be worth the wait,I'm gonna speak with the manager,NA,NA,"It's raining, what's wrong with you?","True, maybe a nice walk will clear my head.","I like you, always seeing the positives",NA,NA
