AssignmentId,WorkerId,HITId,AssignmentStatus,AutoApprovalTime,ApprovalTime,AcceptTime,SubmitTime,Answer,response101,response102,response103,response104,response105,response11,response12,response13,response14,response15,response21,response22,response23,response24,response25,response31,response32,response33,response34,response35,response41,response42,response43,response44,response45,response51,response52,response53,response54,response55,response61,response62,response63,response64,response65,response71,response72,response73,response74,response75,response81,response82,response83,response84,response85,response91,response92,response93,response94,response95
382M9COHEHFQHB1SNGR3OBGQWV7EU5,AYT6G75JNE3OH,35NNO802AVWNG6MCWW077BQZTB1NIE,Submitted,2019-06-21 11:29:39-04:00,NA,2019-06-19 11:20:47-04:00,2019-06-19 11:29:39-04:00,"<?xml version=""1.0"" encoding=""ASCII""?><QuestionFormAnswers xmlns=""http://mechanicalturk.amazonaws.com/AWSMechanicalTurkDataSchemas/2005-10-01/QuestionFormAnswers.xsd""><Answer><QuestionIdentifier>response101</QuestionIdentifier><FreeText>Are you sure?</FreeText></Answer><Answer><QuestionIdentifier>response102</QuestionIdentifier><FreeText>It takes an hour to drive there going fast.</FreeText></Answer><Answer><QuestionIdentifier>response103</QuestionIdentifier><FreeText>I'll have to call the airline and change my flight.</FreeText></Answer><Answer><QuestionIdentifier>response104</QuestionIdentifier><FreeText>Are you sure it is at six?</FreeText></Answer><Answer><QuestionIdentifier>response105</QuestionIdentifier><FreeText>I'm going to check everything with the airline now.</FreeText></Answer><Answer><QuestionIdentifier>response11</QuestionIdentifier><FreeText>I heard of that.</FreeText></Answer><Answer><QuestionIdentifier>response12</QuestionIdentifier><FreeText>There's a lot of truth in it.</FreeText></Answer><Answer><QuestionIdentifier>response13</QuestionIdentifier><FreeText>I didn't think that it would happen to me.</FreeText></Answer><Answer><QuestionIdentifier>response14</QuestionIdentifier><FreeText>I don't even notice.</FreeText></Answer><Answer><QuestionIdentifier>response21</QuestionIdentifier><FreeText>Is it Tylenol or aspirin?</FreeText></Answer><Answer><QuestionIdentifier>response22</QuestionIdentifier><FreeText>What difference does it make?</FreeText></Answer><Answer><QuestionIdentifier>response23</QuestionIdentifier><FreeText>I'm allergic to aspirin.</FreeText></Answer><Answer><QuestionIdentifier>response24</QuestionIdentifier><FreeText>They have all kinds of pain medication.</FreeText></Answer><Answer><QuestionIdentifier>response25</QuestionIdentifier><FreeText>Just so long as it is not aspirin.</FreeText></Answer><Answer><QuestionIdentifier>response31</QuestionIdentifier><FreeText>A junior software developer.</FreeText></Answer><Answer><QuestionIdentifier>response32</QuestionIdentifier><FreeText>I don't even know what that is.</FreeText></Answer><Answer><QuestionIdentifier>response33</QuestionIdentifier><FreeText>To make computer programs for services.</FreeText></Answer><Answer><QuestionIdentifier>response34</QuestionIdentifier><FreeText>I can't even imagine.</FreeText></Answer><Answer><QuestionIdentifier>response35</QuestionIdentifier><FreeText>Once you know how, it's easy.</FreeText></Answer><Answer><QuestionIdentifier>response41</QuestionIdentifier><FreeText>Get it ready.</FreeText></Answer><Answer><QuestionIdentifier>response42</QuestionIdentifier><FreeText>It is.</FreeText></Answer><Answer><QuestionIdentifier>response43</QuestionIdentifier><FreeText>Can I take a look at it?</FreeText></Answer><Answer><QuestionIdentifier>response44</QuestionIdentifier><FreeText>Why do you want to look at it?</FreeText></Answer><Answer><QuestionIdentifier>response45</QuestionIdentifier><FreeText>Idle curiosity.</FreeText></Answer><Answer><QuestionIdentifier>response51</QuestionIdentifier><FreeText>The sooner the better.</FreeText></Answer><Answer><QuestionIdentifier>response52</QuestionIdentifier><FreeText>I suppose that is true.</FreeText></Answer><Answer><QuestionIdentifier>response53</QuestionIdentifier><FreeText>Better to get it done in the good weather.</FreeText></Answer><Answer><QuestionIdentifier>response54</QuestionIdentifier><FreeText>We have all summer.</FreeText></Answer><Answer><QuestionIdentifier>response55</QuestionIdentifier><FreeText>I know.</FreeText></Answer><Answer><QuestionIdentifier>response61</QuestionIdentifier><FreeText>What do you think, though?</FreeText></Answer><Answer><QuestionIdentifier>response62</QuestionIdentifier><FreeText>It's everywhere, from a surly clerk to random shootings.</FreeText></Answer><Answer><QuestionIdentifier>response63</QuestionIdentifier><FreeText>Is it a big problem.</FreeText></Answer><Answer><QuestionIdentifier>response64</QuestionIdentifier><FreeText>I got used to it.</FreeText></Answer><Answer><QuestionIdentifier>response65</QuestionIdentifier><FreeText>What a terrible thing to say!</FreeText></Answer><Answer><QuestionIdentifier>response71</QuestionIdentifier><FreeText>Neither have you!</FreeText></Answer><Answer><QuestionIdentifier>response72</QuestionIdentifier><FreeText>Well, that's good, I guess.</FreeText></Answer><Answer><QuestionIdentifier>response73</QuestionIdentifier><FreeText>You look exactly the same.</FreeText></Answer><Answer><QuestionIdentifier>response74</QuestionIdentifier><FreeText>I'm me until the end.</FreeText></Answer><Answer><QuestionIdentifier>response75</QuestionIdentifier><FreeText>Ha ha, you still have your sense of humor!</FreeText></Answer><Answer><QuestionIdentifier>response81</QuestionIdentifier><FreeText>I got a deep cut on my arm.</FreeText></Answer><Answer><QuestionIdentifier>response82</QuestionIdentifier><FreeText>Let me see.</FreeText></Answer><Answer><QuestionIdentifier>response83</QuestionIdentifier><FreeText>I'm bleeding a lot.</FreeText></Answer><Answer><QuestionIdentifier>response84</QuestionIdentifier><FreeText>Hold this pressure, and I'll get the doctor.</FreeText></Answer><Answer><QuestionIdentifier>response85</QuestionIdentifier><FreeText>Please hurry.</FreeText></Answer><Answer><QuestionIdentifier>response91</QuestionIdentifier><FreeText>They come every hour.</FreeText></Answer><Answer><QuestionIdentifier>response92</QuestionIdentifier><FreeText>So it is probably late.</FreeText></Answer><Answer><QuestionIdentifier>response93</QuestionIdentifier><FreeText>Have you been waiting for longer than an hour?</FreeText></Answer><Answer><QuestionIdentifier>response94</QuestionIdentifier><FreeText>I don't know for sure.</FreeText></Answer><Answer><QuestionIdentifier>response95</QuestionIdentifier><FreeText>I'll check the schedule on my phone.</FreeText></Answer></QuestionFormAnswers>",Are you sure?,It takes an hour to drive there going fast.,I'll have to call the airline and change my flight.,Are you sure it is at six?,I'm going to check everything with the airline now.,I heard of that.,There's a lot of truth in it.,I didn't think that it would happen to me.,I don't even notice.,NA,Is it Tylenol or aspirin?,What difference does it make?,I'm allergic to aspirin.,They have all kinds of pain medication.,Just so long as it is not aspirin.,A junior software developer.,I don't even know what that is.,To make computer programs for services.,I can't even imagine.,"Once you know how, it's easy.",Get it ready.,It is.,Can I take a look at it?,Why do you want to look at it?,Idle curiosity.,The sooner the better.,I suppose that is true.,Better to get it done in the good weather.,We have all summer.,I know.,"What do you think, though?","It's everywhere, from a surly clerk to random shootings.",Is it a big problem.,I got used to it.,What a terrible thing to say!,Neither have you!,"Well, that's good, I guess.",You look exactly the same.,I'm me until the end.,"Ha ha, you still have your sense of humor!",I got a deep cut on my arm.,Let me see.,I'm bleeding a lot.,"Hold this pressure, and I'll get the doctor.",Please hurry.,They come every hour.,So it is probably late.,Have you been waiting for longer than an hour?,I don't know for sure.,I'll check the schedule on my phone.
378XPAWRUCDII7PGDU039P2OHLWIAG,A1UK8S8R5QYL6D,35NNO802AVWNG6MCWW077BQZTB1NIE,Submitted,2019-06-21 12:11:33-04:00,NA,2019-06-19 11:59:34-04:00,2019-06-19 12:11:33-04:00,"<?xml version=""1.0"" encoding=""ASCII""?><QuestionFormAnswers xmlns=""http://mechanicalturk.amazonaws.com/AWSMechanicalTurkDataSchemas/2005-10-01/QuestionFormAnswers.xsd""><Answer><QuestionIdentifier>response101</QuestionIdentifier><FreeText>Nah, it'll be fine. Traffic is slow this time of day.</FreeText></Answer><Answer><QuestionIdentifier>response102</QuestionIdentifier><FreeText>You think so? I'm pretty nervous about missing my flight.</FreeText></Answer><Answer><QuestionIdentifier>response103</QuestionIdentifier><FreeText>My GPS app says I should make it with a few minutes to spare.</FreeText></Answer><Answer><QuestionIdentifier>response11</QuestionIdentifier><FreeText>More like ""freshman 20"" in my case.</FreeText></Answer><Answer><QuestionIdentifier>response12</QuestionIdentifier><FreeText>Any suggestions on how to help me lose it?</FreeText></Answer><Answer><QuestionIdentifier>response13</QuestionIdentifier><FreeText>I really need to start exercising, I guess.</FreeText></Answer><Answer><QuestionIdentifier>response14</QuestionIdentifier><FreeText>How did you deal with the freshman 15?</FreeText></Answer><Answer><QuestionIdentifier>response21</QuestionIdentifier><FreeText>Thank you very much.</FreeText></Answer><Answer><QuestionIdentifier>response22</QuestionIdentifier><FreeText>Is there a brand you recommend over any others?</FreeText></Answer><Answer><QuestionIdentifier>response23</QuestionIdentifier><FreeText>Are there any that are on sale?</FreeText></Answer><Answer><QuestionIdentifier>response24</QuestionIdentifier><FreeText>Thanks, can you point me in the direction of aisle 6?</FreeText></Answer><Answer><QuestionIdentifier>response31</QuestionIdentifier><FreeText>Just a basic customer service job, nothing fancy.</FreeText></Answer><Answer><QuestionIdentifier>response32</QuestionIdentifier><FreeText>Working in human resources. I'm super excited, it pays rally well.</FreeText></Answer><Answer><QuestionIdentifier>response33</QuestionIdentifier><FreeText>It's a job in my field of study.</FreeText></Answer><Answer><QuestionIdentifier>response34</QuestionIdentifier><FreeText>Working with animals! It would be a really cool job.</FreeText></Answer><Answer><QuestionIdentifier>response41</QuestionIdentifier><FreeText>Wonderful, thank you.</FreeText></Answer><Answer><QuestionIdentifier>response42</QuestionIdentifier><FreeText>Great, can I take a look?</FreeText></Answer><Answer><QuestionIdentifier>response43</QuestionIdentifier><FreeText>You made sure to sign and date it, correct?</FreeText></Answer><Answer><QuestionIdentifier>response44</QuestionIdentifier><FreeText>Make sure you filled out all the fields, it'll make the process go quicker.</FreeText></Answer><Answer><QuestionIdentifier>response51</QuestionIdentifier><FreeText>We have plenty of time, don't worry.</FreeText></Answer><Answer><QuestionIdentifier>response52</QuestionIdentifier><FreeText>Yeah, and it will help with the worth of the house.</FreeText></Answer><Answer><QuestionIdentifier>response53</QuestionIdentifier><FreeText>It will be easier to sell when the time comes if the interior is updated.</FreeText></Answer><Answer><QuestionIdentifier>response61</QuestionIdentifier><FreeText>Good to hear.</FreeText></Answer><Answer><QuestionIdentifier>response62</QuestionIdentifier><FreeText>That's awesome; not all places are as nice as this.</FreeText></Answer><Answer><QuestionIdentifier>response71</QuestionIdentifier><FreeText>You haven't either! It's like we're back in school!</FreeText></Answer><Answer><QuestionIdentifier>response72</QuestionIdentifier><FreeText>You look amazing.</FreeText></Answer><Answer><QuestionIdentifier>response73</QuestionIdentifier><FreeText>I love what you've done with your hair, it looks really good on you.</FreeText></Answer><Answer><QuestionIdentifier>response74</QuestionIdentifier><FreeText>Same with you! How are things going?</FreeText></Answer><Answer><QuestionIdentifier>response81</QuestionIdentifier><FreeText>My wife is in labor, please help!</FreeText></Answer><Answer><QuestionIdentifier>response82</QuestionIdentifier><FreeText>I'm having intense stomach pains and they're not going away.</FreeText></Answer><Answer><QuestionIdentifier>response91</QuestionIdentifier><FreeText>Wow, that's quite a long wait.</FreeText></Answer><Answer><QuestionIdentifier>response92</QuestionIdentifier><FreeText>I have my phone, I can hop on their website and see if they've mentioned any delays in the schedule?</FreeText></Answer><Answer><QuestionIdentifier>response93</QuestionIdentifier><FreeText>Let's just walk, it's not that far.</FreeText></Answer><Answer><QuestionIdentifier>response94</QuestionIdentifier><FreeText>No kidding. I'm going to call a friend to come pick us up, this is getting ridiculous.</FreeText></Answer></QuestionFormAnswers>","Nah, it'll be fine. Traffic is slow this time of day.",You think so? I'm pretty nervous about missing my flight.,My GPS app says I should make it with a few minutes to spare.,NA,NA,"More like ""freshman 20"" in my case.",Any suggestions on how to help me lose it?,"I really need to start exercising, I guess.",How did you deal with the freshman 15?,NA,Thank you very much.,Is there a brand you recommend over any others?,Are there any that are on sale?,"Thanks, can you point me in the direction of aisle 6?",NA,"Just a basic customer service job, nothing fancy.","Working in human resources. I'm super excited, it pays rally well.",It's a job in my field of study.,Working with animals! It would be a really cool job.,NA,"Wonderful, thank you.","Great, can I take a look?","You made sure to sign and date it, correct?","Make sure you filled out all the fields, it'll make the process go quicker.",NA,"We have plenty of time, don't worry.","Yeah, and it will help with the worth of the house.",It will be easier to sell when the time comes if the interior is updated.,NA,NA,Good to hear.,That's awesome; not all places are as nice as this.,NA,NA,NA,You haven't either! It's like we're back in school!,You look amazing.,"I love what you've done with your hair, it looks really good on you.",Same with you! How are things going?,NA,"My wife is in labor, please help!",I'm having intense stomach pains and they're not going away.,NA,NA,NA,"Wow, that's quite a long wait.","I have my phone, I can hop on their website and see if they've mentioned any delays in the schedule?","Let's just walk, it's not that far.","No kidding. I'm going to call a friend to come pick us up, this is getting ridiculous.",NA
3180JW2OT4CH7CX50GUMDF122NP5JG,A2J8UU79144B7F,35NNO802AVWNG6MCWW077BQZTB1NIE,Submitted,2019-06-21 12:40:21-04:00,NA,2019-06-19 12:23:34-04:00,2019-06-19 12:40:21-04:00,"<?xml version=""1.0"" encoding=""ASCII""?><QuestionFormAnswers xmlns=""http://mechanicalturk.amazonaws.com/AWSMechanicalTurkDataSchemas/2005-10-01/QuestionFormAnswers.xsd""><Answer><QuestionIdentifier>response101</QuestionIdentifier><FreeText>Don't be so pessimistic.</FreeText></Answer><Answer><QuestionIdentifier>response102</QuestionIdentifier><FreeText>But I need to be there!</FreeText></Answer><Answer><QuestionIdentifier>response11</QuestionIdentifier><FreeText>More like the freshman 45</FreeText></Answer><Answer><QuestionIdentifier>response12</QuestionIdentifier><FreeText>Buffets should be illegal</FreeText></Answer><Answer><QuestionIdentifier>response13</QuestionIdentifier><FreeText>I need to lose that 15</FreeText></Answer><Answer><QuestionIdentifier>response21</QuestionIdentifier><FreeText>I don't like taking medication.</FreeText></Answer><Answer><QuestionIdentifier>response22</QuestionIdentifier><FreeText>I need something stronger.</FreeText></Answer><Answer><QuestionIdentifier>response23</QuestionIdentifier><FreeText>Do you know of any homeopathic remedies?</FreeText></Answer><Answer><QuestionIdentifier>response31</QuestionIdentifier><FreeText>As a bartender.</FreeText></Answer><Answer><QuestionIdentifier>response32</QuestionIdentifier><FreeText>It's at McDonald's. </FreeText></Answer><Answer><QuestionIdentifier>response41</QuestionIdentifier><FreeText>Can I have it please?</FreeText></Answer><Answer><QuestionIdentifier>response42</QuestionIdentifier><FreeText>Can you help me fill mine out?</FreeText></Answer><Answer><QuestionIdentifier>response51</QuestionIdentifier><FreeText>The sooner the better.</FreeText></Answer><Answer><QuestionIdentifier>response52</QuestionIdentifier><FreeText>Why wait?</FreeText></Answer><Answer><QuestionIdentifier>response53</QuestionIdentifier><FreeText>I want to do it now.</FreeText></Answer><Answer><QuestionIdentifier>response61</QuestionIdentifier><FreeText>I think there is discrimination everywhere.</FreeText></Answer><Answer><QuestionIdentifier>response62</QuestionIdentifier><FreeText>If there is I do not know about it. </FreeText></Answer><Answer><QuestionIdentifier>response71</QuestionIdentifier><FreeText>I sure hope not.</FreeText></Answer><Answer><QuestionIdentifier>response72</QuestionIdentifier><FreeText>Neither have you!</FreeText></Answer><Answer><QuestionIdentifier>response81</QuestionIdentifier><FreeText>I'm bleeding everywhere!</FreeText></Answer><Answer><QuestionIdentifier>response82</QuestionIdentifier><FreeText>I think I have a hernia!</FreeText></Answer><Answer><QuestionIdentifier>response91</QuestionIdentifier><FreeText>This is ridiculous.</FreeText></Answer><Answer><QuestionIdentifier>response92</QuestionIdentifier><FreeText>This is way too long I could have walked there.</FreeText></Answer></QuestionFormAnswers>",Don't be so pessimistic.,But I need to be there!,NA,NA,NA,More like the freshman 45,Buffets should be illegal,I need to lose that 15,NA,NA,I don't like taking medication.,I need something stronger.,Do you know of any homeopathic remedies?,NA,NA,As a bartender.,It's at McDonald's.,NA,NA,NA,Can I have it please?,Can you help me fill mine out?,NA,NA,NA,The sooner the better.,Why wait?,I want to do it now.,NA,NA,I think there is discrimination everywhere.,If there is I do not know about it.,NA,NA,NA,I sure hope not.,Neither have you!,NA,NA,NA,I'm bleeding everywhere!,I think I have a hernia!,NA,NA,NA,This is ridiculous.,This is way too long I could have walked there.,NA,NA,NA
3NOKK93PR189SF46XGCYKTUNA8TEE6,A3PY52ERZ3DNJY,35NNO802AVWNG6MCWW077BQZTB1NIE,Submitted,2019-06-21 12:45:56-04:00,NA,2019-06-19 12:34:15-04:00,2019-06-19 12:45:56-04:00,"<?xml version=""1.0"" encoding=""ASCII""?><QuestionFormAnswers xmlns=""http://mechanicalturk.amazonaws.com/AWSMechanicalTurkDataSchemas/2005-10-01/QuestionFormAnswers.xsd""><Answer><QuestionIdentifier>response101</QuestionIdentifier><FreeText>Depends on who's driving!</FreeText></Answer><Answer><QuestionIdentifier>response102</QuestionIdentifier><FreeText>Oh you of little faith!</FreeText></Answer><Answer><QuestionIdentifier>response11</QuestionIdentifier><FreeText>That's beer you dork, not mashed potatoes!</FreeText></Answer><Answer><QuestionIdentifier>response12</QuestionIdentifier><FreeText>I guess this is what my mom warned me about.</FreeText></Answer><Answer><QuestionIdentifier>response21</QuestionIdentifier><FreeText>Is brand name the same as generic?</FreeText></Answer><Answer><QuestionIdentifier>response22</QuestionIdentifier><FreeText>Thank you!</FreeText></Answer><Answer><QuestionIdentifier>response31</QuestionIdentifier><FreeText>I'm going to be a pizza delivery boy!</FreeText></Answer><Answer><QuestionIdentifier>response32</QuestionIdentifier><FreeText>A Cashier at Walgreens.</FreeText></Answer><Answer><QuestionIdentifier>response41</QuestionIdentifier><FreeText>I'm sorry we don't have any record of them in the system.</FreeText></Answer><Answer><QuestionIdentifier>response42</QuestionIdentifier><FreeText>Those will need to be review over in line 2C.</FreeText></Answer><Answer><QuestionIdentifier>response51</QuestionIdentifier><FreeText>No one is going to buy the place looking like this!</FreeText></Answer><Answer><QuestionIdentifier>response52</QuestionIdentifier><FreeText>I'm eager to make this house our home, that's why.</FreeText></Answer><Answer><QuestionIdentifier>response61</QuestionIdentifier><FreeText>Okay, thank you for your time.</FreeText></Answer><Answer><QuestionIdentifier>response62</QuestionIdentifier><FreeText>Anything that you've heard of perhaps?</FreeText></Answer><Answer><QuestionIdentifier>response71</QuestionIdentifier><FreeText>Well you sure have! How long has it been?</FreeText></Answer><Answer><QuestionIdentifier>response72</QuestionIdentifier><FreeText>Neither have you!</FreeText></Answer><Answer><QuestionIdentifier>response81</QuestionIdentifier><FreeText>I've broken my arm! </FreeText></Answer><Answer><QuestionIdentifier>response82</QuestionIdentifier><FreeText>What part of immediately didn't you understand?</FreeText></Answer><Answer><QuestionIdentifier>response91</QuestionIdentifier><FreeText>No kidding, it's never late.</FreeText></Answer><Answer><QuestionIdentifier>response92</QuestionIdentifier><FreeText>Well you do know that this isn't a bus stop, right?</FreeText></Answer></QuestionFormAnswers>",Depends on who's driving!,Oh you of little faith!,NA,NA,NA,"That's beer you dork, not mashed potatoes!",I guess this is what my mom warned me about.,NA,NA,NA,Is brand name the same as generic?,Thank you!,NA,NA,NA,I'm going to be a pizza delivery boy!,A Cashier at Walgreens.,NA,NA,NA,I'm sorry we don't have any record of them in the system.,Those will need to be review over in line 2C.,NA,NA,NA,No one is going to buy the place looking like this!,"I'm eager to make this house our home, that's why.",NA,NA,NA,"Okay, thank you for your time.",Anything that you've heard of perhaps?,NA,NA,NA,Well you sure have! How long has it been?,Neither have you!,NA,NA,NA,I've broken my arm!,What part of immediately didn't you understand?,NA,NA,NA,"No kidding, it's never late.","Well you do know that this isn't a bus stop, right?",NA,NA,NA
3JC6VJ2SABJ66JU16AH9KGYJC065AB,AJKA9BKC011F2,338GLSUI43B0MSCR3KB838ND0IHSF4,Submitted,2019-06-21 13:58:33-04:00,NA,2019-06-19 13:53:10-04:00,2019-06-19 13:58:33-04:00,"<?xml version=""1.0"" encoding=""ASCII""?><QuestionFormAnswers xmlns=""http://mechanicalturk.amazonaws.com/AWSMechanicalTurkDataSchemas/2005-10-01/QuestionFormAnswers.xsd""><Answer><QuestionIdentifier>response101</QuestionIdentifier><FreeText>I need to be able to get to work.</FreeText></Answer><Answer><QuestionIdentifier>response102</QuestionIdentifier><FreeText>I want to go to the mall.</FreeText></Answer><Answer><QuestionIdentifier>response11</QuestionIdentifier><FreeText>When can I move in?</FreeText></Answer><Answer><QuestionIdentifier>response12</QuestionIdentifier><FreeText>How much does it cost?</FreeText></Answer><Answer><QuestionIdentifier>response21</QuestionIdentifier><FreeText>Do you like me?</FreeText></Answer><Answer><QuestionIdentifier>response22</QuestionIdentifier><FreeText>What are your thoughts on the president?</FreeText></Answer><Answer><QuestionIdentifier>response31</QuestionIdentifier><FreeText>No the other one.</FreeText></Answer><Answer><QuestionIdentifier>response32</QuestionIdentifier><FreeText>Yes, I'm so lucky.</FreeText></Answer><Answer><QuestionIdentifier>response41</QuestionIdentifier><FreeText>Thanks for your help.</FreeText></Answer><Answer><QuestionIdentifier>response42</QuestionIdentifier><FreeText>I'll fill it out online.</FreeText></Answer><Answer><QuestionIdentifier>response51</QuestionIdentifier><FreeText>Because I care about you.</FreeText></Answer><Answer><QuestionIdentifier>response52</QuestionIdentifier><FreeText>I was just wondering.</FreeText></Answer><Answer><QuestionIdentifier>response61</QuestionIdentifier><FreeText>Oh, that's right. They're right here.</FreeText></Answer><Answer><QuestionIdentifier>response62</QuestionIdentifier><FreeText>Which results did we need to discuss?</FreeText></Answer><Answer><QuestionIdentifier>response71</QuestionIdentifier><FreeText>Nice to meet you, Mrs. Smith.</FreeText></Answer><Answer><QuestionIdentifier>response72</QuestionIdentifier><FreeText>I thought I was meeting a Mr. Smith.</FreeText></Answer><Answer><QuestionIdentifier>response81</QuestionIdentifier><FreeText>I think you'll like this one more.</FreeText></Answer><Answer><QuestionIdentifier>response82</QuestionIdentifier><FreeText>It's a lot better than the last offer.</FreeText></Answer><Answer><QuestionIdentifier>response91</QuestionIdentifier><FreeText>Well, that's a rude way to put it.</FreeText></Answer><Answer><QuestionIdentifier>response92</QuestionIdentifier><FreeText>Yes, that's what happens when you have a birthday.</FreeText></Answer></QuestionFormAnswers>",I need to be able to get to work.,I want to go to the mall.,NA,NA,NA,When can I move in?,How much does it cost?,NA,NA,NA,Do you like me?,What are your thoughts on the president?,NA,NA,NA,No the other one.,"Yes, I'm so lucky.",NA,NA,NA,Thanks for your help.,I'll fill it out online.,NA,NA,NA,Because I care about you.,I was just wondering.,NA,NA,NA,"Oh, that's right. They're right here.",Which results did we need to discuss?,NA,NA,NA,"Nice to meet you, Mrs. Smith.",I thought I was meeting a Mr. Smith.,NA,NA,NA,I think you'll like this one more.,It's a lot better than the last offer.,NA,NA,NA,"Well, that's a rude way to put it.","Yes, that's what happens when you have a birthday.",NA,NA,NA
