AssignmentId,WorkerId,HITId,AssignmentStatus,AutoApprovalTime,ApprovalTime,AcceptTime,SubmitTime,Answer,response101,response102,response103,response104,response105,response11,response12,response13,response14,response15,response21,response22,response23,response24,response25,response31,response32,response33,response34,response35,response41,response42,response43,response44,response45,response51,response52,response53,response54,response55,response61,response62,response63,response64,response65,response71,response72,response73,response74,response75,response81,response82,response83,response84,response85,response91,response92,response93,response94,response95
3QY5DC2MXRKINP1OIRB96T1Q8XBUFU,A2BQ5SX50WYNUT,31N9JPQXIPINKBBSQEIM7ZPKTYMNHL,Submitted,2019-06-21 13:53:21-04:00,NA,2019-06-19 13:50:10-04:00,2019-06-19 13:53:21-04:00,"<?xml version=""1.0"" encoding=""ASCII""?><QuestionFormAnswers xmlns=""http://mechanicalturk.amazonaws.com/AWSMechanicalTurkDataSchemas/2005-10-01/QuestionFormAnswers.xsd""><Answer><QuestionIdentifier>response101</QuestionIdentifier><FreeText>how are you</FreeText></Answer><Answer><QuestionIdentifier>response102</QuestionIdentifier><FreeText>good morning</FreeText></Answer><Answer><QuestionIdentifier>response11</QuestionIdentifier><FreeText>yes there is </FreeText></Answer><Answer><QuestionIdentifier>response12</QuestionIdentifier><FreeText>no there is not</FreeText></Answer><Answer><QuestionIdentifier>response21</QuestionIdentifier><FreeText>new president new rules</FreeText></Answer><Answer><QuestionIdentifier>response22</QuestionIdentifier><FreeText>a new president will have different views</FreeText></Answer><Answer><QuestionIdentifier>response31</QuestionIdentifier><FreeText>i didnt not commit a crime</FreeText></Answer><Answer><QuestionIdentifier>response32</QuestionIdentifier><FreeText>i was wrongfull accused and arrested</FreeText></Answer><Answer><QuestionIdentifier>response41</QuestionIdentifier><FreeText>yes you may</FreeText></Answer><Answer><QuestionIdentifier>response42</QuestionIdentifier><FreeText>no you may not</FreeText></Answer><Answer><QuestionIdentifier>response51</QuestionIdentifier><FreeText>yes it is</FreeText></Answer><Answer><QuestionIdentifier>response52</QuestionIdentifier><FreeText>no it is not</FreeText></Answer><Answer><QuestionIdentifier>response61</QuestionIdentifier><FreeText>yes you can </FreeText></Answer><Answer><QuestionIdentifier>response62</QuestionIdentifier><FreeText>no you cannot</FreeText></Answer><Answer><QuestionIdentifier>response71</QuestionIdentifier><FreeText>sure i can</FreeText></Answer><Answer><QuestionIdentifier>response72</QuestionIdentifier><FreeText>im sorry i cant</FreeText></Answer><Answer><QuestionIdentifier>response81</QuestionIdentifier><FreeText>thanks i would love to</FreeText></Answer><Answer><QuestionIdentifier>response82</QuestionIdentifier><FreeText>i really need to get home</FreeText></Answer><Answer><QuestionIdentifier>response91</QuestionIdentifier><FreeText>it doesnt work</FreeText></Answer><Answer><QuestionIdentifier>response92</QuestionIdentifier><FreeText>its not compatible</FreeText></Answer></QuestionFormAnswers>",how are you,good morning,NA,NA,NA,yes there is,no there is not,NA,NA,NA,new president new rules,a new president will have different views,NA,NA,NA,i didnt not commit a crime,i was wrongfull accused and arrested,NA,NA,NA,yes you may,no you may not,NA,NA,NA,yes it is,no it is not,NA,NA,NA,yes you can,no you cannot,NA,NA,NA,sure i can,im sorry i cant,NA,NA,NA,thanks i would love to,i really need to get home,NA,NA,NA,it doesnt work,its not compatible,NA,NA,NA
35BLDD71I6XO5LHOOTFL57JRY8QZVM,A11IKOH66UKKBP,3VZYA8PITOY8JMZQO6FF7QQHGWL057,Submitted,2019-06-21 11:35:59-04:00,NA,2019-06-19 11:28:08-04:00,2019-06-19 11:35:59-04:00,"<?xml version=""1.0"" encoding=""ASCII""?><QuestionFormAnswers xmlns=""http://mechanicalturk.amazonaws.com/AWSMechanicalTurkDataSchemas/2005-10-01/QuestionFormAnswers.xsd""><Answer><QuestionIdentifier>response101</QuestionIdentifier><FreeText>Thanks, I'll check it out.</FreeText></Answer><Answer><QuestionIdentifier>response102</QuestionIdentifier><FreeText>Thank you, when is it?</FreeText></Answer><Answer><QuestionIdentifier>response11</QuestionIdentifier><FreeText>Do you know how fast you were driving?</FreeText></Answer><Answer><QuestionIdentifier>response12</QuestionIdentifier><FreeText>Did you see the stop sign you passed?</FreeText></Answer><Answer><QuestionIdentifier>response13</QuestionIdentifier><FreeText>Are you aware one of your tail lights is out?</FreeText></Answer><Answer><QuestionIdentifier>response21</QuestionIdentifier><FreeText>Did you know about the parking garage?</FreeText></Answer><Answer><QuestionIdentifier>response22</QuestionIdentifier><FreeText>If you get here early, there's a lot of available spots.</FreeText></Answer><Answer><QuestionIdentifier>response31</QuestionIdentifier><FreeText>Great, I'll get a pass.</FreeText></Answer><Answer><QuestionIdentifier>response32</QuestionIdentifier><FreeText>Oh that's expensive.</FreeText></Answer><Answer><QuestionIdentifier>response41</QuestionIdentifier><FreeText>No problem, I'll be here.</FreeText></Answer><Answer><QuestionIdentifier>response42</QuestionIdentifier><FreeText>Okay, I'll see you there.</FreeText></Answer><Answer><QuestionIdentifier>response51</QuestionIdentifier><FreeText>Is there anything bothering you?</FreeText></Answer><Answer><QuestionIdentifier>response52</QuestionIdentifier><FreeText>Anything out of the ordinary?</FreeText></Answer><Answer><QuestionIdentifier>response61</QuestionIdentifier><FreeText>You are welcome any time!</FreeText></Answer><Answer><QuestionIdentifier>response62</QuestionIdentifier><FreeText>No problem, hope to see you again soon.</FreeText></Answer><Answer><QuestionIdentifier>response71</QuestionIdentifier><FreeText>Okay, thank you.</FreeText></Answer><Answer><QuestionIdentifier>response72</QuestionIdentifier><FreeText>Do you know where the transfer is?</FreeText></Answer><Answer><QuestionIdentifier>response81</QuestionIdentifier><FreeText>Sure, no problem.</FreeText></Answer><Answer><QuestionIdentifier>response82</QuestionIdentifier><FreeText>Okay, let's get started.</FreeText></Answer><Answer><QuestionIdentifier>response91</QuestionIdentifier><FreeText>No, I have an appointment.</FreeText></Answer><Answer><QuestionIdentifier>response92</QuestionIdentifier><FreeText>Yes, I have a lunch date.</FreeText></Answer></QuestionFormAnswers>","Thanks, I'll check it out.","Thank you, when is it?",NA,NA,NA,Do you know how fast you were driving?,Did you see the stop sign you passed?,Are you aware one of your tail lights is out?,NA,NA,Did you know about the parking garage?,"If you get here early, there's a lot of available spots.",NA,NA,NA,"Great, I'll get a pass.",Oh that's expensive.,NA,NA,NA,"No problem, I'll be here.","Okay, I'll see you there.",NA,NA,NA,Is there anything bothering you?,Anything out of the ordinary?,NA,NA,NA,You are welcome any time!,"No problem, hope to see you again soon.",NA,NA,NA,"Okay, thank you.",Do you know where the transfer is?,NA,NA,NA,"Sure, no problem.","Okay, let's get started.",NA,NA,NA,"No, I have an appointment.","Yes, I have a lunch date.",NA,NA,NA
3KOPY89HM82ETXA1MX6TYI3IOR7J3D,A1MC4JNAU3Q1GY,3VZYA8PITOY8JMZQO6FF7QQHGWL057,Submitted,2019-06-21 13:42:39-04:00,NA,2019-06-19 13:32:21-04:00,2019-06-19 13:42:39-04:00,"<?xml version=""1.0"" encoding=""ASCII""?><QuestionFormAnswers xmlns=""http://mechanicalturk.amazonaws.com/AWSMechanicalTurkDataSchemas/2005-10-01/QuestionFormAnswers.xsd""><Answer><QuestionIdentifier>response101</QuestionIdentifier><FreeText>What workshop?</FreeText></Answer><Answer><QuestionIdentifier>response102</QuestionIdentifier><FreeText>No thanks, I'll figure it out.</FreeText></Answer><Answer><QuestionIdentifier>response103</QuestionIdentifier><FreeText>I think so too.</FreeText></Answer><Answer><QuestionIdentifier>response104</QuestionIdentifier><FreeText>I will if you join me.</FreeText></Answer><Answer><QuestionIdentifier>response105</QuestionIdentifier><FreeText>I don't have the time to do all that.</FreeText></Answer><Answer><QuestionIdentifier>response11</QuestionIdentifier><FreeText>You ran a red light.</FreeText></Answer><Answer><QuestionIdentifier>response12</QuestionIdentifier><FreeText>You were speeding.</FreeText></Answer><Answer><QuestionIdentifier>response13</QuestionIdentifier><FreeText>You did not yield to the pedestrians in the crosswalk.</FreeText></Answer><Answer><QuestionIdentifier>response14</QuestionIdentifier><FreeText>Your inspection sticker is missing.</FreeText></Answer><Answer><QuestionIdentifier>response15</QuestionIdentifier><FreeText>You  were following someone too close.</FreeText></Answer><Answer><QuestionIdentifier>response21</QuestionIdentifier><FreeText>How do you get around?</FreeText></Answer><Answer><QuestionIdentifier>response22</QuestionIdentifier><FreeText>I guess you like walking a lot.</FreeText></Answer><Answer><QuestionIdentifier>response23</QuestionIdentifier><FreeText>There is designated parking where I park.</FreeText></Answer><Answer><QuestionIdentifier>response24</QuestionIdentifier><FreeText>I never have a problem finding a space.</FreeText></Answer><Answer><QuestionIdentifier>response25</QuestionIdentifier><FreeText>I take the bus too.</FreeText></Answer><Answer><QuestionIdentifier>response31</QuestionIdentifier><FreeText>Can I ride free with my student ID?</FreeText></Answer><Answer><QuestionIdentifier>response32</QuestionIdentifier><FreeText>That is a lot of money to go 2 blocks.</FreeText></Answer><Answer><QuestionIdentifier>response33</QuestionIdentifier><FreeText>Never mind, I'll walk.</FreeText></Answer><Answer><QuestionIdentifier>response34</QuestionIdentifier><FreeText>Do you get a transfer with the fare?</FreeText></Answer><Answer><QuestionIdentifier>response35</QuestionIdentifier><FreeText>Okay, thank you.</FreeText></Answer><Answer><QuestionIdentifier>response41</QuestionIdentifier><FreeText>I don't have a minute.</FreeText></Answer><Answer><QuestionIdentifier>response42</QuestionIdentifier><FreeText>But you are an hour away!</FreeText></Answer><Answer><QuestionIdentifier>response43</QuestionIdentifier><FreeText>Time is money.</FreeText></Answer><Answer><QuestionIdentifier>response44</QuestionIdentifier><FreeText>Hurry up, I'm already late.</FreeText></Answer><Answer><QuestionIdentifier>response45</QuestionIdentifier><FreeText>Take your time, we have until midnight.</FreeText></Answer><Answer><QuestionIdentifier>response51</QuestionIdentifier><FreeText>Great to see you.</FreeText></Answer><Answer><QuestionIdentifier>response52</QuestionIdentifier><FreeText>Do you have any existing problems?</FreeText></Answer><Answer><QuestionIdentifier>response53</QuestionIdentifier><FreeText>It's only been ten months.</FreeText></Answer><Answer><QuestionIdentifier>response54</QuestionIdentifier><FreeText>I haven't seen you in four years.</FreeText></Answer><Answer><QuestionIdentifier>response55</QuestionIdentifier><FreeText>What medications are you currently taking?</FreeText></Answer><Answer><QuestionIdentifier>response61</QuestionIdentifier><FreeText>I'm honored to have you.</FreeText></Answer><Answer><QuestionIdentifier>response62</QuestionIdentifier><FreeText>Thanks for bringing wine.</FreeText></Answer><Answer><QuestionIdentifier>response63</QuestionIdentifier><FreeText>Drive home safe.</FreeText></Answer><Answer><QuestionIdentifier>response64</QuestionIdentifier><FreeText>I'll invite you to the next one.</FreeText></Answer><Answer><QuestionIdentifier>response65</QuestionIdentifier><FreeText>Who is your cousin?</FreeText></Answer><Answer><QuestionIdentifier>response71</QuestionIdentifier><FreeText>What station will I transfer at?</FreeText></Answer><Answer><QuestionIdentifier>response72</QuestionIdentifier><FreeText>No one told me that I would be transferring.</FreeText></Answer><Answer><QuestionIdentifier>response73</QuestionIdentifier><FreeText>Is my ticket good for a transfer?</FreeText></Answer><Answer><QuestionIdentifier>response74</QuestionIdentifier><FreeText>What's a transfer?</FreeText></Answer><Answer><QuestionIdentifier>response75</QuestionIdentifier><FreeText>I hate riding the bus!</FreeText></Answer><Answer><QuestionIdentifier>response81</QuestionIdentifier><FreeText>Does this area flood?</FreeText></Answer><Answer><QuestionIdentifier>response82</QuestionIdentifier><FreeText>Do you spray for bugs?</FreeText></Answer><Answer><QuestionIdentifier>response83</QuestionIdentifier><FreeText>Is this upstairs or downstairs?</FreeText></Answer><Answer><QuestionIdentifier>response84</QuestionIdentifier><FreeText>Will you be doing repairs before or after I move in?</FreeText></Answer><Answer><QuestionIdentifier>response85</QuestionIdentifier><FreeText>Can I get it custom painted before move in?</FreeText></Answer><Answer><QuestionIdentifier>response91</QuestionIdentifier><FreeText>No, I'm going to see my parole officer.</FreeText></Answer><Answer><QuestionIdentifier>response92</QuestionIdentifier><FreeText>Yes, my brother is flying in from Dallas.</FreeText></Answer><Answer><QuestionIdentifier>response93</QuestionIdentifier><FreeText>Why are you so nosy all the time?</FreeText></Answer><Answer><QuestionIdentifier>response94</QuestionIdentifier><FreeText>No, I am visiting a few museums on a walking tour.</FreeText></Answer><Answer><QuestionIdentifier>response95</QuestionIdentifier><FreeText>Yes, Pedro lives in the area and asked I come cook for him.</FreeText></Answer></QuestionFormAnswers>",What workshop?,"No thanks, I'll figure it out.",I think so too.,I will if you join me.,I don't have the time to do all that.,You ran a red light.,You were speeding.,You did not yield to the pedestrians in the crosswalk.,Your inspection sticker is missing.,You  were following someone too close.,How do you get around?,I guess you like walking a lot.,There is designated parking where I park.,I never have a problem finding a space.,I take the bus too.,Can I ride free with my student ID?,That is a lot of money to go 2 blocks.,"Never mind, I'll walk.",Do you get a transfer with the fare?,"Okay, thank you.",I don't have a minute.,But you are an hour away!,Time is money.,"Hurry up, I'm already late.","Take your time, we have until midnight.",Great to see you.,Do you have any existing problems?,It's only been ten months.,I haven't seen you in four years.,What medications are you currently taking?,I'm honored to have you.,Thanks for bringing wine.,Drive home safe.,I'll invite you to the next one.,Who is your cousin?,What station will I transfer at?,No one told me that I would be transferring.,Is my ticket good for a transfer?,What's a transfer?,I hate riding the bus!,Does this area flood?,Do you spray for bugs?,Is this upstairs or downstairs?,Will you be doing repairs before or after I move in?,Can I get it custom painted before move in?,"No, I'm going to see my parole officer.","Yes, my brother is flying in from Dallas.",Why are you so nosy all the time?,"No, I am visiting a few museums on a walking tour.","Yes, Pedro lives in the area and asked I come cook for him."
3VELCLL3GKJ2ESAQG31PVRWTX0EF1G,A2WCCV1W8UE8ED,3VZYA8PITOY8JMZQO6FF7QQHGWL057,Submitted,2019-06-21 13:59:58-04:00,NA,2019-06-19 13:51:28-04:00,2019-06-19 13:59:58-04:00,"<?xml version=""1.0"" encoding=""ASCII""?><QuestionFormAnswers xmlns=""http://mechanicalturk.amazonaws.com/AWSMechanicalTurkDataSchemas/2005-10-01/QuestionFormAnswers.xsd""><Answer><QuestionIdentifier>response101</QuestionIdentifier><FreeText>What is that?</FreeText></Answer><Answer><QuestionIdentifier>response102</QuestionIdentifier><FreeText>Can't you help me?</FreeText></Answer><Answer><QuestionIdentifier>response11</QuestionIdentifier><FreeText>Do you know how fast you were driving?</FreeText></Answer><Answer><QuestionIdentifier>response12</QuestionIdentifier><FreeText>Just license and registration please.</FreeText></Answer><Answer><QuestionIdentifier>response21</QuestionIdentifier><FreeText>How do you get around.</FreeText></Answer><Answer><QuestionIdentifier>response22</QuestionIdentifier><FreeText>Even with a parking pass?</FreeText></Answer><Answer><QuestionIdentifier>response31</QuestionIdentifier><FreeText>That's not bad.</FreeText></Answer><Answer><QuestionIdentifier>response32</QuestionIdentifier><FreeText>I don't know if I can afford that every day.</FreeText></Answer><Answer><QuestionIdentifier>response41</QuestionIdentifier><FreeText>We need to be there by noon.</FreeText></Answer><Answer><QuestionIdentifier>response42</QuestionIdentifier><FreeText>Well, hurry up!</FreeText></Answer><Answer><QuestionIdentifier>response51</QuestionIdentifier><FreeText>Anything bothering you?</FreeText></Answer><Answer><QuestionIdentifier>response52</QuestionIdentifier><FreeText>Sounds good.  Let's get to it.</FreeText></Answer><Answer><QuestionIdentifier>response61</QuestionIdentifier><FreeText>You are very welcome.</FreeText></Answer><Answer><QuestionIdentifier>response62</QuestionIdentifier><FreeText>Any friend of your cousin is welcome.</FreeText></Answer><Answer><QuestionIdentifier>response71</QuestionIdentifier><FreeText>How do I do that?</FreeText></Answer><Answer><QuestionIdentifier>response72</QuestionIdentifier><FreeText>Well, that's disappointing.</FreeText></Answer><Answer><QuestionIdentifier>response81</QuestionIdentifier><FreeText>I hope I'll be able to return your deposit.</FreeText></Answer><Answer><QuestionIdentifier>response82</QuestionIdentifier><FreeText>That was a terrible storm.</FreeText></Answer><Answer><QuestionIdentifier>response91</QuestionIdentifier><FreeText>No, just have to renew my license.</FreeText></Answer><Answer><QuestionIdentifier>response92</QuestionIdentifier><FreeText>Yes, I thought I'd check in on my mom.</FreeText></Answer></QuestionFormAnswers>",What is that?,Can't you help me?,NA,NA,NA,Do you know how fast you were driving?,Just license and registration please.,NA,NA,NA,How do you get around.,Even with a parking pass?,NA,NA,NA,That's not bad.,I don't know if I can afford that every day.,NA,NA,NA,We need to be there by noon.,"Well, hurry up!",NA,NA,NA,Anything bothering you?,Sounds good.  Let's get to it.,NA,NA,NA,You are very welcome.,Any friend of your cousin is welcome.,NA,NA,NA,How do I do that?,"Well, that's disappointing.",NA,NA,NA,I hope I'll be able to return your deposit.,That was a terrible storm.,NA,NA,NA,"No, just have to renew my license.","Yes, I thought I'd check in on my mom.",NA,NA,NA
3PXX5PX6LXY8VZBA7K8MN2YBMV4BAS,A3IQ9V1JSB2RJO,3OYHVNTV5TYW4MCCXELWZG5HBPVKO1,Submitted,2019-06-21 11:35:51-04:00,NA,2019-06-19 11:29:12-04:00,2019-06-19 11:35:51-04:00,"<?xml version=""1.0"" encoding=""ASCII""?><QuestionFormAnswers xmlns=""http://mechanicalturk.amazonaws.com/AWSMechanicalTurkDataSchemas/2005-10-01/QuestionFormAnswers.xsd""><Answer><QuestionIdentifier>response101</QuestionIdentifier><FreeText>If I remembered that, Karen, I wouldn't have asked you.</FreeText></Answer><Answer><QuestionIdentifier>response102</QuestionIdentifier><FreeText>I thought it was on the table.</FreeText></Answer><Answer><QuestionIdentifier>response103</QuestionIdentifier><FreeText>I hope I didn't leave it in the mailbox again.</FreeText></Answer><Answer><QuestionIdentifier>response11</QuestionIdentifier><FreeText>I need help finding a room tonight in Atlanta.</FreeText></Answer><Answer><QuestionIdentifier>response12</QuestionIdentifier><FreeText>Could you help me locate the restroom?</FreeText></Answer><Answer><QuestionIdentifier>response13</QuestionIdentifier><FreeText>I'm looking for Mr. Jones.</FreeText></Answer><Answer><QuestionIdentifier>response14</QuestionIdentifier><FreeText>I need to purchase two tickets for tonight's show.</FreeText></Answer><Answer><QuestionIdentifier>response15</QuestionIdentifier><FreeText>I'd like a number one with a coke.</FreeText></Answer><Answer><QuestionIdentifier>response21</QuestionIdentifier><FreeText>Thanks!  I always forget.</FreeText></Answer><Answer><QuestionIdentifier>response22</QuestionIdentifier><FreeText>Good because I forgot.</FreeText></Answer><Answer><QuestionIdentifier>response31</QuestionIdentifier><FreeText>We can get a head start on the day.</FreeText></Answer><Answer><QuestionIdentifier>response32</QuestionIdentifier><FreeText>Hopefully they will be able to wrap this up quickly.</FreeText></Answer><Answer><QuestionIdentifier>response41</QuestionIdentifier><FreeText>Where did you find it? </FreeText></Answer><Answer><QuestionIdentifier>response42</QuestionIdentifier><FreeText>It looks great on you.</FreeText></Answer><Answer><QuestionIdentifier>response43</QuestionIdentifier><FreeText>Is that about a size 14? </FreeText></Answer><Answer><QuestionIdentifier>response51</QuestionIdentifier><FreeText>I'd like to find the swimming pool.</FreeText></Answer><Answer><QuestionIdentifier>response52</QuestionIdentifier><FreeText>I'd like to make a reservation for the restaurant tonight.</FreeText></Answer><Answer><QuestionIdentifier>response53</QuestionIdentifier><FreeText>I'd like a schedule of events for the day.</FreeText></Answer><Answer><QuestionIdentifier>response61</QuestionIdentifier><FreeText>I'd like to make an appointment some time next week.</FreeText></Answer><Answer><QuestionIdentifier>response62</QuestionIdentifier><FreeText>Could you tell me if there are still tickets available?</FreeText></Answer><Answer><QuestionIdentifier>response63</QuestionIdentifier><FreeText>I'd like to order two large pizzas.</FreeText></Answer><Answer><QuestionIdentifier>response71</QuestionIdentifier><FreeText>Don't you recycle, Brad?</FreeText></Answer><Answer><QuestionIdentifier>response72</QuestionIdentifier><FreeText>Do you need some help? </FreeText></Answer><Answer><QuestionIdentifier>response73</QuestionIdentifier><FreeText>You had a party and didn't invite me.  Nice.</FreeText></Answer><Answer><QuestionIdentifier>response74</QuestionIdentifier><FreeText>I hope it was a good time.</FreeText></Answer><Answer><QuestionIdentifier>response81</QuestionIdentifier><FreeText>I'll try my best.</FreeText></Answer><Answer><QuestionIdentifier>response82</QuestionIdentifier><FreeText>What do you need?</FreeText></Answer><Answer><QuestionIdentifier>response91</QuestionIdentifier><FreeText>Is it close to amenities?</FreeText></Answer><Answer><QuestionIdentifier>response92</QuestionIdentifier><FreeText>Is it a safe area?</FreeText></Answer><Answer><QuestionIdentifier>response93</QuestionIdentifier><FreeText>Is it somewhere you'd consider living?</FreeText></Answer></QuestionFormAnswers>","If I remembered that, Karen, I wouldn't have asked you.",I thought it was on the table.,I hope I didn't leave it in the mailbox again.,NA,NA,I need help finding a room tonight in Atlanta.,Could you help me locate the restroom?,I'm looking for Mr. Jones.,I need to purchase two tickets for tonight's show.,I'd like a number one with a coke.,Thanks!  I always forget.,Good because I forgot.,NA,NA,NA,We can get a head start on the day.,Hopefully they will be able to wrap this up quickly.,NA,NA,NA,Where did you find it?,It looks great on you.,Is that about a size 14?,NA,NA,I'd like to find the swimming pool.,I'd like to make a reservation for the restaurant tonight.,I'd like a schedule of events for the day.,NA,NA,I'd like to make an appointment some time next week.,Could you tell me if there are still tickets available?,I'd like to order two large pizzas.,NA,NA,"Don't you recycle, Brad?",Do you need some help?,You had a party and didn't invite me.  Nice.,I hope it was a good time.,NA,I'll try my best.,What do you need?,NA,NA,NA,Is it close to amenities?,Is it a safe area?,Is it somewhere you'd consider living?,NA,NA
