AssignmentId,WorkerId,HITId,AssignmentStatus,AutoApprovalTime,ApprovalTime,AcceptTime,SubmitTime,Answer,response101,response102,response103,response104,response105,response11,response12,response13,response14,response15,response21,response22,response23,response24,response25,response31,response32,response33,response34,response35,response41,response42,response43,response44,response45,response51,response52,response53,response54,response55,response61,response62,response63,response64,response65,response71,response72,response73,response74,response75,response81,response82,response83,response84,response85,response91,response92,response93,response94,response95
3DPNQGW4LLFNNYEY2SHNZJQJGLK46E,A2U6Y560JU2CF1,30EV7DWJTVV1ZLVP1X0TROY1O4AY6L,Submitted,2019-06-21 13:55:23-04:00,NA,2019-06-19 13:35:33-04:00,2019-06-19 13:55:23-04:00,"<?xml version=""1.0"" encoding=""ASCII""?><QuestionFormAnswers xmlns=""http://mechanicalturk.amazonaws.com/AWSMechanicalTurkDataSchemas/2005-10-01/QuestionFormAnswers.xsd""><Answer><QuestionIdentifier>response101</QuestionIdentifier><FreeText>Of course, I love company.</FreeText></Answer><Answer><QuestionIdentifier>response102</QuestionIdentifier><FreeText>I was so excited when you said you wanted to come by.</FreeText></Answer><Answer><QuestionIdentifier>response103</QuestionIdentifier><FreeText>Would you like something to drink or eat?</FreeText></Answer><Answer><QuestionIdentifier>response104</QuestionIdentifier><FreeText>I've been so busy lately, so I'm happy to spend some time with you.</FreeText></Answer><Answer><QuestionIdentifier>response105</QuestionIdentifier><FreeText>I wish you could've come sooner.</FreeText></Answer><Answer><QuestionIdentifier>response11</QuestionIdentifier><FreeText>Thanks for your help.</FreeText></Answer><Answer><QuestionIdentifier>response12</QuestionIdentifier><FreeText>Is there any fee to use it?</FreeText></Answer><Answer><QuestionIdentifier>response13</QuestionIdentifier><FreeText>I'll look over there then.</FreeText></Answer><Answer><QuestionIdentifier>response14</QuestionIdentifier><FreeText>Is there anyone that can assist me with making my copies?</FreeText></Answer><Answer><QuestionIdentifier>response15</QuestionIdentifier><FreeText>Will the copies be in color?</FreeText></Answer><Answer><QuestionIdentifier>response21</QuestionIdentifier><FreeText>Yes and it didn't help.</FreeText></Answer><Answer><QuestionIdentifier>response22</QuestionIdentifier><FreeText>No, I could barely get out of bed to come talk to you.</FreeText></Answer><Answer><QuestionIdentifier>response23</QuestionIdentifier><FreeText>Not yet but I will in a little bit.</FreeText></Answer><Answer><QuestionIdentifier>response24</QuestionIdentifier><FreeText>No, I just tried taking some medicine.</FreeText></Answer><Answer><QuestionIdentifier>response25</QuestionIdentifier><FreeText>Yes, that's the only reason I'm feeling better now.</FreeText></Answer><Answer><QuestionIdentifier>response31</QuestionIdentifier><FreeText>Hi Roger, what can I do for you?</FreeText></Answer><Answer><QuestionIdentifier>response32</QuestionIdentifier><FreeText>Why did you call the company phone?</FreeText></Answer><Answer><QuestionIdentifier>response33</QuestionIdentifier><FreeText>Hey Roger, is everything alright?</FreeText></Answer><Answer><QuestionIdentifier>response34</QuestionIdentifier><FreeText>Roger who?</FreeText></Answer><Answer><QuestionIdentifier>response35</QuestionIdentifier><FreeText>Oh hey, what's up?</FreeText></Answer><Answer><QuestionIdentifier>response41</QuestionIdentifier><FreeText>No I do not.</FreeText></Answer><Answer><QuestionIdentifier>response42</QuestionIdentifier><FreeText>Not yet, I was hoping to get one today.</FreeText></Answer><Answer><QuestionIdentifier>response43</QuestionIdentifier><FreeText>Yes, I got one last week.</FreeText></Answer><Answer><QuestionIdentifier>response44</QuestionIdentifier><FreeText>I'm not sure. Do I need one?</FreeText></Answer><Answer><QuestionIdentifier>response45</QuestionIdentifier><FreeText>I do but I don't know if it still works</FreeText></Answer><Answer><QuestionIdentifier>response51</QuestionIdentifier><FreeText>I'm glad we went out tonight.</FreeText></Answer><Answer><QuestionIdentifier>response52</QuestionIdentifier><FreeText>You did a great job cooking it.</FreeText></Answer><Answer><QuestionIdentifier>response53</QuestionIdentifier><FreeText>How'd you get to look so good?</FreeText></Answer><Answer><QuestionIdentifier>response54</QuestionIdentifier><FreeText>This must not be your first time cooking steak.</FreeText></Answer><Answer><QuestionIdentifier>response55</QuestionIdentifier><FreeText>We're going to have to come back here for more.</FreeText></Answer><Answer><QuestionIdentifier>response61</QuestionIdentifier><FreeText>I just want to be sure before I sign the lease.</FreeText></Answer><Answer><QuestionIdentifier>response62</QuestionIdentifier><FreeText>Wow, its beautiful.</FreeText></Answer><Answer><QuestionIdentifier>response63</QuestionIdentifier><FreeText>I couldn't tell if there were any damages from the pictures you sent me.</FreeText></Answer><Answer><QuestionIdentifier>response64</QuestionIdentifier><FreeText>Do all of these items come with the apartment?</FreeText></Answer><Answer><QuestionIdentifier>response65</QuestionIdentifier><FreeText>How much is the rent here?</FreeText></Answer><Answer><QuestionIdentifier>response71</QuestionIdentifier><FreeText>Why? It's such a nice day.</FreeText></Answer><Answer><QuestionIdentifier>response72</QuestionIdentifier><FreeText>Is something wrong?</FreeText></Answer><Answer><QuestionIdentifier>response73</QuestionIdentifier><FreeText>Are you sick?</FreeText></Answer><Answer><QuestionIdentifier>response74</QuestionIdentifier><FreeText>Are you trying to avoid me?</FreeText></Answer><Answer><QuestionIdentifier>response75</QuestionIdentifier><FreeText>I understand. I did the same thing last week.</FreeText></Answer><Answer><QuestionIdentifier>response81</QuestionIdentifier><FreeText>Let's hurry!</FreeText></Answer><Answer><QuestionIdentifier>response82</QuestionIdentifier><FreeText>I don't think we'll be able to get there in time.</FreeText></Answer><Answer><QuestionIdentifier>response83</QuestionIdentifier><FreeText>Watch out for the cars.</FreeText></Answer><Answer><QuestionIdentifier>response84</QuestionIdentifier><FreeText>I have curfew soon, I can not miss this bus.</FreeText></Answer><Answer><QuestionIdentifier>response85</QuestionIdentifier><FreeText>If we run, we can catch it.</FreeText></Answer><Answer><QuestionIdentifier>response91</QuestionIdentifier><FreeText>Sorry, I wasn't trying to offend you.</FreeText></Answer><Answer><QuestionIdentifier>response92</QuestionIdentifier><FreeText>Have you been to the doctor yet?</FreeText></Answer><Answer><QuestionIdentifier>response93</QuestionIdentifier><FreeText>Did you go partying last night?</FreeText></Answer><Answer><QuestionIdentifier>response94</QuestionIdentifier><FreeText>I can tell.</FreeText></Answer><Answer><QuestionIdentifier>response95</QuestionIdentifier><FreeText>Do you need me to get you anything?</FreeText></Answer></QuestionFormAnswers>","Of course, I love company.",I was so excited when you said you wanted to come by.,Would you like something to drink or eat?,"I've been so busy lately, so I'm happy to spend some time with you.",I wish you could've come sooner.,Thanks for your help.,Is there any fee to use it?,I'll look over there then.,Is there anyone that can assist me with making my copies?,Will the copies be in color?,Yes and it didn't help.,"No, I could barely get out of bed to come talk to you.",Not yet but I will in a little bit.,"No, I just tried taking some medicine.","Yes, that's the only reason I'm feeling better now.","Hi Roger, what can I do for you?",Why did you call the company phone?,"Hey Roger, is everything alright?",Roger who?,"Oh hey, what's up?",No I do not.,"Not yet, I was hoping to get one today.","Yes, I got one last week.",I'm not sure. Do I need one?,I do but I don't know if it still works,I'm glad we went out tonight.,You did a great job cooking it.,How'd you get to look so good?,This must not be your first time cooking steak.,We're going to have to come back here for more.,I just want to be sure before I sign the lease.,"Wow, its beautiful.",I couldn't tell if there were any damages from the pictures you sent me.,Do all of these items come with the apartment?,How much is the rent here?,Why? It's such a nice day.,Is something wrong?,Are you sick?,Are you trying to avoid me?,I understand. I did the same thing last week.,Let's hurry!,I don't think we'll be able to get there in time.,Watch out for the cars.,"I have curfew soon, I can not miss this bus.","If we run, we can catch it.","Sorry, I wasn't trying to offend you.",Have you been to the doctor yet?,Did you go partying last night?,I can tell.,Do you need me to get you anything?
3J2UYBXQQLC6OAWXJRULNG06Z9406U,A31EI07AMHO3MA,30EV7DWJTVV1ZLVP1X0TROY1O4AY6L,Submitted,2019-06-21 13:55:51-04:00,NA,2019-06-19 13:39:38-04:00,2019-06-19 13:55:51-04:00,"<?xml version=""1.0"" encoding=""ASCII""?><QuestionFormAnswers xmlns=""http://mechanicalturk.amazonaws.com/AWSMechanicalTurkDataSchemas/2005-10-01/QuestionFormAnswers.xsd""><Answer><QuestionIdentifier>response101</QuestionIdentifier><FreeText>I'm interested in the insurance you are selling.</FreeText></Answer><Answer><QuestionIdentifier>response102</QuestionIdentifier><FreeText>You were lucky I was home today.</FreeText></Answer><Answer><QuestionIdentifier>response103</QuestionIdentifier><FreeText>It's my only day off so I hope this will be short.</FreeText></Answer><Answer><QuestionIdentifier>response104</QuestionIdentifier><FreeText>I am hoping you can help me.</FreeText></Answer><Answer><QuestionIdentifier>response105</QuestionIdentifier><FreeText>It's my pleasure to have you here.</FreeText></Answer><Answer><QuestionIdentifier>response11</QuestionIdentifier><FreeText>What are the hours?</FreeText></Answer><Answer><QuestionIdentifier>response12</QuestionIdentifier><FreeText>I will need to get over there right away.</FreeText></Answer><Answer><QuestionIdentifier>response13</QuestionIdentifier><FreeText>I only need one copy.</FreeText></Answer><Answer><QuestionIdentifier>response14</QuestionIdentifier><FreeText>Can you scan a document in there too?</FreeText></Answer><Answer><QuestionIdentifier>response21</QuestionIdentifier><FreeText>I haven't gone in days.</FreeText></Answer><Answer><QuestionIdentifier>response22</QuestionIdentifier><FreeText>I don't think that's the problem.</FreeText></Answer><Answer><QuestionIdentifier>response23</QuestionIdentifier><FreeText>I may need to go to the hospital.</FreeText></Answer><Answer><QuestionIdentifier>response24</QuestionIdentifier><FreeText>I need some medicine.</FreeText></Answer><Answer><QuestionIdentifier>response25</QuestionIdentifier><FreeText>I think it was the shrimp last night.</FreeText></Answer><Answer><QuestionIdentifier>response31</QuestionIdentifier><FreeText>How may I help you?</FreeText></Answer><Answer><QuestionIdentifier>response32</QuestionIdentifier><FreeText>I haven't heard from you in awhile.</FreeText></Answer><Answer><QuestionIdentifier>response33</QuestionIdentifier><FreeText>I don't think John is in yet.</FreeText></Answer><Answer><QuestionIdentifier>response34</QuestionIdentifier><FreeText>Are you coming in today?</FreeText></Answer><Answer><QuestionIdentifier>response35</QuestionIdentifier><FreeText>I hope you aren't calling in sick.</FreeText></Answer><Answer><QuestionIdentifier>response41</QuestionIdentifier><FreeText>I only have cash.</FreeText></Answer><Answer><QuestionIdentifier>response42</QuestionIdentifier><FreeText>I could use my credit card.</FreeText></Answer><Answer><QuestionIdentifier>response43</QuestionIdentifier><FreeText>Do you take American Express?</FreeText></Answer><Answer><QuestionIdentifier>response44</QuestionIdentifier><FreeText>I think I have enough on my debit card.</FreeText></Answer><Answer><QuestionIdentifier>response45</QuestionIdentifier><FreeText>I will ask my friend for his card.</FreeText></Answer><Answer><QuestionIdentifier>response51</QuestionIdentifier><FreeText>You are spoiling me.</FreeText></Answer><Answer><QuestionIdentifier>response52</QuestionIdentifier><FreeText>I appreciate all the hard work you put in for this special meal.</FreeText></Answer><Answer><QuestionIdentifier>response53</QuestionIdentifier><FreeText>We are lucky we can afford this.</FreeText></Answer><Answer><QuestionIdentifier>response54</QuestionIdentifier><FreeText>It isn't often we get steak for dinner.</FreeText></Answer><Answer><QuestionIdentifier>response55</QuestionIdentifier><FreeText>It tastes fantastic too.</FreeText></Answer><Answer><QuestionIdentifier>response61</QuestionIdentifier><FreeText>I should be able to get your security deposit back after you move.</FreeText></Answer><Answer><QuestionIdentifier>response62</QuestionIdentifier><FreeText>The bathroom upstairs was quite a mess and I hope your ceiling isn't wet.</FreeText></Answer><Answer><QuestionIdentifier>response63</QuestionIdentifier><FreeText>The earthquake caused some damage in the other apartments.</FreeText></Answer><Answer><QuestionIdentifier>response64</QuestionIdentifier><FreeText>The police said that there was quite a bit of damage.</FreeText></Answer><Answer><QuestionIdentifier>response65</QuestionIdentifier><FreeText>Let me know when we can bring in the painters.</FreeText></Answer><Answer><QuestionIdentifier>response71</QuestionIdentifier><FreeText>It's a nice day.</FreeText></Answer><Answer><QuestionIdentifier>response72</QuestionIdentifier><FreeText>You need to take a break.</FreeText></Answer><Answer><QuestionIdentifier>response73</QuestionIdentifier><FreeText>Do you feel any better?</FreeText></Answer><Answer><QuestionIdentifier>response74</QuestionIdentifier><FreeText>I hope you were able to get some sleep.</FreeText></Answer><Answer><QuestionIdentifier>response75</QuestionIdentifier><FreeText>Let go out for dinner.</FreeText></Answer><Answer><QuestionIdentifier>response81</QuestionIdentifier><FreeText>Watch out for that car.</FreeText></Answer><Answer><QuestionIdentifier>response82</QuestionIdentifier><FreeText>I hope we have time.</FreeText></Answer><Answer><QuestionIdentifier>response83</QuestionIdentifier><FreeText>Wave at the driver and maybe he will stop.</FreeText></Answer><Answer><QuestionIdentifier>response84</QuestionIdentifier><FreeText>We are going to be late if we miss it.</FreeText></Answer><Answer><QuestionIdentifier>response85</QuestionIdentifier><FreeText>There will be another one soon if we miss it.</FreeText></Answer><Answer><QuestionIdentifier>response91</QuestionIdentifier><FreeText>I didn't mean to be rude.</FreeText></Answer><Answer><QuestionIdentifier>response92</QuestionIdentifier><FreeText>Is there anything I can do to help?</FreeText></Answer><Answer><QuestionIdentifier>response93</QuestionIdentifier><FreeText>We should have drank more water last night.</FreeText></Answer><Answer><QuestionIdentifier>response94</QuestionIdentifier><FreeText>I don't feel so good myself.</FreeText></Answer><Answer><QuestionIdentifier>response95</QuestionIdentifier><FreeText>If you take an aspirin, you will feel better.</FreeText></Answer></QuestionFormAnswers>",I'm interested in the insurance you are selling.,You were lucky I was home today.,It's my only day off so I hope this will be short.,I am hoping you can help me.,It's my pleasure to have you here.,What are the hours?,I will need to get over there right away.,I only need one copy.,Can you scan a document in there too?,NA,I haven't gone in days.,I don't think that's the problem.,I may need to go to the hospital.,I need some medicine.,I think it was the shrimp last night.,How may I help you?,I haven't heard from you in awhile.,I don't think John is in yet.,Are you coming in today?,I hope you aren't calling in sick.,I only have cash.,I could use my credit card.,Do you take American Express?,I think I have enough on my debit card.,I will ask my friend for his card.,You are spoiling me.,I appreciate all the hard work you put in for this special meal.,We are lucky we can afford this.,It isn't often we get steak for dinner.,It tastes fantastic too.,I should be able to get your security deposit back after you move.,The bathroom upstairs was quite a mess and I hope your ceiling isn't wet.,The earthquake caused some damage in the other apartments.,The police said that there was quite a bit of damage.,Let me know when we can bring in the painters.,It's a nice day.,You need to take a break.,Do you feel any better?,I hope you were able to get some sleep.,Let go out for dinner.,Watch out for that car.,I hope we have time.,Wave at the driver and maybe he will stop.,We are going to be late if we miss it.,There will be another one soon if we miss it.,I didn't mean to be rude.,Is there anything I can do to help?,We should have drank more water last night.,I don't feel so good myself.,"If you take an aspirin, you will feel better."
345LHZDEDXSN7DLVYWA75KCT56GU3T,A1JJYY622DGE5L,33CLA8O0MIBOLDCEOVB3DYIHEGYFR3,Submitted,2019-06-21 11:28:35-04:00,NA,2019-06-19 11:18:41-04:00,2019-06-19 11:28:35-04:00,"<?xml version=""1.0"" encoding=""ASCII""?><QuestionFormAnswers xmlns=""http://mechanicalturk.amazonaws.com/AWSMechanicalTurkDataSchemas/2005-10-01/QuestionFormAnswers.xsd""><Answer><QuestionIdentifier>response101</QuestionIdentifier><FreeText>It's hard to meet good guys.</FreeText></Answer><Answer><QuestionIdentifier>response102</QuestionIdentifier><FreeText>How do you know who to trust?</FreeText></Answer><Answer><QuestionIdentifier>response103</QuestionIdentifier><FreeText>Where do you meet people?</FreeText></Answer><Answer><QuestionIdentifier>response11</QuestionIdentifier><FreeText>I won't be home to watch it myself.</FreeText></Answer><Answer><QuestionIdentifier>response12</QuestionIdentifier><FreeText>I will be at work.</FreeText></Answer><Answer><QuestionIdentifier>response13</QuestionIdentifier><FreeText>There are other things I need to do.</FreeText></Answer><Answer><QuestionIdentifier>response14</QuestionIdentifier><FreeText>I would if I could.</FreeText></Answer><Answer><QuestionIdentifier>response21</QuestionIdentifier><FreeText>Do you now where the EDD office is?</FreeText></Answer><Answer><QuestionIdentifier>response22</QuestionIdentifier><FreeText>Do you know their website?</FreeText></Answer><Answer><QuestionIdentifier>response23</QuestionIdentifier><FreeText>Is it faster to go to the office or use the website?</FreeText></Answer><Answer><QuestionIdentifier>response24</QuestionIdentifier><FreeText>Which do you recommend?</FreeText></Answer><Answer><QuestionIdentifier>response25</QuestionIdentifier><FreeText>Thank you so much for the help!</FreeText></Answer><Answer><QuestionIdentifier>response31</QuestionIdentifier><FreeText>Oh, I didn't know it would be that much.</FreeText></Answer><Answer><QuestionIdentifier>response32</QuestionIdentifier><FreeText>Wow, that's a lot more than I thought.</FreeText></Answer><Answer><QuestionIdentifier>response33</QuestionIdentifier><FreeText>I guess I need to save up more money.</FreeText></Answer><Answer><QuestionIdentifier>response41</QuestionIdentifier><FreeText>Yes, I am going to book direct.</FreeText></Answer><Answer><QuestionIdentifier>response42</QuestionIdentifier><FreeText>No, I am using a discount travel website.</FreeText></Answer><Answer><QuestionIdentifier>response43</QuestionIdentifier><FreeText>It depends on where I can get the best deal.</FreeText></Answer><Answer><QuestionIdentifier>response51</QuestionIdentifier><FreeText>You were speeding.</FreeText></Answer><Answer><QuestionIdentifier>response52</QuestionIdentifier><FreeText>A car like this was reported in a crime.</FreeText></Answer><Answer><QuestionIdentifier>response53</QuestionIdentifier><FreeText>You have a tail light that is not working.</FreeText></Answer><Answer><QuestionIdentifier>response61</QuestionIdentifier><FreeText>We are raising money to help educate people on this candidate.</FreeText></Answer><Answer><QuestionIdentifier>response62</QuestionIdentifier><FreeText>Your donation would help to promote the ideas of this candidate.</FreeText></Answer><Answer><QuestionIdentifier>response71</QuestionIdentifier><FreeText>Is there someone specific you'd like an appointment with?</FreeText></Answer><Answer><QuestionIdentifier>response72</QuestionIdentifier><FreeText>What day of the week works best for you?</FreeText></Answer><Answer><QuestionIdentifier>response73</QuestionIdentifier><FreeText>Great! Let me check to see what is available.</FreeText></Answer><Answer><QuestionIdentifier>response81</QuestionIdentifier><FreeText>Is there one for unlimited rides?</FreeText></Answer><Answer><QuestionIdentifier>response82</QuestionIdentifier><FreeText>What is the best deal?</FreeText></Answer><Answer><QuestionIdentifier>response83</QuestionIdentifier><FreeText>How much are they?</FreeText></Answer><Answer><QuestionIdentifier>response91</QuestionIdentifier><FreeText>I am fine, thanks for asking.</FreeText></Answer><Answer><QuestionIdentifier>response92</QuestionIdentifier><FreeText>I've been doing really good.</FreeText></Answer><Answer><QuestionIdentifier>response93</QuestionIdentifier><FreeText>I have been keeping busy.</FreeText></Answer><Answer><QuestionIdentifier>response94</QuestionIdentifier><FreeText>I can't complain.</FreeText></Answer></QuestionFormAnswers>",It's hard to meet good guys.,How do you know who to trust?,Where do you meet people?,NA,NA,I won't be home to watch it myself.,I will be at work.,There are other things I need to do.,I would if I could.,NA,Do you now where the EDD office is?,Do you know their website?,Is it faster to go to the office or use the website?,Which do you recommend?,Thank you so much for the help!,"Oh, I didn't know it would be that much.","Wow, that's a lot more than I thought.",I guess I need to save up more money.,NA,NA,"Yes, I am going to book direct.","No, I am using a discount travel website.",It depends on where I can get the best deal.,NA,NA,You were speeding.,A car like this was reported in a crime.,You have a tail light that is not working.,NA,NA,We are raising money to help educate people on this candidate.,Your donation would help to promote the ideas of this candidate.,NA,NA,NA,Is there someone specific you'd like an appointment with?,What day of the week works best for you?,Great! Let me check to see what is available.,NA,NA,Is there one for unlimited rides?,What is the best deal?,How much are they?,NA,NA,"I am fine, thanks for asking.",I've been doing really good.,I have been keeping busy.,I can't complain.,NA
