AssignmentId,WorkerId,HITId,AssignmentStatus,AutoApprovalTime,ApprovalTime,AcceptTime,SubmitTime,Answer,response101,response102,response103,response104,response105,response11,response12,response13,response14,response15,response21,response22,response23,response24,response25,response31,response32,response33,response34,response35,response41,response42,response43,response44,response45,response51,response52,response53,response54,response55,response61,response62,response63,response64,response65,response71,response72,response73,response74,response75,response81,response82,response83,response84,response85,response91,response92,response93,response94,response95
3QJOXOW4XJR743WJEE0HX1ZWJ92MEJ,A3PSSKMQPOKCEL,3D0LPO3EABZROR1T1TMN8OKS944YOA,Submitted,2019-06-21 11:09:40-04:00,NA,2019-06-19 11:02:21-04:00,2019-06-19 11:09:40-04:00,"<?xml version=""1.0"" encoding=""ASCII""?><QuestionFormAnswers xmlns=""http://mechanicalturk.amazonaws.com/AWSMechanicalTurkDataSchemas/2005-10-01/QuestionFormAnswers.xsd""><Answer><QuestionIdentifier>response101</QuestionIdentifier><FreeText>That would work.</FreeText></Answer><Answer><QuestionIdentifier>response102</QuestionIdentifier><FreeText>No, in the head.</FreeText></Answer><Answer><QuestionIdentifier>response11</QuestionIdentifier><FreeText>to finish the job we were given.</FreeText></Answer><Answer><QuestionIdentifier>response12</QuestionIdentifier><FreeText>because they told us to be here at this time.</FreeText></Answer><Answer><QuestionIdentifier>response21</QuestionIdentifier><FreeText>Popular in the not so good way.</FreeText></Answer><Answer><QuestionIdentifier>response22</QuestionIdentifier><FreeText>If you want to call it that.</FreeText></Answer><Answer><QuestionIdentifier>response31</QuestionIdentifier><FreeText>I'm always ready to drink a toast!</FreeText></Answer><Answer><QuestionIdentifier>response32</QuestionIdentifier><FreeText>If its to the Cardinal then of course!</FreeText></Answer><Answer><QuestionIdentifier>response41</QuestionIdentifier><FreeText>I'm glad, most people wouldn't.</FreeText></Answer><Answer><QuestionIdentifier>response42</QuestionIdentifier><FreeText>Did you find the book you were looking for?</FreeText></Answer><Answer><QuestionIdentifier>response51</QuestionIdentifier><FreeText>He's turning 12 next month.</FreeText></Answer><Answer><QuestionIdentifier>response52</QuestionIdentifier><FreeText>He's about to be 14.</FreeText></Answer><Answer><QuestionIdentifier>response61</QuestionIdentifier><FreeText>I have wonderful taste.</FreeText></Answer><Answer><QuestionIdentifier>response62</QuestionIdentifier><FreeText>But you pulled the look off great!</FreeText></Answer><Answer><QuestionIdentifier>response71</QuestionIdentifier><FreeText>I am being hijacked!</FreeText></Answer><Answer><QuestionIdentifier>response72</QuestionIdentifier><FreeText>Like they would ever believe that.</FreeText></Answer><Answer><QuestionIdentifier>response81</QuestionIdentifier><FreeText>You can leave right through that door.</FreeText></Answer><Answer><QuestionIdentifier>response82</QuestionIdentifier><FreeText>Your in a hospital, I wouldn't recommend leaving just yet. </FreeText></Answer><Answer><QuestionIdentifier>response91</QuestionIdentifier><FreeText>Can always use a second opinion.</FreeText></Answer><Answer><QuestionIdentifier>response92</QuestionIdentifier><FreeText>Never hurts to have some help.</FreeText></Answer></QuestionFormAnswers>",That would work.,"No, in the head.",NA,NA,NA,to finish the job we were given.,because they told us to be here at this time.,NA,NA,NA,Popular in the not so good way.,If you want to call it that.,NA,NA,NA,I'm always ready to drink a toast!,If its to the Cardinal then of course!,NA,NA,NA,"I'm glad, most people wouldn't.",Did you find the book you were looking for?,NA,NA,NA,He's turning 12 next month.,He's about to be 14.,NA,NA,NA,I have wonderful taste.,But you pulled the look off great!,NA,NA,NA,I am being hijacked!,Like they would ever believe that.,NA,NA,NA,You can leave right through that door.,"Your in a hospital, I wouldn't recommend leaving just yet.",NA,NA,NA,Can always use a second opinion.,Never hurts to have some help.,NA,NA,NA
3PJ71Z61R42TDIJDDH1XLVAIU1Z91W,A3UV95L5M6RF7B,3D0LPO3EABZROR1T1TMN8OKS944YOA,Submitted,2019-06-21 11:55:40-04:00,NA,2019-06-19 11:40:06-04:00,2019-06-19 11:55:40-04:00,"<?xml version=""1.0"" encoding=""ASCII""?><QuestionFormAnswers xmlns=""http://mechanicalturk.amazonaws.com/AWSMechanicalTurkDataSchemas/2005-10-01/QuestionFormAnswers.xsd""><Answer><QuestionIdentifier>response101</QuestionIdentifier><FreeText>NO IN THE SHOULDER</FreeText></Answer><Answer><QuestionIdentifier>response102</QuestionIdentifier><FreeText>DON'T SHOOT AT LEG</FreeText></Answer><Answer><QuestionIdentifier>response11</QuestionIdentifier><FreeText>JUST TO WATCH MOVIE</FreeText></Answer><Answer><QuestionIdentifier>response12</QuestionIdentifier><FreeText>EVEN IN THIS CROWD I GOT THE TICKET'S</FreeText></Answer><Answer><QuestionIdentifier>response13</QuestionIdentifier><FreeText>LET GO </FreeText></Answer><Answer><QuestionIdentifier>response14</QuestionIdentifier><FreeText>LET WATCH THE MOVIE</FreeText></Answer><Answer><QuestionIdentifier>response15</QuestionIdentifier><FreeText>BE COOL</FreeText></Answer><Answer><QuestionIdentifier>response21</QuestionIdentifier><FreeText>IF U NOT AN POPULAR THAT YOU TELLING?</FreeText></Answer><Answer><QuestionIdentifier>response22</QuestionIdentifier><FreeText>EVEN THAT WE MAY DARE BEAT YOU</FreeText></Answer><Answer><QuestionIdentifier>response23</QuestionIdentifier><FreeText>AND SURELY KILL YOU</FreeText></Answer><Answer><QuestionIdentifier>response24</QuestionIdentifier><FreeText>AS LIKE THAT YOU HAVE DONE THE THING TODAY</FreeText></Answer><Answer><QuestionIdentifier>response25</QuestionIdentifier><FreeText>LET HIM BEAT</FreeText></Answer><Answer><QuestionIdentifier>response31</QuestionIdentifier><FreeText>YA SURE</FreeText></Answer><Answer><QuestionIdentifier>response32</QuestionIdentifier><FreeText>LET WE DRINK TODAY</FreeText></Answer><Answer><QuestionIdentifier>response33</QuestionIdentifier><FreeText>BRANDY IS ENOUGH FOR ME</FreeText></Answer><Answer><QuestionIdentifier>response34</QuestionIdentifier><FreeText>YA I'M THE MUSKEETER'S</FreeText></Answer><Answer><QuestionIdentifier>response35</QuestionIdentifier><FreeText>LET DRINK</FreeText></Answer><Answer><QuestionIdentifier>response41</QuestionIdentifier><FreeText>IS IT? THANK U</FreeText></Answer><Answer><QuestionIdentifier>response42</QuestionIdentifier><FreeText>U WEAR ON THAT DAY A BLACK SHIRT.</FreeText></Answer><Answer><QuestionIdentifier>response43</QuestionIdentifier><FreeText>I FORGOT YOUR NAME THAT DAY YOU TOLD .</FreeText></Answer><Answer><QuestionIdentifier>response44</QuestionIdentifier><FreeText>HAVE A NICE DAY </FreeText></Answer><Answer><QuestionIdentifier>response45</QuestionIdentifier><FreeText>THANK YOU</FreeText></Answer><Answer><QuestionIdentifier>response51</QuestionIdentifier><FreeText>MY NEPHEW NAME IS JASS</FreeText></Answer><Answer><QuestionIdentifier>response52</QuestionIdentifier><FreeText>I THINK U MAY KNOW HIM</FreeText></Answer><Answer><QuestionIdentifier>response61</QuestionIdentifier><FreeText>NO U ARE NOT LOKKING UGLY</FreeText></Answer><Answer><QuestionIdentifier>response62</QuestionIdentifier><FreeText>YOU MAY LOOK SO SMART</FreeText></Answer><Answer><QuestionIdentifier>response71</QuestionIdentifier><FreeText>VEHICLE IS IMPORTANT TO ALL OF US</FreeText></Answer><Answer><QuestionIdentifier>response72</QuestionIdentifier><FreeText>WE BOTH RIDE TOGETHER</FreeText></Answer><Answer><QuestionIdentifier>response81</QuestionIdentifier><FreeText>HI LET LEAVE </FreeText></Answer><Answer><QuestionIdentifier>response82</QuestionIdentifier><FreeText>TOGHETHER</FreeText></Answer><Answer><QuestionIdentifier>response91</QuestionIdentifier><FreeText>LET WE DISCUSS</FreeText></Answer><Answer><QuestionIdentifier>response92</QuestionIdentifier><FreeText>TOGETHER TONIGHT</FreeText></Answer></QuestionFormAnswers>",NO IN THE SHOULDER,DON'T SHOOT AT LEG,NA,NA,NA,JUST TO WATCH MOVIE,EVEN IN THIS CROWD I GOT THE TICKET'S,LET GO,LET WATCH THE MOVIE,BE COOL,IF U NOT AN POPULAR THAT YOU TELLING?,EVEN THAT WE MAY DARE BEAT YOU,AND SURELY KILL YOU,AS LIKE THAT YOU HAVE DONE THE THING TODAY,LET HIM BEAT,YA SURE,LET WE DRINK TODAY,BRANDY IS ENOUGH FOR ME,YA I'M THE MUSKEETER'S,LET DRINK,IS IT? THANK U,U WEAR ON THAT DAY A BLACK SHIRT.,I FORGOT YOUR NAME THAT DAY YOU TOLD .,HAVE A NICE DAY,THANK YOU,MY NEPHEW NAME IS JASS,I THINK U MAY KNOW HIM,NA,NA,NA,NO U ARE NOT LOKKING UGLY,YOU MAY LOOK SO SMART,NA,NA,NA,VEHICLE IS IMPORTANT TO ALL OF US,WE BOTH RIDE TOGETHER,NA,NA,NA,HI LET LEAVE,TOGHETHER,NA,NA,NA,LET WE DISCUSS,TOGETHER TONIGHT,NA,NA,NA
3KAKFY4PGU2IYMQV4FLTMHOIBCB3IE,A3I97794CB5SUO,3D0LPO3EABZROR1T1TMN8OKS944YOA,Submitted,2019-06-21 12:58:39-04:00,NA,2019-06-19 12:42:10-04:00,2019-06-19 12:58:39-04:00,"<?xml version=""1.0"" encoding=""ASCII""?><QuestionFormAnswers xmlns=""http://mechanicalturk.amazonaws.com/AWSMechanicalTurkDataSchemas/2005-10-01/QuestionFormAnswers.xsd""><Answer><QuestionIdentifier>response101</QuestionIdentifier><FreeText>If that's all you can hit, sure!</FreeText></Answer><Answer><QuestionIdentifier>response102</QuestionIdentifier><FreeText>No, in the head!</FreeText></Answer><Answer><QuestionIdentifier>response103</QuestionIdentifier><FreeText>Whatever works!</FreeText></Answer><Answer><QuestionIdentifier>response104</QuestionIdentifier><FreeText>I don't care, just shoot him!</FreeText></Answer><Answer><QuestionIdentifier>response105</QuestionIdentifier><FreeText>Just shoot now!</FreeText></Answer><Answer><QuestionIdentifier>response11</QuestionIdentifier><FreeText>Because we're going to have a fun time!</FreeText></Answer><Answer><QuestionIdentifier>response12</QuestionIdentifier><FreeText>Because it's our job.</FreeText></Answer><Answer><QuestionIdentifier>response13</QuestionIdentifier><FreeText>We're here because we don't have any choice but to be here.</FreeText></Answer><Answer><QuestionIdentifier>response14</QuestionIdentifier><FreeText>Because this is where the girls are.</FreeText></Answer><Answer><QuestionIdentifier>response15</QuestionIdentifier><FreeText>Because we're getting paid to be here.</FreeText></Answer><Answer><QuestionIdentifier>response21</QuestionIdentifier><FreeText>Let's hope you don't get more popular.</FreeText></Answer><Answer><QuestionIdentifier>response22</QuestionIdentifier><FreeText>These people are all crazy, you know.</FreeText></Answer><Answer><QuestionIdentifier>response23</QuestionIdentifier><FreeText>Why would I be surprised?</FreeText></Answer><Answer><QuestionIdentifier>response24</QuestionIdentifier><FreeText>Maybe you should think about toning down what you say?</FreeText></Answer><Answer><QuestionIdentifier>response25</QuestionIdentifier><FreeText>You're kind of a jerk sometimes, you know?</FreeText></Answer><Answer><QuestionIdentifier>response31</QuestionIdentifier><FreeText>I don't think so, no.</FreeText></Answer><Answer><QuestionIdentifier>response32</QuestionIdentifier><FreeText>I'd be pleased to drink a toast to anyone or anything you ask!</FreeText></Answer><Answer><QuestionIdentifier>response33</QuestionIdentifier><FreeText>If there's drinking involved I'm always willing.</FreeText></Answer><Answer><QuestionIdentifier>response34</QuestionIdentifier><FreeText>I'd drink to the devil himself if the brandy is fine enough.</FreeText></Answer><Answer><QuestionIdentifier>response35</QuestionIdentifier><FreeText>Well, I don't care for brandy, honestly.</FreeText></Answer><Answer><QuestionIdentifier>response41</QuestionIdentifier><FreeText>I thought you would.</FreeText></Answer><Answer><QuestionIdentifier>response42</QuestionIdentifier><FreeText>Do you really remember me?</FreeText></Answer><Answer><QuestionIdentifier>response43</QuestionIdentifier><FreeText>I was wondering if you'd like to get together sometime?</FreeText></Answer><Answer><QuestionIdentifier>response44</QuestionIdentifier><FreeText>Yes, I expect you do remember how rude you were to me, also.</FreeText></Answer><Answer><QuestionIdentifier>response45</QuestionIdentifier><FreeText>I should think so after that kiss.</FreeText></Answer><Answer><QuestionIdentifier>response51</QuestionIdentifier><FreeText>He's only seven.</FreeText></Answer><Answer><QuestionIdentifier>response52</QuestionIdentifier><FreeText>He will be nine in two weeks.</FreeText></Answer><Answer><QuestionIdentifier>response53</QuestionIdentifier><FreeText>Well, I know you have kids so I thought I might invite them to his tenth birthday party which will be the week after he gets here.</FreeText></Answer><Answer><QuestionIdentifier>response54</QuestionIdentifier><FreeText>Oh, he's just a little baby. Six months.</FreeText></Answer><Answer><QuestionIdentifier>response55</QuestionIdentifier><FreeText>He'll be sixteen this year.</FreeText></Answer><Answer><QuestionIdentifier>response61</QuestionIdentifier><FreeText>Not all nuns are ugly.</FreeText></Answer><Answer><QuestionIdentifier>response62</QuestionIdentifier><FreeText>I said I was sorry about it.</FreeText></Answer><Answer><QuestionIdentifier>response63</QuestionIdentifier><FreeText>I'm sure I did better this time.</FreeText></Answer><Answer><QuestionIdentifier>response64</QuestionIdentifier><FreeText>Well, you didn't look ugly but you did look like a nun.</FreeText></Answer><Answer><QuestionIdentifier>response65</QuestionIdentifier><FreeText>No dress could make you look ugly.</FreeText></Answer><Answer><QuestionIdentifier>response71</QuestionIdentifier><FreeText>No one is going to believe that!</FreeText></Answer><Answer><QuestionIdentifier>response72</QuestionIdentifier><FreeText>I guess that will work, yes.</FreeText></Answer><Answer><QuestionIdentifier>response73</QuestionIdentifier><FreeText>Are you crazy?</FreeText></Answer><Answer><QuestionIdentifier>response74</QuestionIdentifier><FreeText>I don't care what you need!</FreeText></Answer><Answer><QuestionIdentifier>response75</QuestionIdentifier><FreeText>That is the stupidest idea I have ever heard!</FreeText></Answer><Answer><QuestionIdentifier>response81</QuestionIdentifier><FreeText>You're in the future and you cannot leave.</FreeText></Answer><Answer><QuestionIdentifier>response82</QuestionIdentifier><FreeText>You're in the place you're in and the only way out is to do what you are told to do.</FreeText></Answer><Answer><QuestionIdentifier>response83</QuestionIdentifier><FreeText>You're here and you are stuck here forever.</FreeText></Answer><Answer><QuestionIdentifier>response84</QuestionIdentifier><FreeText>You got here on your own and you don't know how to reverse it?</FreeText></Answer><Answer><QuestionIdentifier>response85</QuestionIdentifier><FreeText>You're where we want you to be. And you'll never leave.</FreeText></Answer><Answer><QuestionIdentifier>response91</QuestionIdentifier><FreeText>It really doesn't seem that way to me. </FreeText></Answer><Answer><QuestionIdentifier>response92</QuestionIdentifier><FreeText>I still want to know what you think.</FreeText></Answer><Answer><QuestionIdentifier>response93</QuestionIdentifier><FreeText>We really need a neutral party, I think.</FreeText></Answer><Answer><QuestionIdentifier>response94</QuestionIdentifier><FreeText>No. Please help us.</FreeText></Answer><Answer><QuestionIdentifier>response95</QuestionIdentifier><FreeText>We both value your thoughts.</FreeText></Answer></QuestionFormAnswers>","If that's all you can hit, sure!","No, in the head!",Whatever works!,"I don't care, just shoot him!",Just shoot now!,Because we're going to have a fun time!,Because it's our job.,We're here because we don't have any choice but to be here.,Because this is where the girls are.,Because we're getting paid to be here.,Let's hope you don't get more popular.,"These people are all crazy, you know.",Why would I be surprised?,Maybe you should think about toning down what you say?,"You're kind of a jerk sometimes, you know?","I don't think so, no.",I'd be pleased to drink a toast to anyone or anything you ask!,If there's drinking involved I'm always willing.,I'd drink to the devil himself if the brandy is fine enough.,"Well, I don't care for brandy, honestly.",I thought you would.,Do you really remember me?,I was wondering if you'd like to get together sometime?,"Yes, I expect you do remember how rude you were to me, also.",I should think so after that kiss.,He's only seven.,He will be nine in two weeks.,"Well, I know you have kids so I thought I might invite them to his tenth birthday party which will be the week after he gets here.","Oh, he's just a little baby. Six months.",He'll be sixteen this year.,Not all nuns are ugly.,I said I was sorry about it.,I'm sure I did better this time.,"Well, you didn't look ugly but you did look like a nun.",No dress could make you look ugly.,No one is going to believe that!,"I guess that will work, yes.",Are you crazy?,I don't care what you need!,That is the stupidest idea I have ever heard!,You're in the future and you cannot leave.,You're in the place you're in and the only way out is to do what you are told to do.,You're here and you are stuck here forever.,You got here on your own and you don't know how to reverse it?,You're where we want you to be. And you'll never leave.,It really doesn't seem that way to me.,I still want to know what you think.,"We really need a neutral party, I think.",No. Please help us.,We both value your thoughts.
3AUQQEL7U5TR30BYKZ2TZ8G5G2L0VB,A3OK67ZUPCJR1K,3LAZVA75NIR1N68M88FSZKJNUPA2OY,Submitted,2019-06-21 12:40:19-04:00,NA,2019-06-19 12:23:34-04:00,2019-06-19 12:40:19-04:00,"<?xml version=""1.0"" encoding=""ASCII""?><QuestionFormAnswers xmlns=""http://mechanicalturk.amazonaws.com/AWSMechanicalTurkDataSchemas/2005-10-01/QuestionFormAnswers.xsd""><Answer><QuestionIdentifier>response101</QuestionIdentifier><FreeText>I didn't really decide to do that, it just sort of happened.</FreeText></Answer><Answer><QuestionIdentifier>response102</QuestionIdentifier><FreeText>It wasn't planned if that's what you think.</FreeText></Answer><Answer><QuestionIdentifier>response103</QuestionIdentifier><FreeText>Yeah, I decided to break into his house instead.</FreeText></Answer><Answer><QuestionIdentifier>response11</QuestionIdentifier><FreeText>Then show me.</FreeText></Answer><Answer><QuestionIdentifier>response12</QuestionIdentifier><FreeText>nobody can</FreeText></Answer><Answer><QuestionIdentifier>response13</QuestionIdentifier><FreeText>cannot. cannot. cannot</FreeText></Answer><Answer><QuestionIdentifier>response14</QuestionIdentifier><FreeText>You only make-believed you could.</FreeText></Answer><Answer><QuestionIdentifier>response15</QuestionIdentifier><FreeText>Your eyes are shut, you never moved.</FreeText></Answer><Answer><QuestionIdentifier>response21</QuestionIdentifier><FreeText>You only have three minutes.</FreeText></Answer><Answer><QuestionIdentifier>response22</QuestionIdentifier><FreeText>Thinking isn't knowing</FreeText></Answer><Answer><QuestionIdentifier>response23</QuestionIdentifier><FreeText>You really should double check.</FreeText></Answer><Answer><QuestionIdentifier>response24</QuestionIdentifier><FreeText>Yes, I heard you, but you didn't sound sure.</FreeText></Answer><Answer><QuestionIdentifier>response31</QuestionIdentifier><FreeText>It just wasn't really my type of show.</FreeText></Answer><Answer><QuestionIdentifier>response32</QuestionIdentifier><FreeText>I've seen better.</FreeText></Answer><Answer><QuestionIdentifier>response33</QuestionIdentifier><FreeText>It wasn't bad, but I wouldn't say it was better then usual.</FreeText></Answer><Answer><QuestionIdentifier>response34</QuestionIdentifier><FreeText>If you liked it, that's all that matters.</FreeText></Answer><Answer><QuestionIdentifier>response35</QuestionIdentifier><FreeText>I haven't seen enough shows to know if its better then usual.</FreeText></Answer><Answer><QuestionIdentifier>response41</QuestionIdentifier><FreeText>Not nice.</FreeText></Answer><Answer><QuestionIdentifier>response42</QuestionIdentifier><FreeText>Maybe, can you just check.</FreeText></Answer><Answer><QuestionIdentifier>response43</QuestionIdentifier><FreeText>I just don't want things to be awkward.</FreeText></Answer><Answer><QuestionIdentifier>response44</QuestionIdentifier><FreeText>Hey, I'd do the same for you.</FreeText></Answer><Answer><QuestionIdentifier>response45</QuestionIdentifier><FreeText>I'd rather you think I'm pathetic the have her think it. So just check.</FreeText></Answer><Answer><QuestionIdentifier>response51</QuestionIdentifier><FreeText>So where does that leave us.</FreeText></Answer><Answer><QuestionIdentifier>response52</QuestionIdentifier><FreeText>Why didn't you tell you you didn't know earlier.</FreeText></Answer><Answer><QuestionIdentifier>response53</QuestionIdentifier><FreeText>So we have no idea who is trying to kill me.</FreeText></Answer><Answer><QuestionIdentifier>response54</QuestionIdentifier><FreeText>Are you even sure its a he?</FreeText></Answer><Answer><QuestionIdentifier>response55</QuestionIdentifier><FreeText>So you are going to leave me even though we don't know who is trying to kill me?</FreeText></Answer><Answer><QuestionIdentifier>response61</QuestionIdentifier><FreeText>Yeah, but where</FreeText></Answer><Answer><QuestionIdentifier>response62</QuestionIdentifier><FreeText>Won't that add more proof to the bodies.</FreeText></Answer><Answer><QuestionIdentifier>response63</QuestionIdentifier><FreeText>What if someone finds them.</FreeText></Answer><Answer><QuestionIdentifier>response64</QuestionIdentifier><FreeText>How do you know all this.</FreeText></Answer><Answer><QuestionIdentifier>response65</QuestionIdentifier><FreeText>Are you sure the bodies are the only proof.</FreeText></Answer><Answer><QuestionIdentifier>response71</QuestionIdentifier><FreeText>Shouldn't one of us stay just in case.</FreeText></Answer><Answer><QuestionIdentifier>response72</QuestionIdentifier><FreeText>Won't we get in trouble leaving him to attend a ribbon cutting?</FreeText></Answer><Answer><QuestionIdentifier>response73</QuestionIdentifier><FreeText>If we get in trouble over this, i'm saying it was your idea to leave him.</FreeText></Answer><Answer><QuestionIdentifier>response74</QuestionIdentifier><FreeText>Not to be insolent, but that's a bad idea.</FreeText></Answer><Answer><QuestionIdentifier>response81</QuestionIdentifier><FreeText>Fuck that, if not you then who.</FreeText></Answer><Answer><QuestionIdentifier>response82</QuestionIdentifier><FreeText>Shit, you know you did.</FreeText></Answer><Answer><QuestionIdentifier>response83</QuestionIdentifier><FreeText>Give it up, your ass was on the camera.</FreeText></Answer><Answer><QuestionIdentifier>response84</QuestionIdentifier><FreeText>I've go witnesses that say you did.</FreeText></Answer><Answer><QuestionIdentifier>response85</QuestionIdentifier><FreeText>Yeah, everyone says that. Gonna say it wasn't you holding the weapon?</FreeText></Answer><Answer><QuestionIdentifier>response91</QuestionIdentifier><FreeText>I'll deal with it tomorrow.</FreeText></Answer><Answer><QuestionIdentifier>response92</QuestionIdentifier><FreeText>All you have to do is kiss me tomorrow, and I'll pick you.</FreeText></Answer></QuestionFormAnswers>","I didn't really decide to do that, it just sort of happened.",It wasn't planned if that's what you think.,"Yeah, I decided to break into his house instead.",NA,NA,Then show me.,nobody can,cannot. cannot. cannot,You only make-believed you could.,"Your eyes are shut, you never moved.",You only have three minutes.,Thinking isn't knowing,You really should double check.,"Yes, I heard you, but you didn't sound sure.",NA,It just wasn't really my type of show.,I've seen better.,"It wasn't bad, but I wouldn't say it was better then usual.","If you liked it, that's all that matters.",I haven't seen enough shows to know if its better then usual.,Not nice.,"Maybe, can you just check.",I just don't want things to be awkward.,"Hey, I'd do the same for you.",I'd rather you think I'm pathetic the have her think it. So just check.,So where does that leave us.,Why didn't you tell you you didn't know earlier.,So we have no idea who is trying to kill me.,Are you even sure its a he?,So you are going to leave me even though we don't know who is trying to kill me?,"Yeah, but where",Won't that add more proof to the bodies.,What if someone finds them.,How do you know all this.,Are you sure the bodies are the only proof.,Shouldn't one of us stay just in case.,Won't we get in trouble leaving him to attend a ribbon cutting?,"If we get in trouble over this, i'm saying it was your idea to leave him.","Not to be insolent, but that's a bad idea.",NA,"Fuck that, if not you then who.","Shit, you know you did.","Give it up, your ass was on the camera.",I've go witnesses that say you did.,"Yeah, everyone says that. Gonna say it wasn't you holding the weapon?",I'll deal with it tomorrow.,"All you have to do is kiss me tomorrow, and I'll pick you.",NA,NA,NA
