AssignmentId,WorkerId,HITId,AssignmentStatus,AutoApprovalTime,ApprovalTime,AcceptTime,SubmitTime,Answer,response101,response102,response103,response104,response105,response11,response12,response13,response14,response15,response21,response22,response23,response24,response25,response31,response32,response33,response34,response35,response41,response42,response43,response44,response45,response51,response52,response53,response54,response55,response61,response62,response63,response64,response65,response71,response72,response73,response74,response75,response81,response82,response83,response84,response85,response91,response92,response93,response94,response95
3ZPBJO59KP1GKJH8RM9KZE9F2CKDHS,A524WZ3LA2L2K,36D1BWBEHN1DN3NAVS0F7GUIZPV2MJ,Submitted,2019-06-21 12:43:54-04:00,NA,2019-06-19 12:38:36-04:00,2019-06-19 12:43:54-04:00,"<?xml version=""1.0"" encoding=""ASCII""?><QuestionFormAnswers xmlns=""http://mechanicalturk.amazonaws.com/AWSMechanicalTurkDataSchemas/2005-10-01/QuestionFormAnswers.xsd""><Answer><QuestionIdentifier>response101</QuestionIdentifier><FreeText>Yes, I would love that.</FreeText></Answer><Answer><QuestionIdentifier>response102</QuestionIdentifier><FreeText>Of Course. I always want a beautiful person on my arm.</FreeText></Answer><Answer><QuestionIdentifier>response11</QuestionIdentifier><FreeText>I have eyes, its not that hard to see.</FreeText></Answer><Answer><QuestionIdentifier>response12</QuestionIdentifier><FreeText>Im secure enough in my masculinity to admit another man is good looking.</FreeText></Answer><Answer><QuestionIdentifier>response21</QuestionIdentifier><FreeText>as you wish.</FreeText></Answer><Answer><QuestionIdentifier>response22</QuestionIdentifier><FreeText>You sure? it would be fun.</FreeText></Answer><Answer><QuestionIdentifier>response31</QuestionIdentifier><FreeText>Where too?</FreeText></Answer><Answer><QuestionIdentifier>response32</QuestionIdentifier><FreeText>How are we moving them?</FreeText></Answer><Answer><QuestionIdentifier>response41</QuestionIdentifier><FreeText>Alright lets get to the lake.</FreeText></Answer><Answer><QuestionIdentifier>response42</QuestionIdentifier><FreeText>All aboard the boats.</FreeText></Answer><Answer><QuestionIdentifier>response51</QuestionIdentifier><FreeText>Get me out of here now!</FreeText></Answer><Answer><QuestionIdentifier>response52</QuestionIdentifier><FreeText>Answer my question dammit.</FreeText></Answer><Answer><QuestionIdentifier>response61</QuestionIdentifier><FreeText>What oprah are you watching?</FreeText></Answer><Answer><QuestionIdentifier>response62</QuestionIdentifier><FreeText>That escalated quickly. </FreeText></Answer><Answer><QuestionIdentifier>response71</QuestionIdentifier><FreeText>Thats why I quit!</FreeText></Answer><Answer><QuestionIdentifier>response72</QuestionIdentifier><FreeText>I don't give a fuck.</FreeText></Answer><Answer><QuestionIdentifier>response81</QuestionIdentifier><FreeText>Sorry, I have no idea who you are.</FreeText></Answer><Answer><QuestionIdentifier>response82</QuestionIdentifier><FreeText>I don't even know who you are.</FreeText></Answer><Answer><QuestionIdentifier>response91</QuestionIdentifier><FreeText>Yeah its an A.</FreeText></Answer><Answer><QuestionIdentifier>response92</QuestionIdentifier><FreeText>Its a 97 actually</FreeText></Answer></QuestionFormAnswers>","Yes, I would love that.",Of Course. I always want a beautiful person on my arm.,NA,NA,NA,"I have eyes, its not that hard to see.",Im secure enough in my masculinity to admit another man is good looking.,NA,NA,NA,as you wish.,You sure? it would be fun.,NA,NA,NA,Where too?,How are we moving them?,NA,NA,NA,Alright lets get to the lake.,All aboard the boats.,NA,NA,NA,Get me out of here now!,Answer my question dammit.,NA,NA,NA,What oprah are you watching?,That escalated quickly.,NA,NA,NA,Thats why I quit!,I don't give a fuck.,NA,NA,NA,"Sorry, I have no idea who you are.",I don't even know who you are.,NA,NA,NA,Yeah its an A.,Its a 97 actually,NA,NA,NA
3WI0P0II61ST9DVBNRLEDIBLPK9RDS,A2U4MJ6TG6AYAH,3PCPFX4U40QO9CXEBGM3888CIUWQFD,Submitted,2019-06-21 11:55:33-04:00,NA,2019-06-19 11:43:22-04:00,2019-06-19 11:55:33-04:00,"<?xml version=""1.0"" encoding=""ASCII""?><QuestionFormAnswers xmlns=""http://mechanicalturk.amazonaws.com/AWSMechanicalTurkDataSchemas/2005-10-01/QuestionFormAnswers.xsd""><Answer><QuestionIdentifier>response101</QuestionIdentifier><FreeText>What truth?</FreeText></Answer><Answer><QuestionIdentifier>response102</QuestionIdentifier><FreeText>Kiddie porn?  You're disgusting.</FreeText></Answer><Answer><QuestionIdentifier>response103</QuestionIdentifier><FreeText>I can't talk to someone like you.</FreeText></Answer><Answer><QuestionIdentifier>response104</QuestionIdentifier><FreeText>What are you talking about?</FreeText></Answer><Answer><QuestionIdentifier>response105</QuestionIdentifier><FreeText>Are you a sex offender?!</FreeText></Answer><Answer><QuestionIdentifier>response11</QuestionIdentifier><FreeText>You can make time.  I really need your help!</FreeText></Answer><Answer><QuestionIdentifier>response12</QuestionIdentifier><FreeText>I don't understand why you're not willing to help me.</FreeText></Answer><Answer><QuestionIdentifier>response13</QuestionIdentifier><FreeText>I thought we were friends?</FreeText></Answer><Answer><QuestionIdentifier>response14</QuestionIdentifier><FreeText>Why are you saying we're out of time?</FreeText></Answer><Answer><QuestionIdentifier>response15</QuestionIdentifier><FreeText>I didn't kill my girlfriend!</FreeText></Answer><Answer><QuestionIdentifier>response21</QuestionIdentifier><FreeText>What are you up for?</FreeText></Answer><Answer><QuestionIdentifier>response22</QuestionIdentifier><FreeText>Leave me alone.</FreeText></Answer><Answer><QuestionIdentifier>response23</QuestionIdentifier><FreeText>I said it's none of you business.</FreeText></Answer><Answer><QuestionIdentifier>response24</QuestionIdentifier><FreeText>Leave me alone.</FreeText></Answer><Answer><QuestionIdentifier>response25</QuestionIdentifier><FreeText>I'll talk to you about this later. </FreeText></Answer><Answer><QuestionIdentifier>response31</QuestionIdentifier><FreeText>It did happen.</FreeText></Answer><Answer><QuestionIdentifier>response32</QuestionIdentifier><FreeText>It didn't happen.</FreeText></Answer><Answer><QuestionIdentifier>response33</QuestionIdentifier><FreeText>I don't know what you're talking about.</FreeText></Answer><Answer><QuestionIdentifier>response34</QuestionIdentifier><FreeText>I said I didn't know.</FreeText></Answer><Answer><QuestionIdentifier>response35</QuestionIdentifier><FreeText>Let's not talk about this right now.</FreeText></Answer><Answer><QuestionIdentifier>response41</QuestionIdentifier><FreeText>I am very good.</FreeText></Answer><Answer><QuestionIdentifier>response42</QuestionIdentifier><FreeText>It is a nice house.  I live very well.</FreeText></Answer><Answer><QuestionIdentifier>response43</QuestionIdentifier><FreeText>I'm a great shaman.  Not a medicine man.</FreeText></Answer><Answer><QuestionIdentifier>response44</QuestionIdentifier><FreeText>I have healed many people.</FreeText></Answer><Answer><QuestionIdentifier>response45</QuestionIdentifier><FreeText>Shamans make good money.</FreeText></Answer><Answer><QuestionIdentifier>response51</QuestionIdentifier><FreeText>There wasn't any dope in the diaper!</FreeText></Answer><Answer><QuestionIdentifier>response52</QuestionIdentifier><FreeText>I would never put dope in a diaper.  Gross.</FreeText></Answer><Answer><QuestionIdentifier>response53</QuestionIdentifier><FreeText>I don't know what you're talking about.</FreeText></Answer><Answer><QuestionIdentifier>response54</QuestionIdentifier><FreeText>Who puts dope in a diaper?</FreeText></Answer><Answer><QuestionIdentifier>response55</QuestionIdentifier><FreeText>Ew.  Why would you ask that?</FreeText></Answer><Answer><QuestionIdentifier>response61</QuestionIdentifier><FreeText>I don't know where it is.</FreeText></Answer><Answer><QuestionIdentifier>response62</QuestionIdentifier><FreeText>It's not to big for me.</FreeText></Answer><Answer><QuestionIdentifier>response63</QuestionIdentifier><FreeText>I don't know where the sub is going.</FreeText></Answer><Answer><QuestionIdentifier>response64</QuestionIdentifier><FreeText>Where is what?</FreeText></Answer><Answer><QuestionIdentifier>response65</QuestionIdentifier><FreeText>What are you talking about?</FreeText></Answer><Answer><QuestionIdentifier>response71</QuestionIdentifier><FreeText>Okay, well hurry up please.</FreeText></Answer><Answer><QuestionIdentifier>response72</QuestionIdentifier><FreeText>We can't hold up dinner for you.</FreeText></Answer><Answer><QuestionIdentifier>response73</QuestionIdentifier><FreeText>Please hurry; I'm hungry.</FreeText></Answer><Answer><QuestionIdentifier>response74</QuestionIdentifier><FreeText>We're all starving, hurry!</FreeText></Answer><Answer><QuestionIdentifier>response75</QuestionIdentifier><FreeText>We're starting without you.</FreeText></Answer><Answer><QuestionIdentifier>response81</QuestionIdentifier><FreeText>As I should be.  I'm awesome.</FreeText></Answer><Answer><QuestionIdentifier>response82</QuestionIdentifier><FreeText>I love you.</FreeText></Answer><Answer><QuestionIdentifier>response83</QuestionIdentifier><FreeText>I dream of you too.</FreeText></Answer><Answer><QuestionIdentifier>response84</QuestionIdentifier><FreeText>You're so wonderful.</FreeText></Answer><Answer><QuestionIdentifier>response85</QuestionIdentifier><FreeText>Let's get married.</FreeText></Answer><Answer><QuestionIdentifier>response91</QuestionIdentifier><FreeText>I do care about what I do.</FreeText></Answer><Answer><QuestionIdentifier>response92</QuestionIdentifier><FreeText>If I were paid more, I would care more.</FreeText></Answer><Answer><QuestionIdentifier>response93</QuestionIdentifier><FreeText>This job sucks.</FreeText></Answer><Answer><QuestionIdentifier>response94</QuestionIdentifier><FreeText>I'm quitting; I just don't care enough.</FreeText></Answer><Answer><QuestionIdentifier>response95</QuestionIdentifier><FreeText>We deserve better.</FreeText></Answer></QuestionFormAnswers>",What truth?,Kiddie porn?  You're disgusting.,I can't talk to someone like you.,What are you talking about?,Are you a sex offender?!,You can make time.  I really need your help!,I don't understand why you're not willing to help me.,I thought we were friends?,Why are you saying we're out of time?,I didn't kill my girlfriend!,What are you up for?,Leave me alone.,I said it's none of you business.,Leave me alone.,I'll talk to you about this later.,It did happen.,It didn't happen.,I don't know what you're talking about.,I said I didn't know.,Let's not talk about this right now.,I am very good.,It is a nice house.  I live very well.,I'm a great shaman.  Not a medicine man.,I have healed many people.,Shamans make good money.,There wasn't any dope in the diaper!,I would never put dope in a diaper.  Gross.,I don't know what you're talking about.,Who puts dope in a diaper?,Ew.  Why would you ask that?,I don't know where it is.,It's not to big for me.,I don't know where the sub is going.,Where is what?,What are you talking about?,"Okay, well hurry up please.",We can't hold up dinner for you.,Please hurry; I'm hungry.,"We're all starving, hurry!",We're starting without you.,As I should be.  I'm awesome.,I love you.,I dream of you too.,You're so wonderful.,Let's get married.,I do care about what I do.,"If I were paid more, I would care more.",This job sucks.,I'm quitting; I just don't care enough.,We deserve better.
35DR22AR5DKFOHFQ31LUPRBXZPDX36,A3GNQDFPZALU92,3PCPFX4U40QO9CXEBGM3888CIUWQFD,Submitted,2019-06-21 12:39:35-04:00,NA,2019-06-19 12:30:43-04:00,2019-06-19 12:39:35-04:00,"<?xml version=""1.0"" encoding=""ASCII""?><QuestionFormAnswers xmlns=""http://mechanicalturk.amazonaws.com/AWSMechanicalTurkDataSchemas/2005-10-01/QuestionFormAnswers.xsd""><Answer><QuestionIdentifier>response101</QuestionIdentifier><FreeText>I hope that's what it is and I hope you're not trying to mislead me.</FreeText></Answer><Answer><QuestionIdentifier>response102</QuestionIdentifier><FreeText>Why should I trust you? Give me a reason.</FreeText></Answer><Answer><QuestionIdentifier>response103</QuestionIdentifier><FreeText>What is the truth? When were planning to tell me?</FreeText></Answer><Answer><QuestionIdentifier>response11</QuestionIdentifier><FreeText>Won't you help me, though?</FreeText></Answer><Answer><QuestionIdentifier>response12</QuestionIdentifier><FreeText>You don't know me at all, that's all I can say.</FreeText></Answer><Answer><QuestionIdentifier>response21</QuestionIdentifier><FreeText>Sounds good to me, I'll admit.</FreeText></Answer><Answer><QuestionIdentifier>response22</QuestionIdentifier><FreeText>I would appreciate the help.</FreeText></Answer><Answer><QuestionIdentifier>response31</QuestionIdentifier><FreeText>I think so. I'm not sure what I'm seeing.</FreeText></Answer><Answer><QuestionIdentifier>response32</QuestionIdentifier><FreeText>I don't believe it, even though I saw it with my own eyes.</FreeText></Answer><Answer><QuestionIdentifier>response33</QuestionIdentifier><FreeText>Perhaps. I don't want to jump to any conclusions.</FreeText></Answer><Answer><QuestionIdentifier>response41</QuestionIdentifier><FreeText>I have my moments.</FreeText></Answer><Answer><QuestionIdentifier>response42</QuestionIdentifier><FreeText>I am good, that's for sure.</FreeText></Answer><Answer><QuestionIdentifier>response43</QuestionIdentifier><FreeText>I guess, it's hard to judge shamanic abilities.</FreeText></Answer><Answer><QuestionIdentifier>response51</QuestionIdentifier><FreeText>I am not sure what you're talking about.</FreeText></Answer><Answer><QuestionIdentifier>response52</QuestionIdentifier><FreeText>It probably was, but who knows for sure?</FreeText></Answer><Answer><QuestionIdentifier>response53</QuestionIdentifier><FreeText>It definitely was, that's the only explanation.</FreeText></Answer><Answer><QuestionIdentifier>response61</QuestionIdentifier><FreeText>I'm not telling you unless you help me.</FreeText></Answer><Answer><QuestionIdentifier>response62</QuestionIdentifier><FreeText>Where do you think it is?</FreeText></Answer><Answer><QuestionIdentifier>response63</QuestionIdentifier><FreeText>I have no idea and there's no reason I should know.</FreeText></Answer><Answer><QuestionIdentifier>response71</QuestionIdentifier><FreeText>Well, hurry up, would you?</FreeText></Answer><Answer><QuestionIdentifier>response72</QuestionIdentifier><FreeText>How long until you get there?</FreeText></Answer><Answer><QuestionIdentifier>response73</QuestionIdentifier><FreeText>Are you lost or do you know where you are?</FreeText></Answer><Answer><QuestionIdentifier>response81</QuestionIdentifier><FreeText>I think you were lying to me.</FreeText></Answer><Answer><QuestionIdentifier>response82</QuestionIdentifier><FreeText>Did you mean it or were you laughing at me behind my back?</FreeText></Answer><Answer><QuestionIdentifier>response83</QuestionIdentifier><FreeText>It made me so happy when you said that.</FreeText></Answer><Answer><QuestionIdentifier>response91</QuestionIdentifier><FreeText>I do care, I don't know why you don't think I do.</FreeText></Answer><Answer><QuestionIdentifier>response92</QuestionIdentifier><FreeText>I don't care as much as you do, though, and that's the problem.</FreeText></Answer><Answer><QuestionIdentifier>response93</QuestionIdentifier><FreeText>I am trying, I really am trying.</FreeText></Answer></QuestionFormAnswers>",I hope that's what it is and I hope you're not trying to mislead me.,Why should I trust you? Give me a reason.,What is the truth? When were planning to tell me?,NA,NA,"Won't you help me, though?","You don't know me at all, that's all I can say.",NA,NA,NA,"Sounds good to me, I'll admit.",I would appreciate the help.,NA,NA,NA,I think so. I'm not sure what I'm seeing.,"I don't believe it, even though I saw it with my own eyes.",Perhaps. I don't want to jump to any conclusions.,NA,NA,I have my moments.,"I am good, that's for sure.","I guess, it's hard to judge shamanic abilities.",NA,NA,I am not sure what you're talking about.,"It probably was, but who knows for sure?","It definitely was, that's the only explanation.",NA,NA,I'm not telling you unless you help me.,Where do you think it is?,I have no idea and there's no reason I should know.,NA,NA,"Well, hurry up, would you?",How long until you get there?,Are you lost or do you know where you are?,NA,NA,I think you were lying to me.,Did you mean it or were you laughing at me behind my back?,It made me so happy when you said that.,NA,NA,"I do care, I don't know why you don't think I do.","I don't care as much as you do, though, and that's the problem.","I am trying, I really am trying.",NA,NA
3NAPMVF0ZWFWOKDGHO3RCITHRI927G,A9RIPO4QJ0Z04,3GITHABACYLJ5L8A7TFFKVJI4F52NJ,Submitted,2019-06-21 13:59:00-04:00,NA,2019-06-19 13:50:29-04:00,2019-06-19 13:59:00-04:00,"<?xml version=""1.0"" encoding=""ASCII""?><QuestionFormAnswers xmlns=""http://mechanicalturk.amazonaws.com/AWSMechanicalTurkDataSchemas/2005-10-01/QuestionFormAnswers.xsd""><Answer><QuestionIdentifier>response101</QuestionIdentifier><FreeText>I'll work at a hotel. </FreeText></Answer><Answer><QuestionIdentifier>response102</QuestionIdentifier><FreeText>I'll be a bartender.</FreeText></Answer><Answer><QuestionIdentifier>response103</QuestionIdentifier><FreeText>I'll stay at home. </FreeText></Answer><Answer><QuestionIdentifier>response104</QuestionIdentifier><FreeText>I'll raise the kids. </FreeText></Answer><Answer><QuestionIdentifier>response105</QuestionIdentifier><FreeText>I'll work with you. </FreeText></Answer><Answer><QuestionIdentifier>response11</QuestionIdentifier><FreeText>I think it did. </FreeText></Answer><Answer><QuestionIdentifier>response12</QuestionIdentifier><FreeText>I'm not sure.</FreeText></Answer><Answer><QuestionIdentifier>response13</QuestionIdentifier><FreeText>I don't think so.</FreeText></Answer><Answer><QuestionIdentifier>response14</QuestionIdentifier><FreeText>I didn't happen.</FreeText></Answer><Answer><QuestionIdentifier>response15</QuestionIdentifier><FreeText>It definitely happened.</FreeText></Answer><Answer><QuestionIdentifier>response21</QuestionIdentifier><FreeText>Who is this?</FreeText></Answer><Answer><QuestionIdentifier>response22</QuestionIdentifier><FreeText>What do you want?</FreeText></Answer><Answer><QuestionIdentifier>response23</QuestionIdentifier><FreeText>May I speak to the lady of the house?</FreeText></Answer><Answer><QuestionIdentifier>response24</QuestionIdentifier><FreeText>Is this Daryl?</FreeText></Answer><Answer><QuestionIdentifier>response25</QuestionIdentifier><FreeText>Why did you call me?</FreeText></Answer><Answer><QuestionIdentifier>response31</QuestionIdentifier><FreeText>Yes I am. </FreeText></Answer><Answer><QuestionIdentifier>response32</QuestionIdentifier><FreeText>No I'm not sorry. </FreeText></Answer><Answer><QuestionIdentifier>response33</QuestionIdentifier><FreeText>I'm actually a nursing assistant. </FreeText></Answer><Answer><QuestionIdentifier>response34</QuestionIdentifier><FreeText>I'm the nanny not the nurse.</FreeText></Answer><Answer><QuestionIdentifier>response35</QuestionIdentifier><FreeText>Who told you?</FreeText></Answer><Answer><QuestionIdentifier>response41</QuestionIdentifier><FreeText>Just like I said we would.</FreeText></Answer><Answer><QuestionIdentifier>response42</QuestionIdentifier><FreeText>There was nothing to worry about. </FreeText></Answer><Answer><QuestionIdentifier>response43</QuestionIdentifier><FreeText>Was that so bad?</FreeText></Answer><Answer><QuestionIdentifier>response44</QuestionIdentifier><FreeText>Are you glad you trusted me?</FreeText></Answer><Answer><QuestionIdentifier>response45</QuestionIdentifier><FreeText>Now we can keep going.</FreeText></Answer><Answer><QuestionIdentifier>response51</QuestionIdentifier><FreeText>I think they were professionals.</FreeText></Answer><Answer><QuestionIdentifier>response52</QuestionIdentifier><FreeText>Not sure who. </FreeText></Answer><Answer><QuestionIdentifier>response53</QuestionIdentifier><FreeText>It could have been anyone. </FreeText></Answer><Answer><QuestionIdentifier>response54</QuestionIdentifier><FreeText>Possibly one of the neighbors. </FreeText></Answer><Answer><QuestionIdentifier>response55</QuestionIdentifier><FreeText>Probably junkies needing a fix. </FreeText></Answer><Answer><QuestionIdentifier>response61</QuestionIdentifier><FreeText>Everything and anything about him. </FreeText></Answer><Answer><QuestionIdentifier>response62</QuestionIdentifier><FreeText>Just where he grew up. </FreeText></Answer><Answer><QuestionIdentifier>response63</QuestionIdentifier><FreeText>What he does for a living. </FreeText></Answer><Answer><QuestionIdentifier>response64</QuestionIdentifier><FreeText>When he met my mother.</FreeText></Answer><Answer><QuestionIdentifier>response65</QuestionIdentifier><FreeText>His medical history.</FreeText></Answer><Answer><QuestionIdentifier>response71</QuestionIdentifier><FreeText>We can only give her comfort at this point. </FreeText></Answer><Answer><QuestionIdentifier>response72</QuestionIdentifier><FreeText>Maybe we need a second opinion. </FreeText></Answer><Answer><QuestionIdentifier>response73</QuestionIdentifier><FreeText>Let's call the family to inform them. </FreeText></Answer><Answer><QuestionIdentifier>response74</QuestionIdentifier><FreeText>Well what did the doctor say?</FreeText></Answer><Answer><QuestionIdentifier>response75</QuestionIdentifier><FreeText>Can we contact some specialists?</FreeText></Answer><Answer><QuestionIdentifier>response81</QuestionIdentifier><FreeText>I'm not him but I know the guy. </FreeText></Answer><Answer><QuestionIdentifier>response82</QuestionIdentifier><FreeText>Why would you be looking for cars?</FreeText></Answer><Answer><QuestionIdentifier>response83</QuestionIdentifier><FreeText>I'm a bartender not a mechanic.</FreeText></Answer><Answer><QuestionIdentifier>response84</QuestionIdentifier><FreeText>Not sure where you would get those from.</FreeText></Answer><Answer><QuestionIdentifier>response85</QuestionIdentifier><FreeText>You sure you got enough money to be talking to me about that?</FreeText></Answer><Answer><QuestionIdentifier>response91</QuestionIdentifier><FreeText>Check and see.</FreeText></Answer><Answer><QuestionIdentifier>response92</QuestionIdentifier><FreeText>How bad is it?</FreeText></Answer><Answer><QuestionIdentifier>response93</QuestionIdentifier><FreeText>You need to be more careful?</FreeText></Answer><Answer><QuestionIdentifier>response94</QuestionIdentifier><FreeText>Why don't you pay more attention?</FreeText></Answer><Answer><QuestionIdentifier>response95</QuestionIdentifier><FreeText>Give it to me before you destroy it completely.</FreeText></Answer></QuestionFormAnswers>",I'll work at a hotel.,I'll be a bartender.,I'll stay at home.,I'll raise the kids.,I'll work with you.,I think it did.,I'm not sure.,I don't think so.,I didn't happen.,It definitely happened.,Who is this?,What do you want?,May I speak to the lady of the house?,Is this Daryl?,Why did you call me?,Yes I am.,No I'm not sorry.,I'm actually a nursing assistant.,I'm the nanny not the nurse.,Who told you?,Just like I said we would.,There was nothing to worry about.,Was that so bad?,Are you glad you trusted me?,Now we can keep going.,I think they were professionals.,Not sure who.,It could have been anyone.,Possibly one of the neighbors.,Probably junkies needing a fix.,Everything and anything about him.,Just where he grew up.,What he does for a living.,When he met my mother.,His medical history.,We can only give her comfort at this point.,Maybe we need a second opinion.,Let's call the family to inform them.,Well what did the doctor say?,Can we contact some specialists?,I'm not him but I know the guy.,Why would you be looking for cars?,I'm a bartender not a mechanic.,Not sure where you would get those from.,You sure you got enough money to be talking to me about that?,Check and see.,How bad is it?,You need to be more careful?,Why don't you pay more attention?,Give it to me before you destroy it completely.
