AssignmentId,WorkerId,HITId,AssignmentStatus,AutoApprovalTime,ApprovalTime,AcceptTime,SubmitTime,Answer,response101,response102,response103,response104,response105,response11,response12,response13,response14,response15,response21,response22,response23,response24,response25,response31,response32,response33,response34,response35,response41,response42,response43,response44,response45,response51,response52,response53,response54,response55,response61,response62,response63,response64,response65,response71,response72,response73,response74,response75,response81,response82,response83,response84,response85,response91,response92,response93,response94,response95
3Z4AIRP3C6DJEE1BGX7B1YW015Z1XI,A3HL2LL0LEPZT8,3BKZLF990ZZU93E9G6ERXTFSO5MYQI,Submitted,2019-06-21 12:43:45-04:00,NA,2019-06-19 12:26:18-04:00,2019-06-19 12:43:45-04:00,"<?xml version=""1.0"" encoding=""ASCII""?><QuestionFormAnswers xmlns=""http://mechanicalturk.amazonaws.com/AWSMechanicalTurkDataSchemas/2005-10-01/QuestionFormAnswers.xsd""><Answer><QuestionIdentifier>response101</QuestionIdentifier><FreeText>I help the community and they repay me.</FreeText></Answer><Answer><QuestionIdentifier>response102</QuestionIdentifier><FreeText>I'm the only one here.</FreeText></Answer><Answer><QuestionIdentifier>response103</QuestionIdentifier><FreeText>I'm not interested in helping you.</FreeText></Answer><Answer><QuestionIdentifier>response104</QuestionIdentifier><FreeText>It would be a nicer house if you left.</FreeText></Answer><Answer><QuestionIdentifier>response105</QuestionIdentifier><FreeText>I'm the best in this land.</FreeText></Answer><Answer><QuestionIdentifier>response11</QuestionIdentifier><FreeText>I'm not giving you my vehicle.</FreeText></Answer><Answer><QuestionIdentifier>response12</QuestionIdentifier><FreeText>Okay, I'm getting out.</FreeText></Answer><Answer><QuestionIdentifier>response13</QuestionIdentifier><FreeText>You owe me for this car.</FreeText></Answer><Answer><QuestionIdentifier>response14</QuestionIdentifier><FreeText>Why don't you go get your own car.</FreeText></Answer><Answer><QuestionIdentifier>response15</QuestionIdentifier><FreeText>You can have it over my dead body.</FreeText></Answer><Answer><QuestionIdentifier>response21</QuestionIdentifier><FreeText>You have a good point about that.</FreeText></Answer><Answer><QuestionIdentifier>response22</QuestionIdentifier><FreeText>You are the best psycho they have.</FreeText></Answer><Answer><QuestionIdentifier>response23</QuestionIdentifier><FreeText>Well you're their psycho now.</FreeText></Answer><Answer><QuestionIdentifier>response24</QuestionIdentifier><FreeText>And I'm sure they look forward to what you will bring them.</FreeText></Answer><Answer><QuestionIdentifier>response25</QuestionIdentifier><FreeText>The government is straight up crazy.</FreeText></Answer><Answer><QuestionIdentifier>response31</QuestionIdentifier><FreeText>The horse is yours now that you're here.</FreeText></Answer><Answer><QuestionIdentifier>response32</QuestionIdentifier><FreeText>It's a good horse.</FreeText></Answer><Answer><QuestionIdentifier>response33</QuestionIdentifier><FreeText>It's a pity the horse died.</FreeText></Answer><Answer><QuestionIdentifier>response34</QuestionIdentifier><FreeText>Your granddaughter has a fine horse.</FreeText></Answer><Answer><QuestionIdentifier>response35</QuestionIdentifier><FreeText>It was a special horse.</FreeText></Answer><Answer><QuestionIdentifier>response41</QuestionIdentifier><FreeText>Plunges aren't for me either.</FreeText></Answer><Answer><QuestionIdentifier>response42</QuestionIdentifier><FreeText>A plunge to my death.</FreeText></Answer><Answer><QuestionIdentifier>response43</QuestionIdentifier><FreeText>That's not convincing me.</FreeText></Answer><Answer><QuestionIdentifier>response44</QuestionIdentifier><FreeText>I'm sticking to sailing.</FreeText></Answer><Answer><QuestionIdentifier>response45</QuestionIdentifier><FreeText>I'm in if you need someone to sail.</FreeText></Answer><Answer><QuestionIdentifier>response51</QuestionIdentifier><FreeText>I meet the most fabulous people.</FreeText></Answer><Answer><QuestionIdentifier>response52</QuestionIdentifier><FreeText>I wouldn't quite say they're fabulous.</FreeText></Answer><Answer><QuestionIdentifier>response53</QuestionIdentifier><FreeText>I wish I would meet anyone fabulous.</FreeText></Answer><Answer><QuestionIdentifier>response54</QuestionIdentifier><FreeText>No, that would be wrong.</FreeText></Answer><Answer><QuestionIdentifier>response55</QuestionIdentifier><FreeText>Fascinating would be one was to describe it.</FreeText></Answer><Answer><QuestionIdentifier>response61</QuestionIdentifier><FreeText>That's great, finally progress.</FreeText></Answer><Answer><QuestionIdentifier>response62</QuestionIdentifier><FreeText>Keep working hard, we really need this.</FreeText></Answer><Answer><QuestionIdentifier>response63</QuestionIdentifier><FreeText>Maybe isn't good enough.</FreeText></Answer><Answer><QuestionIdentifier>response64</QuestionIdentifier><FreeText>Tell me when you've fully cracked it.</FreeText></Answer><Answer><QuestionIdentifier>response65</QuestionIdentifier><FreeText>Tell me if you need anything.</FreeText></Answer><Answer><QuestionIdentifier>response71</QuestionIdentifier><FreeText>Yes, that would be an ideal spot to shoot him.</FreeText></Answer><Answer><QuestionIdentifier>response72</QuestionIdentifier><FreeText>No, in the head.</FreeText></Answer><Answer><QuestionIdentifier>response73</QuestionIdentifier><FreeText>Wait, don't shoot him.</FreeText></Answer><Answer><QuestionIdentifier>response74</QuestionIdentifier><FreeText>In the leg, in the chest, it doesn't matter.</FreeText></Answer><Answer><QuestionIdentifier>response75</QuestionIdentifier><FreeText>Shoot him in the hand, not the leg.</FreeText></Answer><Answer><QuestionIdentifier>response81</QuestionIdentifier><FreeText>That's a tough place to investigate a murder.</FreeText></Answer><Answer><QuestionIdentifier>response82</QuestionIdentifier><FreeText>Who was murdered?</FreeText></Answer><Answer><QuestionIdentifier>response83</QuestionIdentifier><FreeText>Let me know if you need help with that.</FreeText></Answer><Answer><QuestionIdentifier>response84</QuestionIdentifier><FreeText>I wouldn't put one foot in that place.</FreeText></Answer><Answer><QuestionIdentifier>response85</QuestionIdentifier><FreeText>Can't say that I envy you. </FreeText></Answer><Answer><QuestionIdentifier>response91</QuestionIdentifier><FreeText>Sponsorship? I'll take it.</FreeText></Answer><Answer><QuestionIdentifier>response92</QuestionIdentifier><FreeText>I'm not interested in you being my sponsor.</FreeText></Answer><Answer><QuestionIdentifier>response93</QuestionIdentifier><FreeText>Now you're talking, tell me more about it.</FreeText></Answer><Answer><QuestionIdentifier>response94</QuestionIdentifier><FreeText>Sorry, I think your products suck.</FreeText></Answer><Answer><QuestionIdentifier>response95</QuestionIdentifier><FreeText>You guys just can't keep away from me can you?</FreeText></Answer></QuestionFormAnswers>",I help the community and they repay me.,I'm the only one here.,I'm not interested in helping you.,It would be a nicer house if you left.,I'm the best in this land.,I'm not giving you my vehicle.,"Okay, I'm getting out.",You owe me for this car.,Why don't you go get your own car.,You can have it over my dead body.,You have a good point about that.,You are the best psycho they have.,Well you're their psycho now.,And I'm sure they look forward to what you will bring them.,The government is straight up crazy.,The horse is yours now that you're here.,It's a good horse.,It's a pity the horse died.,Your granddaughter has a fine horse.,It was a special horse.,Plunges aren't for me either.,A plunge to my death.,That's not convincing me.,I'm sticking to sailing.,I'm in if you need someone to sail.,I meet the most fabulous people.,I wouldn't quite say they're fabulous.,I wish I would meet anyone fabulous.,"No, that would be wrong.",Fascinating would be one was to describe it.,"That's great, finally progress.","Keep working hard, we really need this.",Maybe isn't good enough.,Tell me when you've fully cracked it.,Tell me if you need anything.,"Yes, that would be an ideal spot to shoot him.","No, in the head.","Wait, don't shoot him.","In the leg, in the chest, it doesn't matter.","Shoot him in the hand, not the leg.",That's a tough place to investigate a murder.,Who was murdered?,Let me know if you need help with that.,I wouldn't put one foot in that place.,Can't say that I envy you.,Sponsorship? I'll take it.,I'm not interested in you being my sponsor.,"Now you're talking, tell me more about it.","Sorry, I think your products suck.",You guys just can't keep away from me can you?
3T111IHZ5EQH6NIUBBGCRMSVY049R5,AO6B0VEVBGGAP,38Z7YZ2SB328J3Z4COSOB5L4YMOQI4,Submitted,2019-06-21 12:55:40-04:00,NA,2019-06-19 12:45:40-04:00,2019-06-19 12:55:40-04:00,"<?xml version=""1.0"" encoding=""ASCII""?><QuestionFormAnswers xmlns=""http://mechanicalturk.amazonaws.com/AWSMechanicalTurkDataSchemas/2005-10-01/QuestionFormAnswers.xsd""><Answer><QuestionIdentifier>response101</QuestionIdentifier><FreeText>fair trade</FreeText></Answer><Answer><QuestionIdentifier>response102</QuestionIdentifier><FreeText>no, never</FreeText></Answer><Answer><QuestionIdentifier>response103</QuestionIdentifier><FreeText>these are mine</FreeText></Answer><Answer><QuestionIdentifier>response104</QuestionIdentifier><FreeText>you stole them from me</FreeText></Answer><Answer><QuestionIdentifier>response105</QuestionIdentifier><FreeText>well you are not getting your dog back</FreeText></Answer><Answer><QuestionIdentifier>response11</QuestionIdentifier><FreeText>i would love some brandy</FreeText></Answer><Answer><QuestionIdentifier>response12</QuestionIdentifier><FreeText>i am up for a celebration</FreeText></Answer><Answer><QuestionIdentifier>response13</QuestionIdentifier><FreeText>sure.  what kind of brandy?</FreeText></Answer><Answer><QuestionIdentifier>response14</QuestionIdentifier><FreeText>that would be nice</FreeText></Answer><Answer><QuestionIdentifier>response15</QuestionIdentifier><FreeText>super.  i am a cardinal's fan too</FreeText></Answer><Answer><QuestionIdentifier>response21</QuestionIdentifier><FreeText>where did i put my toothbrush</FreeText></Answer><Answer><QuestionIdentifier>response22</QuestionIdentifier><FreeText>i'm so forgetful.</FreeText></Answer><Answer><QuestionIdentifier>response23</QuestionIdentifier><FreeText>how did i misplace my toothbrush?</FreeText></Answer><Answer><QuestionIdentifier>response24</QuestionIdentifier><FreeText>this sucks</FreeText></Answer><Answer><QuestionIdentifier>response25</QuestionIdentifier><FreeText>now i have to buy yet another one</FreeText></Answer><Answer><QuestionIdentifier>response31</QuestionIdentifier><FreeText>he's still his teens</FreeText></Answer><Answer><QuestionIdentifier>response32</QuestionIdentifier><FreeText>he's your sister's age</FreeText></Answer><Answer><QuestionIdentifier>response33</QuestionIdentifier><FreeText>i think he's in sophmore in high school</FreeText></Answer><Answer><QuestionIdentifier>response34</QuestionIdentifier><FreeText>not really sure</FreeText></Answer><Answer><QuestionIdentifier>response35</QuestionIdentifier><FreeText>he can't be older than your brother</FreeText></Answer><Answer><QuestionIdentifier>response41</QuestionIdentifier><FreeText>we should take the chairs with us</FreeText></Answer><Answer><QuestionIdentifier>response42</QuestionIdentifier><FreeText>leave the chairs</FreeText></Answer><Answer><QuestionIdentifier>response43</QuestionIdentifier><FreeText>the chairs will get in the way</FreeText></Answer><Answer><QuestionIdentifier>response44</QuestionIdentifier><FreeText>the chairs are a hassle</FreeText></Answer><Answer><QuestionIdentifier>response45</QuestionIdentifier><FreeText>the chairs would be useful</FreeText></Answer><Answer><QuestionIdentifier>response51</QuestionIdentifier><FreeText>he wants attention</FreeText></Answer><Answer><QuestionIdentifier>response52</QuestionIdentifier><FreeText>what a waste of a life</FreeText></Answer><Answer><QuestionIdentifier>response53</QuestionIdentifier><FreeText>easy target</FreeText></Answer><Answer><QuestionIdentifier>response54</QuestionIdentifier><FreeText>yet another bombing</FreeText></Answer><Answer><QuestionIdentifier>response55</QuestionIdentifier><FreeText>so much violence</FreeText></Answer><Answer><QuestionIdentifier>response61</QuestionIdentifier><FreeText>what are we arguing about</FreeText></Answer><Answer><QuestionIdentifier>response62</QuestionIdentifier><FreeText>i mean it how i mean it</FreeText></Answer><Answer><QuestionIdentifier>response63</QuestionIdentifier><FreeText>why does it matter</FreeText></Answer><Answer><QuestionIdentifier>response64</QuestionIdentifier><FreeText>let's move onto something else</FreeText></Answer><Answer><QuestionIdentifier>response65</QuestionIdentifier><FreeText>what are you doing tomorrow</FreeText></Answer><Answer><QuestionIdentifier>response71</QuestionIdentifier><FreeText>i've play pool a few times</FreeText></Answer><Answer><QuestionIdentifier>response72</QuestionIdentifier><FreeText>not great but i can manage</FreeText></Answer><Answer><QuestionIdentifier>response73</QuestionIdentifier><FreeText>you wanna play?</FreeText></Answer><Answer><QuestionIdentifier>response74</QuestionIdentifier><FreeText>i have't played in a while</FreeText></Answer><Answer><QuestionIdentifier>response75</QuestionIdentifier><FreeText>sure.  sounds fun</FreeText></Answer><Answer><QuestionIdentifier>response81</QuestionIdentifier><FreeText>it's not that hard</FreeText></Answer><Answer><QuestionIdentifier>response82</QuestionIdentifier><FreeText>when you do, let me know</FreeText></Answer><Answer><QuestionIdentifier>response83</QuestionIdentifier><FreeText>i am wondering if you will get what i got</FreeText></Answer><Answer><QuestionIdentifier>response84</QuestionIdentifier><FreeText>i hope i like it</FreeText></Answer><Answer><QuestionIdentifier>response85</QuestionIdentifier><FreeText>you will like it</FreeText></Answer><Answer><QuestionIdentifier>response91</QuestionIdentifier><FreeText>yes</FreeText></Answer><Answer><QuestionIdentifier>response92</QuestionIdentifier><FreeText>no in the chest</FreeText></Answer><Answer><QuestionIdentifier>response93</QuestionIdentifier><FreeText>make sure it's lethal</FreeText></Answer><Answer><QuestionIdentifier>response94</QuestionIdentifier><FreeText>yes wherever just disable him</FreeText></Answer><Answer><QuestionIdentifier>response95</QuestionIdentifier><FreeText>yes shoot and run</FreeText></Answer></QuestionFormAnswers>",fair trade,"no, never",these are mine,you stole them from me,well you are not getting your dog back,i would love some brandy,i am up for a celebration,sure.  what kind of brandy?,that would be nice,super.  i am a cardinal's fan too,where did i put my toothbrush,i'm so forgetful.,how did i misplace my toothbrush?,this sucks,now i have to buy yet another one,he's still his teens,he's your sister's age,i think he's in sophmore in high school,not really sure,he can't be older than your brother,we should take the chairs with us,leave the chairs,the chairs will get in the way,the chairs are a hassle,the chairs would be useful,he wants attention,what a waste of a life,easy target,yet another bombing,so much violence,what are we arguing about,i mean it how i mean it,why does it matter,let's move onto something else,what are you doing tomorrow,i've play pool a few times,not great but i can manage,you wanna play?,i have't played in a while,sure.  sounds fun,it's not that hard,"when you do, let me know",i am wondering if you will get what i got,i hope i like it,you will like it,yes,no in the chest,make sure it's lethal,yes wherever just disable him,yes shoot and run
3T3IWE1XG6N0E1C8W2WTDWJ2WLFQTV,AHQ4XY8PP5EGS,38Z7YZ2SB328J3Z4COSOB5L4YMOQI4,Submitted,2019-06-21 14:15:59-04:00,NA,2019-06-19 14:07:19-04:00,2019-06-19 14:15:59-04:00,"<?xml version=""1.0"" encoding=""ASCII""?><QuestionFormAnswers xmlns=""http://mechanicalturk.amazonaws.com/AWSMechanicalTurkDataSchemas/2005-10-01/QuestionFormAnswers.xsd""><Answer><QuestionIdentifier>response101</QuestionIdentifier><FreeText>Fine, it's a deal.</FreeText></Answer><Answer><QuestionIdentifier>response102</QuestionIdentifier><FreeText>I won't be blackmailed. I refuse.</FreeText></Answer><Answer><QuestionIdentifier>response103</QuestionIdentifier><FreeText>Wait, that's not my dog. </FreeText></Answer><Answer><QuestionIdentifier>response104</QuestionIdentifier><FreeText>I didn't take the slippers!</FreeText></Answer><Answer><QuestionIdentifier>response105</QuestionIdentifier><FreeText>I'm sorry I lost them, how about these shoes instead?</FreeText></Answer><Answer><QuestionIdentifier>response11</QuestionIdentifier><FreeText>Come with us, you are under arrest.</FreeText></Answer><Answer><QuestionIdentifier>response12</QuestionIdentifier><FreeText>Just one, and only becuase it is for the cardinal. Then it's off to jail with you.</FreeText></Answer><Answer><QuestionIdentifier>response21</QuestionIdentifier><FreeText>I'm sorry, I forgot that I dropped it. </FreeText></Answer><Answer><QuestionIdentifier>response22</QuestionIdentifier><FreeText>I suppose you should buy a new one then?</FreeText></Answer><Answer><QuestionIdentifier>response23</QuestionIdentifier><FreeText>Maybe you forgot it at the hotel?</FreeText></Answer><Answer><QuestionIdentifier>response24</QuestionIdentifier><FreeText>You can use mine, but that would be pretty gross. I suggest ordering a new one online.</FreeText></Answer><Answer><QuestionIdentifier>response25</QuestionIdentifier><FreeText>Use extra mouthwash then, I don't know what to tell you.</FreeText></Answer><Answer><QuestionIdentifier>response31</QuestionIdentifier><FreeText>He's 5.</FreeText></Answer><Answer><QuestionIdentifier>response32</QuestionIdentifier><FreeText>He's 40 actually, more like a brother to me.</FreeText></Answer><Answer><QuestionIdentifier>response33</QuestionIdentifier><FreeText>I don't know, we've been pretty out of touch.</FreeText></Answer><Answer><QuestionIdentifier>response34</QuestionIdentifier><FreeText>He's 12. Can I borrow some toys? I don't have any.</FreeText></Answer><Answer><QuestionIdentifier>response35</QuestionIdentifier><FreeText>He's going to be 21 in July. I'm pretty excited to be able to have a drink with the guy.</FreeText></Answer><Answer><QuestionIdentifier>response41</QuestionIdentifier><FreeText>Bring them all, we'll need them.</FreeText></Answer><Answer><QuestionIdentifier>response42</QuestionIdentifier><FreeText>Don't worry about them, there will be some there.</FreeText></Answer><Answer><QuestionIdentifier>response43</QuestionIdentifier><FreeText>I don't care, however many you want to bring.</FreeText></Answer><Answer><QuestionIdentifier>response44</QuestionIdentifier><FreeText>It's a marathon, we don't need chairs for that.</FreeText></Answer><Answer><QuestionIdentifier>response45</QuestionIdentifier><FreeText>Which ones, the armchairs or kitchen chairs?</FreeText></Answer><Answer><QuestionIdentifier>response51</QuestionIdentifier><FreeText>I don't believe that for a second.</FreeText></Answer><Answer><QuestionIdentifier>response52</QuestionIdentifier><FreeText>That makes sense I guess, but what about the back entrance.</FreeText></Answer><Answer><QuestionIdentifier>response53</QuestionIdentifier><FreeText>They could have used a remote detonator. </FreeText></Answer><Answer><QuestionIdentifier>response61</QuestionIdentifier><FreeText>Maybe? I'm not a psychologist.</FreeText></Answer><Answer><QuestionIdentifier>response62</QuestionIdentifier><FreeText>I guess you're right, I think I did.</FreeText></Answer><Answer><QuestionIdentifier>response63</QuestionIdentifier><FreeText>Stop telling me what to think. That's rude.</FreeText></Answer><Answer><QuestionIdentifier>response64</QuestionIdentifier><FreeText>I'm hanging up, don't call me again.</FreeText></Answer><Answer><QuestionIdentifier>response71</QuestionIdentifier><FreeText>I'm not very good but I know how.</FreeText></Answer><Answer><QuestionIdentifier>response72</QuestionIdentifier><FreeText>I've never played but I guess I could try.</FreeText></Answer><Answer><QuestionIdentifier>response73</QuestionIdentifier><FreeText>How did you know? I'm top in the state at pool.</FreeText></Answer><Answer><QuestionIdentifier>response74</QuestionIdentifier><FreeText>No, will you teach me? It sounds like it's important.</FreeText></Answer><Answer><QuestionIdentifier>response81</QuestionIdentifier><FreeText>I guess so, we'll see.</FreeText></Answer><Answer><QuestionIdentifier>response82</QuestionIdentifier><FreeText>Fine, if you insist.</FreeText></Answer><Answer><QuestionIdentifier>response83</QuestionIdentifier><FreeText>No. I will not. Don't yell at me.</FreeText></Answer><Answer><QuestionIdentifier>response91</QuestionIdentifier><FreeText>I don't have a gun, give me one.</FreeText></Answer><Answer><QuestionIdentifier>response92</QuestionIdentifier><FreeText>Why not the body? Harder to miss.</FreeText></Answer><Answer><QuestionIdentifier>response93</QuestionIdentifier><FreeText>Okay, but I need bullets.</FreeText></Answer><Answer><QuestionIdentifier>response94</QuestionIdentifier><FreeText>I did it, now what do you want me to do?</FreeText></Answer></QuestionFormAnswers>","Fine, it's a deal.",I won't be blackmailed. I refuse.,"Wait, that's not my dog.",I didn't take the slippers!,"I'm sorry I lost them, how about these shoes instead?","Come with us, you are under arrest.","Just one, and only becuase it is for the cardinal. Then it's off to jail with you.",NA,NA,NA,"I'm sorry, I forgot that I dropped it.",I suppose you should buy a new one then?,Maybe you forgot it at the hotel?,"You can use mine, but that would be pretty gross. I suggest ordering a new one online.","Use extra mouthwash then, I don't know what to tell you.",He's 5.,"He's 40 actually, more like a brother to me.","I don't know, we've been pretty out of touch.",He's 12. Can I borrow some toys? I don't have any.,He's going to be 21 in July. I'm pretty excited to be able to have a drink with the guy.,"Bring them all, we'll need them.","Don't worry about them, there will be some there.","I don't care, however many you want to bring.","It's a marathon, we don't need chairs for that.","Which ones, the armchairs or kitchen chairs?",I don't believe that for a second.,"That makes sense I guess, but what about the back entrance.",They could have used a remote detonator.,NA,NA,Maybe? I'm not a psychologist.,"I guess you're right, I think I did.",Stop telling me what to think. That's rude.,"I'm hanging up, don't call me again.",NA,I'm not very good but I know how.,I've never played but I guess I could try.,How did you know? I'm top in the state at pool.,"No, will you teach me? It sounds like it's important.",NA,"I guess so, we'll see.","Fine, if you insist.",No. I will not. Don't yell at me.,NA,NA,"I don't have a gun, give me one.",Why not the body? Harder to miss.,"Okay, but I need bullets.","I did it, now what do you want me to do?",NA
